ticker,datetime,title,summary,url,source,category
NVDA,2025-11-13 20:11:46+00:00,Dow Sinks 750 Points as Selloff Continues to Broaden Beyond Tech,"The AI stock rally and a December rate cut both seemed like sure things not so long ago, but both assumptions were being tested on Thursday. The Nasdaq Composite was down 2.5%. The S&P 500 was down 1.",https://finnhub.io/api/news?id=3f0288b26e1ae13e1621a42dbf31f2d20b2f4a2e18c16902e348c6e94d3f1fc8,Yahoo,company
NVDA,2025-11-13 20:06:25+00:00,"Nvidia Earnings: AI Valuation Vs. Long-Term Driver On Watch, Fund Chief Says; Is Nvidia A Buy Now?","Nvidia  fell Thursday, as investors continued to weigh whether valuations are too high for artificial intelligence stocks, a persistent concern even as corporate updates and Nvidia's chief executive have signaled strong demand for AI technology and chips.  Is Nvidia stock a buy or sell now?  In a key event, Nvidia's third-quarter results are due Nov. 19.",https://finnhub.io/api/news?id=e785ded77b9469aaffa15f78e5fc90abfca234476967119ffa15a1ad4c96ffb2,Yahoo,company
NVDA,2025-11-13 20:06:00+00:00,"AI DEVELOPERS FROM AROUND THE WORLD INVITED BY MILESTONE TO INNOVATE ON SAFER, MORE EFFICIENT VIDEO SURVEILLANCE","The Milestone Developer Summit 2025, dedicated to innovators, developers, and technology partners in video technology, took place at the historic Carlsberg Museum in Copenhagen—a venue renowned for scientific breakthroughs, including the invention of the pH enzyme, a milestone in biochemical innovation. This legacy of discovery provided the perfect global stage for a new era of open platform development, responsible AI, and, not least, the Hackathon.",https://finnhub.io/api/news?id=cc72beee7306a1bedf935e9cd149359f41ae4da53503f7e4774e9c4d5b5e82ab,Yahoo,company
NVDA,2025-11-13 19:37:20+00:00,Nvidia Earnings Seen As Key To Reviving AI Stock Trade,"AI stocks have pulled back recently on bubble concerns, which has raised the stakes for Nvidia's upcoming earnings report.",https://finnhub.io/api/news?id=4dac1806c000eff74d5ab8d23b8dd42c2057c0f9b4fdf78e5eafbaf1b2317a00,Yahoo,company
NVDA,2025-11-13 19:03:05+00:00,Radcom Ltd (RDCM) Q3 2025 Earnings Call Highlights: Record Revenue and Strategic Partnerships ...,"Radcom Ltd (RDCM) reports a 16.2% revenue increase and strengthens its market position through strategic alliances, despite challenges in immediate financial gains.",https://finnhub.io/api/news?id=ecda6c28d90a5de5b7bd85d03ca4d9780816eca26a41d56574a56cdea8fa4095,Yahoo,company
NVDA,2025-11-13 19:01:03+00:00,"MACOM, Nvidia, Amtech, Semtech, and Nova Shares Are Falling, What You Need To Know","A number of stocks fell in the afternoon session after markets continued to retreat, as investors re-evaluated the high valuations of stocks that benefited from the artificial intelligence boom.",https://finnhub.io/api/news?id=3732f7ada9d1cc796ef6df3eb12cfca6b7642f9527a54c7d913a1e1004ccbf11,Yahoo,company
NVDA,2025-11-13 18:25:27+00:00,Baidu's 2.4 Trillion-Parameter AI Bombshell: China's Answer to Nvidia?,"With homegrown chips and supernodes in sight, Baidu is rewriting the AI playbook--one trillion parameter at a time.",https://finnhub.io/api/news?id=1bb114167cb1111fe36d8b283cf51ea53b8767aa3dbf2e57ca011bc024206d73,Yahoo,company
NVDA,2025-11-13 18:24:29+00:00,Nvidia Pours $1 Billion Into Nokia -- AI and 6G Revolution Set to Accelerate,Next-Level Connectivity: Nvidia Teams With Nokia for AI-RAN and Data Centers,https://finnhub.io/api/news?id=74863380cba3dc869d457b09a40a84985c9976b022d826a4b5f110b00739dbc5,Yahoo,company
NVDA,2025-11-13 18:02:50+00:00,"Frank Sands Reduces Stake in DexCom Inc by 50.4%, Impacting Portfolio by -1.25%","Insightful Analysis of Frank Sands (Trades, Portfolio)' Third Quarter 2025 13F Filing",https://finnhub.io/api/news?id=28f2cb7098f78da59290e358b310cf84e440777efc8c22fae42e325c9fa63a91,Yahoo,company
NVDA,2025-11-13 18:01:27+00:00,Nvidia Q3 Earnings Preview: Robust Margins Met With A China Problem,"Nvidia Corporation's Q3 earnings outlook sees solid margins from Data Center growth, but rising competitive risks and China market issues. Click for my NVDA update.",https://finnhub.io/api/news?id=6eee9d1781a071bdd2d1a9ff27680958e57ad3d09810bfb6b50c77229c95eb06,SeekingAlpha,company
NVDA,2025-11-13 17:59:38+00:00,This Tech Stock Expert Just Got More Bullish About Nvidia Ahead of Earnings. Here's Why,"Oppenheimer analysts raised their price target for Nvidia's stock, saying they view the chipmaker as best positioned to ""win in AI.""",https://finnhub.io/api/news?id=7e184957cbf77285c0f2c07580f7513b3714fa87c82f2d7694436bf0e238efd6,Yahoo,company
NVDA,2025-11-13 17:54:32+00:00,"Disney drags the Dow lower, Starbucks workers on strike","Yahoo Finance Senior Reporter Brooke DiPalma, Yahoo Finance Senior Business Reporter Ines Ferré, and Yahoo Finance Senior Reporter Allie Canal take a look at Thursday's market action. Disney (DIS) is dragging the Dow Jones Industrial Average (^DJI) lower. NBC Universal (CMCSA) is launching a new sports network on Monday. Unionized Starbucks (SBUX) workers in over 40 cities are walking out on strike. Watch the video above to learn more of Thursday's trending headlines. For full interviews, highlights, and key insights, check out more from Yahoo Finance Invest.",https://finnhub.io/api/news?id=cbeaa8843f74df14d332af4052763352cfddb655da86fd4849e3a90033a4f862,Yahoo,company
NVDA,2025-11-13 17:45:24+00:00,AI boom or bubble? Top Wall Street voices map what's next,"Is AI a bubble or a generational boom? Yahoo Finance convenes Wedbush Securities managing director and global head of technology research Dan Ives, EMJ Capital founder and president Eric Jackson, and BlackRock Americas chief investment and portfolio strategist Gargi Chaudhuri to debate Nvidia (NVDA), Tesla (TSLA), OpenAI (OPAI.PVT), and how AI will reshape jobs, markets, and the next leg of the AI trade. For full interviews, highlights, and key insights, check out more from Yahoo Finance Invest.",https://finnhub.io/api/news?id=519bc8f689702f99cda6c3c96996ba438e346d607759605160a79be15cafe7fc,Yahoo,company
NVDA,2025-11-13 17:09:29+00:00,Jim Cramer on GSI Technology: “I Don’t Think It’s Worth Sticking Your Neck Out”,"GSI Technology, Inc. (NASDAQ:GSIT) is one of the stocks Jim Cramer recently put under a microscope. Cramer was bearish on the company stock during the episode. He said: “In the end, I simply can’t bring myself to endorse GSI Technology for you. As far as I can tell, the only truly positive news out of […]",https://finnhub.io/api/news?id=194052243254693eb8c2b491dadb8b8e87b3c1a68e6500fc805c293951b0b506,Yahoo,company
NVDA,2025-11-13 17:09:19+00:00,Jim Cramer Notes SoftBank’s Sale of Its NVIDIA Stake,"NVIDIA Corporation (NASDAQ:NVDA) is one of the stocks Jim Cramer recently put under a microscope. Cramer highlighted SoftBank’s sale of its stake in the company, as he stated: “I say own NVIDIA, don’t trade it. But we just learned that SoftBank, an outfit so rich I thought it could be meaningful to the AI buildout, […]",https://finnhub.io/api/news?id=cc2a5b38a4c9d92a4e96d9f3ef7b53df4c4da3208b7080eb93f3de18881a345f,Yahoo,company
NVDA,2025-11-13 16:45:57+00:00,"Jewelry Mogul Kendra Scott Built A $1 Billion Brand From $500 And A Baby In A Carrier — 'Failure Wasn't An Option,' She Said","Kendra Scott built a billion-dollar jewelry company from a bedroom with $500 and her newborn son in a carrier by her side. While she was pregnant, she began wiring stones by hand and realized the market didn't offer much between luxury pieces and cheap costume jewelry. ""Extra bedroom in my house, on a card table. 500 bucks, baby. That's it,"" she told James Dumoulin, host of ""The School of Hard Knocks"" podcast. Scott officially launched Kendra Scott LLC in 2002 despite having no retail background",https://finnhub.io/api/news?id=a00ab2a8b29d285a60c9d5e509cdb1ee7c0ec44d03bf5f8a7130a9723b357d69,Yahoo,company
NVDA,2025-11-13 16:45:02+00:00,"Quantum Computing Stocks: AMD, Qualcomm, IonQ Invest In Startup","Earnings reports for quantum computing stocks wind up on Friday. Startup Classiq's new funding round includes AMD, Qualcomm, IonQ.",https://finnhub.io/api/news?id=9e33d2c00a7730bbb5f96a402430fc94d478ee2dd6702bb1702c2ce4b51e11e4,Yahoo,company
NVDA,2025-11-13 16:44:30+00:00,"Nvidia, Palantir Put The 8 'Secrets' Of Selling In Focus. No. 2 Is Key.","As Wall Street watches the market wobble, Nvidia stock and Palantir put focus on rules for when to sell stocks.",https://finnhub.io/api/news?id=b9db9c265aa2f4ec9caaa55c012ce56ca3a81a27c7de6698af38c51c8b74f0f1,Yahoo,company
NVDA,2025-11-13 16:42:41+00:00,Why Nvidia's AI lead still looks unshakable,"Eric Jackson pushes back on the idea that Nvidia (NVDA) has peaked, arguing the chipmaker’s 25-year head start keeps it firmly in the driver’s seat even as AMD (AMD) and other rivals chase the next generation of AI hardware. He says Nvidia will remain essential as both infrastructure and applications scale, making it the clear leader for years to come. For full interviews, highlights, and key insights, check out more from Yahoo Finance Invest.",https://finnhub.io/api/news?id=bd0e3f2e63cb900c9a95fa27645c41371e1154ac5a5d547777b7fe0848c98c86,Yahoo,company
NVDA,2025-11-13 16:35:51+00:00,"Oracle (ORCL)’s Got To Find A Huge Amount Of Money,” Says Jim Cramer",We recently published Jim Cramer Discussed These 25 Stocks In An Important Show About AI Spending. Oracle Corp (NYSE:ORCL) is one of the stocks Jim Cramer recently discussed. Cramer and co-host David Faber spent quite some time discussing Oracle Corp (NYSE:ORCL) on the show. The firm is a key player in the ecosystem as it […],https://finnhub.io/api/news?id=e06949b57f42f61fa9aa756544732b62739a196fc08ce1d9ca1ad527aaef6adc,Yahoo,company
NVDA,2025-11-13 16:35:27+00:00,"Jim Cramer Discusses NVIDIA (NVDA) CEO’s Comments About US, China, And AI",We recently published Jim Cramer Discussed These 25 Stocks In An Important Show About AI Spending. NVIDIA Corporation (NASDAQ:NVDA) is one of the stocks Jim Cramer recently discussed. AI chip designer NVIDIA Corporation (NASDAQ:NVDA) was in the news last week after CEO Jensen Huang commented that the US was going to lose to China in […],https://finnhub.io/api/news?id=cfc093d82b4bea158afb907f8bf2e2e76a4413f63852aeb8bd9a96cea5399629,Yahoo,company
NVDA,2025-11-13 16:35:23+00:00,Nvidia Earnings Are Due Next Week. Here's One Possible Options Play.,"Here's an option trade that presumes Nvidia stock stays within an expected range after earnings, and the report is positive.",https://finnhub.io/api/news?id=e407f367a262cebdb0d2a88a29d80992f398c5134ac62736718f779f5a5e3d59,Yahoo,company
NVDA,2025-11-13 16:32:00+00:00,AMD Rides on Growing Data Center Footprint: Buy or Hold the Stock?,"Advanced Micro Devices projects a $1T data center market by 2030 and over 80% AI revenue CAGR, but valuation and NVIDIA rivalry test investor conviction.",https://finnhub.io/api/news?id=c7eb13087e51256c89b8293c602c52d28d0678230a674d4c922a759586dd778a,Yahoo,company
NVDA,2025-11-13 16:05:51+00:00,NVDA: Top Analysts Hike Nvidia Price Target Ahead of Key Earnings,"Top Analysts Increase Nvidia Targets, Investors Sell Into Strength",https://finnhub.io/api/news?id=f84cdbb2ab6d8081720af296d8d9de21e19a3c1409ef919eff3d0007f07ac3e2,Yahoo,company
NVDA,2025-11-13 16:03:31+00:00,"Nvidia Sees Upside to Q3 Estimates on AI Demand, Oppenheimer Says","Nvidia (NVDA) is set to report its fiscal Q3 earnings next Wednesday, with Oppenheimer seeing upside",https://finnhub.io/api/news?id=235c1fae91105c7259b051908b91e2c1af7f71a405b07be1eee2309d068a7e6f,Yahoo,company
NVDA,2025-11-13 15:52:10+00:00,"CoreWeave stock falls after The Verge labels it ""heart of AI bubble""","Investing.com -- CoreWeave Inc (NASDAQ:CRWV) shares dropped 6% Thursday following a report from The Verge that characterized the company as being at ""the heart of the AI bubble,"" raising questions about its business model and dependence on Nvidia.",https://finnhub.io/api/news?id=8e64702aee22b0c9cc8d7498000d08420844b38b77bf078fb68117f69ae6fea5,Yahoo,company
NVDA,2025-11-13 15:30:00+00:00,What Is One of the Best Artificial Intelligence (AI) Stocks to Own for the Next 5 Years?,This top chip supplier can help you profit from the AI boom.,https://finnhub.io/api/news?id=0ed924d299cadcca9047d1e25cd1b25356a4a65e0da8ddcea2c8b47d6beba240,Yahoo,company
NVDA,2025-11-13 15:16:21+00:00,The bull case for Tesla and Nvidia: Dan Ives explains,"Wedbush Securities managing director and global head of technology research, Dan Ives, talks about the bull cases for Tesla (TSLA) and Nvidia (NVDA), and what hour we're at in the artificial intelligence (AI) party. For full interviews, highlights, and key insights, check out more from Yahoo Finance Invest.",https://finnhub.io/api/news?id=cd69d07ad198102c304c9be85639689615d53503bc90996b5e6d3a0a3695e666,Yahoo,company
NVDA,2025-11-13 15:15:33+00:00,AI winner Ibiden sees its stock target lifted at Bernstein,"Investing.com -- Bernstein has raised its price target on Ibiden Co. Ltd. to ¥16,500 from ¥9,080, citing accelerating margin expansion from artificial intelligence (AI) demand and improving profitability in its semiconductor substrate business.",https://finnhub.io/api/news?id=2cacf518f4532901cd46c083c511e56386c8fc59e1a136cf0272bfe1ebaaec93,Yahoo,company
NVDA,2025-11-13 15:13:40+00:00,It's still early in the night at the AI party: Dan Ives,"Wedbush Securities managing director and global head of technology research, Dan Ives, breaks down where we're at in the current artificial intelligence (AI) cycle. ""It was 9 p.m. in that AI party. It's now 10:30 p.m., but that party goes to 4 a.m.,"" says Ives. Make sure to watch Yahoo Finance's full interview with Dan Ives. For full interviews, highlights, and key insights, check out more from Yahoo Finance Invest.",https://finnhub.io/api/news?id=150ec94f3b694535fcad35e3151656f6a4809fb9524eaa6f580d910f48ef9b0f,Yahoo,company
NVDA,2025-11-13 14:52:00+00:00,Are Declining Earnings Estimates an Indication to Avoid INTC Stock?,"Falling earnings estimates cloud Intel's outlook, even as AI chip launches and major investments aim to revive growth.",https://finnhub.io/api/news?id=674da1b44a1f97815808da8f4940b6deab8a9fabe8929beb44d2d71de8b15042,Yahoo,company
NVDA,2025-11-13 14:46:15+00:00,Wall Street Lunch: Michael Burry Waves Bye,"Michael Burry has wound up his hedge fund, Scion Asset Management, just days after making waves by betting against the AI trade.",https://finnhub.io/api/news?id=e0638aa2e754d60348626fec56894db69cbdb5a9b8b93e6b33d36702b3c71cf8,SeekingAlpha,company
NVDA,2025-11-13 13:43:54+00:00,"Michael Burry’s Scion Fund Is Deregistered, SEC Filing Shows","The change took place on Nov. 10, according to a filing on the SEC website.  Burry, who rose to fame for his 2008 bet against the US housing market, said in a social media post featuring a screenshot of the terminated status that he was “on to much better things Nov 25th.”  The hedge fund manager has previously warned about market exuberance, last month posting an image of his character from  movie and a warning that “sometimes, we see bubbles.”",https://finnhub.io/api/news?id=69925f87d4051fda5613a2dd0116ecf3c4542cdfa2cc558045b87beb0db08bcb,Yahoo,company
NVDA,2025-11-13 12:40:39+00:00,"NVIDIA Rejects $1 Billion Mexican AI Project Claim, Fuels Market Buzz","Tech Giant Nvidia Limits Role to AI Support, Rules Out Direct Investment",https://finnhub.io/api/news?id=222ffdc7bfed8f55e2812f8aeaa6e45ee3ab7ed929c73b947639229cc33d65f2,Yahoo,company
NVDA,2025-11-13 12:30:00+00:00,Directed share issuance to NVIDIA completed – a change in the total number of Nokia shares,"Nokia CorporationStock Exchange Release13 November 2025 at 14:30 EETDirected share issuance to NVIDIA completed – a change in the total number of Nokia shares Espoo, Finland – Following the completion of the directed share issuance to NVIDIA Corporation (“NVIDIA”), announced by Nokia Corporation (“Nokia”) on 28 October 2025, a total of 166 389 351 new Nokia shares (NOKIA) were today registered with the Finnish Trade Register and entered in the book-entry system maintained by Euroclear Finland Lt",https://finnhub.io/api/news?id=efa99875abc6cc0cee3da2da468e33a817fe53dbb8837ee845d9400fd919f8cd,Yahoo,company
NVDA,2025-11-13 12:08:00+00:00,Rigetti Computing's CEO Sent an $11 Million Warning to Wall Street,Subodh Kulkarni quietly made an interesting move in the wake of one share price surge -- and ahead of another.,https://finnhub.io/api/news?id=8e1b112621de7e3f694892ca30c6b59682b4de382d9b7b98740013c35a475d6f,Yahoo,company
NVDA,2025-11-13 12:01:09+00:00,"Inside Yahoo Finance Invest 2025: Elon Musk's $1 trillion pay package, crypto cracks, and AI bubbles","If you love investing or want to love investing, Yahoo Finance's annual Invest event is here to help!",https://finnhub.io/api/news?id=6e6e366ff24c14546c3b39a88cad2326b67197634b3af7b59bb83476b573a848,Yahoo,company
NVDA,2025-11-13 12:00:00+00:00,Should You Buy Nvidia Stock Hand Over Fist Before Nov. 19?,Nvidia has a ton of growth potential coming down the pipeline.,https://finnhub.io/api/news?id=0a142387d7bd40d241c4d3d7b86829050209ad70c2533a7c875f59b4eaf7cf86,Yahoo,company
NVDA,2025-11-13 11:59:06+00:00,Nvidia Faces Volatility Ahead of Earnings -- Investors Brace for Potential Pullback,Nvidia Earnings Could Ignite Wild Swings -- $5 Trillion Market Cap Under Scrutiny,https://finnhub.io/api/news?id=a59902f36f149a48144751edc45ac4cb529542c69a6da332218cec69645e8606,Yahoo,company
NVDA,2025-11-13 11:13:00+00:00,Could Oracle Be the Dark Horse in the Enterprise AI Cloud Race?,"Oracle is the fifth-largest cloud computing infrastructure company, and its massive backlog is gaining attention.",https://finnhub.io/api/news?id=ec0c2e76e6b9cefed891098cd3733a1d50f3c8239cae743eb872d6ac7b420130,Yahoo,company
NVDA,2025-11-13 10:58:00+00:00,SMIC Posts Profit Growth Amid China’s Chip Self-Reliance Drive,Semiconductor Manufacturing International Corp. returned to profit growth amid Beijing’s push for chip self-sufficiency as the battle for artificial-intelligence supremacy intensifies.,https://finnhub.io/api/news?id=60c0ef448928d9ebe4f796f0103950072427557cb9b589eae70b276812c3fd73,Yahoo,company
NVDA,2025-11-13 10:35:00+00:00,Is MP Materials Stock the Next Nvidia?,"MP Materials has soared 250% on the year. Can this mining company match -- or, indeed, exceed -- the performance of tech giant Nvidia?",https://finnhub.io/api/news?id=5f4428e91e99e403abb91fbd3a8f5393b744e073c902fde0495458349ed6bf6d,Yahoo,company
NVDA,2025-11-13 09:12:00+00:00,Here's Why Nov. 19 Could Be a Very Important Day for the Stock Market,The world's largest company -- and lynchpin of the artificial intelligence (AI) industry -- is about to report its latest quarterly operating results.,https://finnhub.io/api/news?id=58c114912e6c4116e7650d011c09d3610b3af5dadc1678948faefaf0f132f2c0,Yahoo,company
NVDA,2025-11-13 09:00:34+00:00,Intel's Incredible Rally Might Be Over (Rating Downgrade),Intel Corporation's stock rally may be overextended as fundamentals lag. See why INTC is now a Hold and what could trigger future upgrades. Click for my update.,https://finnhub.io/api/news?id=63d0fbe27c64caca42b6987b9bc24ebf75f5a6fe883579f623410651d21e38e4,SeekingAlpha,company
NVDA,2025-11-13 08:36:00+00:00,SoftBank Just Sold Its Entire Stake in Nvidia. Here's the 1 Key Thing You Need to Know.,What does SoftBank's move say about the artificial intelligence (AI) market?,https://finnhub.io/api/news?id=54d25c2fe4d737fbe91c4ff3058061144cd01c009f1ba2843437ffe69d9db110,Yahoo,company
NVDA,2025-11-13 08:06:00+00:00,Prediction: The Puzzle Pieces Are in Place for Nvidia to Disappoint Wall Street on Nov. 19,Investors may have bit off more than they can chew when it comes to Wall Street's artificial intelligence (AI) darling.,https://finnhub.io/api/news?id=0d1c39b491ba4202ff1978a5e58ffe8e74b7dad30d755d3c6c2b892eb9b395e9,Yahoo,company
NVDA,2025-11-13 06:29:55+00:00,China's Baidu unveils 2 new AI chips amid US export curbs,"BEIJING (Reuters) -Baidu unveiled two new semiconductors for artificial intelligence on Thursday, saying the ​products can provide Chinese companies with powerful, low-cost and domestically ‌controlled computing power.  Escalating tensions between the United States and China have led to restrictions on exports of ‌advanced U.S. AI chips to Chinese firms, prompting many to develop their own processors or seek domestic alternatives.  The company said at its annual Baidu World technology conference that the M100, an inference-focused chip, is set to be ⁠launched in early 2026. ‌The M300, capable of both training and inference, is slated for early 2027.",https://finnhub.io/api/news?id=7075130868d30df27a26b7cf1537abd92e502eacaa62330e08ce1c969e55a055,Yahoo,company
NVDA,2025-11-13 04:33:00+00:00,Why Nvidia’s 'big sellers' might secretly be its biggest believers,"Nvidia's latest round of share sales, which included SoftBank's $5.8 billion departure and other institutional cuts, led to inevitable rumors: Is the AI trade losing its appeal? Upon closer examination, the scenario changes. SoftBank isn't backing away from AI; instead, it's putting more money into ...",https://finnhub.io/api/news?id=387a59eddfae9f7f1ae74562cbb5ba3d25a2a8872dbb202da7e01dba3676c996,Yahoo,company
NVDA,2025-11-13 02:00:00+00:00,How a Chinese AI Company Worked Around U.S. Rules to Access Nvidia’s Top Chips,"In Indonesia, semiconductors covered by U.S. export controls are ready to help a Shanghai-based group.",https://finnhub.io/api/news?id=aab099620453b58432e192f5c8ec6bbcaecdd9eeccece6700b4cdc749fa42838,Yahoo,company
NVDA,2025-11-13 00:00:00+00:00,Electricity Shortages Threaten to Pull the Plug on AI Expansion,AP reported this week that electricity bills are shaping up as a major topic of discussion in the upcoming midterm election as resentment towards Big Tech and its data centers grows,https://finnhub.io/api/news?id=bc49169e9445194c3f1574ac09ecb5015d62ae6d8f108cdd68f97af97c2c0eae,Yahoo,company
NVDA,2025-11-12 22:20:21+00:00,"Cisco Earnings Beat, Outlook Above Views Amid Strong AI Orders",Cisco stock rose on fiscal first-quarter earnings and revenue that topped estimates amid strong artificial intelligence product orders.,https://finnhub.io/api/news?id=8d5b7e099492bd9310b66944a22ace92cf871e3cd971e0220430aa10c11ea5fe,Yahoo,company
NVDA,2025-11-12 21:38:20+00:00,A $25 Billion Bitcoin Bet Frays as Doubt Hits Big Buyers,"After a bruising October, the digital currency has staged only a halting recovery — climbing, dipping and stalling just above $100,000.  Over the past month, many of the biggest buyers — from exchange-traded fund allocators to corporate treasuries — have quietly stepped back, depriving the market of the flow-driven support that helped propel the token to records earlier this year.  For much of the year, institutions were the backbone of Bitcoin’s legitimacy and its price.",https://finnhub.io/api/news?id=45564c05cd09aa22fcdbf08bc16d47957e8bd9f9afd1a5988b292f2544572160,Yahoo,company
NVDA,2025-11-12 21:16:16+00:00,Nvidia's Earnings Are Almost Here. Investors Are Already Worried About the AI Rally.,AI bellwether Nvidia is slated to report its quarterly results next Wednesday in what could be a make-or-break moment for the AI-driven bull market.,https://finnhub.io/api/news?id=6bc2436c951a9ed130584c226740179cfc46edd7f5c502adf7e9e660d414fdeb,Yahoo,company
META,2025-11-17 11:30:00+00:00,Should You Buy the Dip on Meta Stock?,Meta's stock sold off due to spending concerns.,https://finnhub.io/api/news?id=6c1b774dbf5115ecd15816a6f60facde849c381b1fd5bf37d4fafde146fc8cd5,Yahoo,company
META,2025-11-17 10:00:00+00:00,"The Best Stocks to Invest $1,000 in Right Now",The AI race is slated to continue into 2026.,https://finnhub.io/api/news?id=3729713ee0d4d804c27591500e1fe77f9c20247fee540315dcbacff8beb12dfc,Yahoo,company
META,2025-11-17 02:00:00+00:00,Wall Street Blows Past Bubble Worries to Supercharge AI Spending Frenzy,"Firms such as Blue Owl Capital have raised trillions in investing firepower. The artificial-intelligence build-out is a perfect match, though warning signs are flashing.",https://finnhub.io/api/news?id=26cbaf88d8d0ae31ca46d0b4e875218758d828b504a0068b8c36839b8777605a,Yahoo,company
META,2025-11-16 19:46:37+00:00,Oracle's AI Strategy Shake-Up Sparks Market Jitters As Shares Plunge 25%,"Oracle Corporation (NYSE:ORCL) has seen a significant market reaction following its bold shift towards artificial intelligence (AI), resulting in a 25% drop in shares over the past month. What Happened: Oracle’s ambitious entry into the AI sector, fueled by substantial borrowing, has caused unease on Wall Street. The tech behemoth has pledged to invest hundreds of billions in the next few years on chips and data centers, primarily to bolster computing capacity for OpenAI, the creator of ChatGPT.",https://finnhub.io/api/news?id=2502a6a80056a4a376039862fa9990a846af54cb324753683b6262e8312ee1d2,Yahoo,company
META,2025-11-16 13:20:00+00:00,Prediction: This Unstoppable AI Stock Will Split by 2030,And it recently went on sale.,https://finnhub.io/api/news?id=cfe820a01197293a1b54a6ea1f60bdb4e2ad179a770f7c835aff4f0224d4ef19,Yahoo,company
META,2025-11-16 09:47:03+00:00,Meta Platforms And Its Real Value,,https://finnhub.io/api/news?id=f52d70b55e8152c4b75c617ab81b3ec9ae252b19372b5ad1b4b7bb5cb3d59172,SeekingAlpha,company
META,2025-11-16 09:15:00+00:00,2 Top Artificial Intelligence (AI) Stocks to Buy in November,These elite growth stocks can help you build wealth for retirement.,https://finnhub.io/api/news?id=3b721071f9c12ee53b7c87e3ba8aacc9664b307e414331bf79c0ffd00d87e7d8,Yahoo,company
