ticker,datetime,title,summary,url,source,category
AMZN,2025-11-15 15:01:37+00:00,"Airbnb CEO Brian Chesky Argues That AI Is 'Mostly Going To Be A Tool,' But Warns That Without Gen Z At The Bottom, There Will Be No Leaders At The Top","Airbnb Inc. (NASDAQ:ABNB) CEO Brian Chesky warned that excluding young professionals from the workforce could create a leadership void in the future as companies rely more on artificial intelligence. ""We need to make room for people early in their careers, even if AI can do the interns' work,"" Chesky told ABC News. He said that while AI can handle many entry-level tasks, companies that close off opportunities to young workers risk losing the next generation of leaders. Don't Miss: The ‘ChatGPT o",https://finnhub.io/api/news?id=1434a09dca839fd8a579b6aa39720d1ef50ca3ddbbdd20362713e76ed8774b4a,Yahoo,company
AMZN,2025-11-15 15:00:49+00:00,2 Intriguing Stocks in the Portfolio of Congresswoman Marjorie Taylor Greene,"If you have a look at Congresswoman Marjorie Taylor Greene’s portfolio, you’d think that she’s quite the savvy investor, given the picks made in recent quarters. After taking a quick glance at the recent activity within the portfolio, I must say that I like her personal portfolio’s chances of doing well in the new year. ... 2 Intriguing Stocks in the Portfolio of Congresswoman Marjorie Taylor Greene",https://finnhub.io/api/news?id=0e13090268abeefcd7b5e3e01f942b84e07dd8d1254b6a2e48f0205c006181c2,Yahoo,company
AMZN,2025-11-15 09:43:23+00:00,Amazon.com (AMZN) Looks to Expand Its Amazon Bazaar to 14 New Markets,"With significant hedge fund interest, Amazon.com, Inc. (NASDAQ:AMZN) secures a spot on our list of the 11 best AI infrastructure stocks to buy right now. On November 7, 2025, Amazon.com, Inc. (NASDAQ:AMZN) expanded its low-cost e-commerce service, Amazon Bazaar, to 14 new markets, according to Reuters. With this move, the company expects to compete with […]",https://finnhub.io/api/news?id=e9c80f08f76cf227f085eebd01f19c2377a68a017badde63ac782afe04acbc45,Yahoo,company
AMZN,2025-11-15 08:25:00+00:00,"The Best ""Training-Wheel"" Stocks for New Investors in 2025",The stocks that probably got you interested in the market probably aren't going to be the ones you want to start with.,https://finnhub.io/api/news?id=ea4b313aafd834cce96777b277bc1237287d56417f58309b93d12b10a28176ff,Yahoo,company
AMZN,2025-11-15 06:10:38+00:00,Can Amazon (AMZN) Extend Its AI Leadership After Securing the Recent OpenAI Partnership?,"Amazon.com Inc. (NASDAQ:AMZN) is among the most fantastic stocks every investor should pay attention to. Amazon is a consensus Buy and is currently one of the most analyst-favoured mega-cap stocks. While its year-to-date returns have been subdued, analysts still see a nearly 20% potential upside. Two events primarily drove the renewed enthusiasm for Amazon over the […]",https://finnhub.io/api/news?id=033143ca9ca02fbc24d5da7dde2564a2605308dc31fd14bf2956ea38ae608466,Yahoo,company
AMZN,2025-11-14 23:52:50+00:00,"Amazon robotics chief: ‘I want to eliminate every menial, mundane job’ as AI reshapes warehouse work",Amazon's robotics chief reveals plans to eliminate menial jobs through AI and automation as the company reshapes warehouse operations with advanced robotics.,https://finnhub.io/api/news?id=79b3958e24654950047cf30f40ddae2004d677bba6e4957dee43c317360a28d0,Yahoo,company
AMZN,2025-11-14 23:03:00+00:00,ValueAct Capital's Strategic Moves: MongoDB Inc. Takes Center Stage with a 4.17% Portfolio Impact,"ValueAct Capital (Trades, Portfolio)'s Third Quarter 2025 13F Filing: Key Insights and Strategic Adjustments",https://finnhub.io/api/news?id=0d0337b2b4b9e334736e39ea0f9f38401388ab51953d609366f1cc3363948ff6,Yahoo,company
AMZN,2025-11-14 23:00:45+00:00,George Soros Significantly Increases Stake in Amazon.com Inc,Insight into Soros's Strategic Moves in Q3 2025,https://finnhub.io/api/news?id=be6075580e8607be1cbc9a9602ec3d45480b15f332485895fbe1115ee584b507,Yahoo,company
AMZN,2025-11-14 21:32:57+00:00,Tracking Warren Buffett's Berkshire Hathaway Portfolio - Q3 2025 Update,,https://finnhub.io/api/news?id=9cc246a749b2f0a9dfae59a12b7eae2dd93b312dcf6a755e390505547a52f24b,SeekingAlpha,company
AMZN,2025-11-14 21:30:11+00:00,"Amazon, Walmart, and Target make holiday return policy changes","Retailers face a dilemma when it comes to returns. They want to have a customer-friendly policy, but they don't want their businesses to be taken advantage of. Returns cost money as, in many cases, the items can't be returned to the manufacturer or resold through traditional channels. ""Retailers ...",https://finnhub.io/api/news?id=a169581f4d9ff327416f1408a1f3326f5848093a6b6ebbf82815167ce421cbfc,Yahoo,company
AMZN,2025-11-14 20:15:47+00:00,Leadership Transition at Walmart: How McMillon's Retirement Could Impact the Stock,Doug McMillon surprised investors with his retirement announcement. Here's what it means.,https://finnhub.io/api/news?id=71720d13fa3c8b92d6a2542f8bfcef5cddaa34985a191d59709a347aa542621e,Yahoo,company
AMZN,2025-11-14 19:00:34+00:00,OpenAI Keeps Eyes Locked On 2030 Despite The Mind-Boggling Amount Of Money It Lost Last Month,"OpenAI completed a major corporate restructuring of its for-profit division last week that highlights the company's vision ahead of 2030. This comes as the company recorded a staggering loss of $11.5 billion in most recent quarter, according to an analysis of financial disclosures from major partner Microsoft. Corporate Restructuring Paves Way for IPO The Register conducted the review of Microsoft’s latest earnings report, which was released on Oct. 29. The massive quarterly loss highlights the",https://finnhub.io/api/news?id=f5db37dd6ae597982c6c4ef88b690502f2183d38e28238bf4b2b860a12d33daf,Yahoo,company
AMZN,2025-11-14 17:32:00+00:00,Don’t Call Them Bets. They’re ‘Prediction Markets’—and Robinhood Is Getting Rich Off Them.,"“Will the U.S. say that aliens exist this year?”  Robinhood Markets  clients can currently guess “yes” through their brokerage app, paying $4, plus $2 in fees, to win $100 if they’re right.  If I’ve been abducted and probed by extraterrestrials, is it inside information?  Robinhood  prefers terms like “prediction markets” and “event trading.”",https://finnhub.io/api/news?id=cc5157dabb22aaad6049d5c282a522dde4361c3a9ff5f3d08db86c6a9c4b21ab,Yahoo,company
AMZN,2025-11-14 17:17:52+00:00,Walmart CEO Retiring. He Built An E-commerce Empire To Rival Amazon,Walmart CEO Doug McMillon led the retail giant's transformation into an online retailer that could rival the likes of Amazon.,https://finnhub.io/api/news?id=a71a3a84ce15b499be13e5884e248aff39ed27fad5a2c4b369d8eea016c5da36,Yahoo,company
AMZN,2025-11-14 17:15:22+00:00,"Stock Market Today: Dow Jones Climbs Off Lows As Nvidia Jumps; Micron, Palantir Lead Nasdaq (Live Coverage)",Stock Market Today: The Dow Jones index dropped 400 points Friday. But Nvidia and Palantir recovered well off session lows.,https://finnhub.io/api/news?id=333e9e8f32ba76abe1fe6dfb734d7c4bfe4aa366598178d2283386f8789605e9,Yahoo,company
AMZN,2025-11-14 15:51:57+00:00,Walmart shares are up 312% during outgoing CEO Doug McMillon's tenure. Here's how that compares to its rivals,The outgoing Walmart CEO's tenure was marked by both sharp sales gains and stock growth.,https://finnhub.io/api/news?id=4ac6535e71d80f1ce8f323be73733fda2464d04d0d9f45601e10f3184416a2f6,CNBC,company
AMZN,2025-11-14 15:50:35+00:00,Longest U.S. Government Shutdown Is Over: What Happened And Key Takeaways,"Discover how major U.S. stock indexes withstand government shutdowns, driven by AI trends and margin focus. Click for the results of this latest shutdown.",https://finnhub.io/api/news?id=466f73f2c90a58f2051c8b8cefde29a83aa9560dd0f60af384f62321eabb36d4,SeekingAlpha,company
AMZN,2025-11-14 14:21:25+00:00,"Walmart CEO Doug McMillon to retire Jan. 31, longtime exec John Furner named next CEO","Walmart announced Friday that its longtime CEO, Doug McMillon, would retire and be replaced by insider John Furner.",https://finnhub.io/api/news?id=3d88189f1208a51935c53c58646cfb9f5f3f9ebae5b3756fc08e107644d272ac,Yahoo,company
AMZN,2025-11-14 14:07:24+00:00,John Furner Stepping Up as Walmart’s Next CEO,The head of the company’s U.S. discount business is taking the top job from Doug McMillon who cemented Walmart’s place in the digital age.,https://finnhub.io/api/news?id=4a15df5bbcc6a62156d98bf9bf1d4b590cbd6fe8be62b41c71041f6861d97b5b,Yahoo,company
AMZN,2025-11-14 13:57:41+00:00,QQQ vs. SPY vs. DIA: Which ETF Is the Ultimate Winner?,"The Invesco QQQ Trust (NASDAQ:QQQ), SPDR S&P 500 ETF (NYSEARCA:SPY) and the SPDR Dow Jones Industrial Average ETF Trust (NYSEARCA:DIA) are among the market’s biggest ETFs, each tracking a different theme. Most investors hold a blend of these ETFs in their portfolios in different proportions. There are also investors who pick one of those three as ... QQQ vs. SPY vs. DIA: Which ETF Is the Ultimate Winner?",https://finnhub.io/api/news?id=a6bd84fae2c2918a94340ae8e529ff52e634c000ace04bb62982bc19c877f2a0,Yahoo,company
AMZN,2025-11-14 13:45:00+00:00,"Wall Street Roundup: Cisco Surges, Oracle Sinks Amid Growing AI Fears",Market mood is mercurial and jittery. Cisco vs. Oracle: a split in AI infrastructure plays.,https://finnhub.io/api/news?id=8e15994140831b7df83a365386b0e3951e0e442cd0352a0b705eb5b8a92f36fa,SeekingAlpha,company
AMZN,2025-11-14 13:40:00+00:00,Nebius Shares Fall Post Q3 Earnings: Should Investors Hold or Sell?,"NBIS sinks on wider losses and a tightened revenue outlook, raising fresh questions about its breakneck AI infrastructure expansion.",https://finnhub.io/api/news?id=4bbd49b64e01282e6001b6ff84b62d07b6d433f01dce0ea2c1e9749e19bde462,Yahoo,company
AMZN,2025-11-14 13:32:00+00:00,"Shopify Rallies 31% in 6 Months: Buy, Sell or Hold the Stock?","SHOP's 31% rise, and stronger merchant activity and cash flow meet stiff competition and valuation concerns, prompting caution.",https://finnhub.io/api/news?id=664426a8a70bd9924faca1478383ccbff5921ff90774df63abaf7b2d3dc85b92,Yahoo,company
AMZN,2025-11-14 11:10:55+00:00,Amazon and Microsoft Support U.S. Plan to Tighten Nvidia Chip Exports to China,Tech giants back the proposed GAIN AI Act aimed at prioritizing domestic access to advanced AI chips.,https://finnhub.io/api/news?id=a59017877432d4f9109842a89d57b25adb3eefc96c117373fcbb106234a84663,Yahoo,company
AMZN,2025-11-14 08:16:00+00:00,Best E-Commerce Stock To Buy: Amazon Vs. Shopify,"Amazon and Shopify are both solid e-commerce stocks, but in a close race, one of these stocks has a slight edge.",https://finnhub.io/api/news?id=ac88f9dd8eb0f34507d0b37cbca679538b9c12308d7a40f423056e279678ef1a,Yahoo,company
AMZN,2025-11-14 07:56:19+00:00,"Alibaba Leveraging China's Superior AI Strategy, Buy Ahead Of Earnings",Alibaba's performance is now reflecting China's superior strategy to grow monetizable AI ecosystems. Learn why BABA stock is a Buy.,https://finnhub.io/api/news?id=a7d0ffbfe075a2425c39ac8cefd6e4bf1a3d024647f1e64eb11d540cffaef25b,SeekingAlpha,company
AMZN,2025-11-14 07:35:01+00:00,"After a job loss, don't forget to manage your 401(k) — it's 'one of your biggest assets,' CFP says","While your 401(k) may not be top of mind after being laid off, be sure not to forget about managing those assets.",https://finnhub.io/api/news?id=2eaedb48d018e2e78d764bb24b67fe40740eab958e95088caa71f725442c165d,CNBC,company
AMZN,2025-11-14 06:11:16+00:00,Amazon (AMZN): Evaluating Valuation Perspectives as Long-Term Growth Outpaces Peers,"Amazon.com (AMZN) shares have drifted a bit this week, trading near $238. Investors are watching how the company balances its recurring online retail business with fast-growing segments such as cloud services and advertising, which helps fuel its long-term performance. See our latest analysis for Amazon.com. Amazon’s share price has bounced back impressively this year, with a 1-month share price return of nearly 10% and year-to-date gains putting it well ahead of many peers. Although momentum...",https://finnhub.io/api/news?id=999885bb1d40c95a8693f5f6baf0cb9f87707e3aaae5f50045689f5c85ad1f1c,Yahoo,company
AMZN,2025-11-14 05:02:25+00:00,Vuzix Corp (VUZI) Q3 2025 Earnings Call Highlights: Strategic Partnerships and Military ...,"Despite a dip in revenue, Vuzix Corp (VUZI) strengthens its market position with new partnerships and military applications, while maintaining financial stability.",https://finnhub.io/api/news?id=9e4c3bd8b20a59f04aca06010acc2b72555e2b37f627ba1f6ed06f1acadf39d5,Yahoo,company
AMZN,2025-11-14 04:20:20+00:00,Benchmark Boosts Amazon (AMZN) Price Target Amid Accelerating AWS Momentum and Long-Term Growth Plans,"Amazon.com, Inc. (NASDAQ:AMZN) ranks among the best long-term stocks to buy according to D. E. Shaw. Benchmark reaffirmed its Buy rating on Amazon.com, Inc. (NASDAQ:AMZN) and boosted its price target from $260 to $295 on October 31. Despite continuous investment phases, the price target rise reflects rising confidence in Amazon’s growth trajectory, representing a 13.5% […]",https://finnhub.io/api/news?id=22140ae47856abd0c1933e80e3f0c6b1042ed71ad4c7c3078afb702de1f6022d,Yahoo,company
AMZN,2025-11-14 03:32:13+00:00,Bezos’ Blue Origin launches landmark Mars mission,"Blue Origin, the rocket company founded by Amazon multibillionaire Jeff Bezos, launched its towering New Glenn rocket on a mission that marked its first major test.",https://finnhub.io/api/news?id=b149bc60179731798ce56fd1f15c5bb1a8e14ae5e4b1f3c6fa67ad64509f2af6,Yahoo,company
AMZN,2025-11-13 22:05:33+00:00,Nasdaq Logs Worst Day in Nearly 5 Weeks as Data Release Uncertainty Dims Rate Cut Hopes,"US equity benchmarks tumbled Thursday, with the Nasdaq Composite logging its worst day in nearly fiv",https://finnhub.io/api/news?id=45e17f628d5a8c977db8f2da1915d4e8581846fc9c473d34fe1d0a177591a98d,Yahoo,company
AMZN,2025-11-13 21:21:51+00:00,Jeff Bezos’s Blue Origin pulls off first landing of its largest reusable rocket,Blue Origin has for the first time landed the booster rocket for its largest spacecraft in a step forward for Jeff Bezos’s space venture as it...,https://finnhub.io/api/news?id=1f8b5ae2ea0a2dd619c6891711e1fc65151a25cf3005e60cb6442aa476ed22f1,Yahoo,company
AMZN,2025-11-13 21:08:00+00:00,TEAMSTERS-BACKED DELIVERY PROTECTION ACT SECURES SUPERMAJORITY IN NEW YORK CITY COUNCIL,"The Teamsters and their allies have reached a major milestone for working people as the Delivery Protection Act secured a bipartisan, veto-proof supermajority of sponsors in the New York City Council. This legislation would hold Amazon accountable for its exploitative labor practices and make the e-commerce giant responsible for the safety of its drivers and city streets.",https://finnhub.io/api/news?id=d3aa7de6a39960b1bd65bb76a970bc370391c61cf43348821a30bc66fb1e4e3f,Yahoo,company
AMZN,2025-11-13 20:33:38+00:00,"Stock Market Today: Dow Craters As Nvidia, Palantir Fall; Jobs Data On Watch (Live Coverage)","The Dow Jones index fell Thursday, following a record high in the previous session after news of the U.S. government shutdown ending.",https://finnhub.io/api/news?id=b814c246e7655f08eba0eb165cfcad4feea03e2f34310e105668097204ffd052,Yahoo,company
AMZN,2025-11-13 20:29:00+00:00,"2 ""Magnificent Seven"" Stocks to Buy Before They Soar at Least 20%, According to Select Wall Street Analysts","Meta Platforms and Amazon already sport massive market caps, but that doesn't mean they can't keep growing.",https://finnhub.io/api/news?id=62bfc6839169ef3e796b880eba3402144d8b6f1e5f10fa02745ce1ca644ee2bd,Yahoo,company
AMZN,2025-11-13 18:48:47+00:00,Equities Retreat Intraday as Tech Sector Tumbles,US benchmark equity indexes were sharply lower intraday amid uncertainty around the release of key e,https://finnhub.io/api/news?id=ed9ff9df0057b5dcb8b3c8f905174962680dddd1f9718244e9444d84558f2715,Yahoo,company
AMZN,2025-11-13 18:38:07+00:00,Affirm CEO says the robots are coming — but they're not coming for our jobs,Affirm CEO Max Levchin says AI and robotics will enhance human lives.,https://finnhub.io/api/news?id=772927f1dd7163484cab887812555fce0323c4269cd943044741febb11a5b339,Yahoo,company
AMZN,2025-11-13 18:11:02+00:00,CSE Global (SGX:544) Valuation in Focus After Amazon Deal and Strong New Orders,"CSE Global (SGX:544) just inked a big transaction with Amazon, involving nearly 63 million new warrants. This signals deeper commercial ties between the companies. This announcement comes as the company reported strong new orders for the third quarter of 2025. See our latest analysis for CSE Global. Momentum has been picking up fast for CSE Global, with the share price up 36.9% over the last month and a staggering 132.5% year-to-date. Recent highlights such as its major Amazon deal and a...",https://finnhub.io/api/news?id=d176fbdd4d5f08e04b69a9098459337def6fce3b38dee48aef88d3f6d772f969,Yahoo,company
AMZN,2025-11-13 18:09:33+00:00,"Stock Market Today: Dow, Nasdaq Losses Mount; Chip Titan Heads Into Earnings (Live Coverage)","The Dow Jones index fell Thursday, following a record high in the previous session after news of the U.S. government shutdown ending.",https://finnhub.io/api/news?id=48978ec96be72606c85654ae5f10836f9c0b17d131760379f995e3c0897ec946,Yahoo,company
AMZN,2025-11-13 17:29:45+00:00,Stock Market Today: Dow Sinks 400 Amid Inflation Woes; WeChat Parent Slides (Live Coverage),"Stock Market Today: The Dow Jones index fell Thursday, following a record high in the previous session after news of the U.S. government shutdown ending. Nvidia stock sells off.",https://finnhub.io/api/news?id=9c736e2f62c7c98697122ed2c333cd37e16e6dd05679f60fba67d811e3b1550f,Yahoo,company
AMZN,2025-11-13 17:09:28+00:00,Jim Cramer on Hertz: “It Has Been a Contrary Name”,"Hertz Global Holdings, Inc. (NASDAQ:HTZ) is one of the stocks Jim Cramer recently put under a microscope. When a caller highlighted that 95% of HTZ shares are owned by insiders, hedge funds, and institutions, the company reported a positive EPS in nearly two years, and its deal with Amazon, Cramer commented: “Oh, I’ll tell you, […]",https://finnhub.io/api/news?id=03a82fb499a938fbb63cfff463cb01890fcd7d946f4296ddd58ed74ca7ac2c07,Yahoo,company
AMZN,2025-11-13 16:41:51+00:00,"Exclusive: Jumia goes from turning point to inflection point in Q3, CEO Dufay says","Investing.com -- Following Jumia Technologies’ (NYSE:JMIA) second-quarter results, CEO Francis Dufay described the company as being at a turning point. Now, after another solid quarter, Dufay says “Africa’s Amazon” has reached a key inflection point, with its cost-cutting strategy continuing to pay off.",https://finnhub.io/api/news?id=c8f23d677797be7f37e07cf1cf6a31e011cee25e6ff3fe82595d6aec27fe5041,Yahoo,company
AMZN,2025-11-13 16:37:32+00:00,Stock Market Today: Dow Drops 300 Amid Inflation Woes; Burry De-Registers Fund (Live Coverage),"Stock Market Today: The Dow Jones index fell Thursday, following a record high in the previous session after news of the U.S. government shutdown ending. Nvidia stock sells off.",https://finnhub.io/api/news?id=223d9385f9d552a59f9fc83443128b3dd14072cae965f82c0b514f71a6413680,Yahoo,company
AMZN,2025-11-13 16:32:00+00:00,Can Audio Advertising Become Trade Desk's Next Big Growth Driver?,"TTD is amplifying growth beyond CTV, betting on AI-powered tools and surging demand to make audio ads its next big win.",https://finnhub.io/api/news?id=1eee4de4dd35d7c075a23f8e3600b46fe20865316f40810bbe31b01cd43a3789,Yahoo,company
AMZN,2025-11-13 16:00:00+00:00,Fortune Announces Brainstorm AI 2025 Speaker Lineup For Dec. 8-9,"Fortune announced today the addition of several speakers for its fifth annual Fortune Brainstorm AI, December 8-9 at the St. Regis in San Francisco.",https://finnhub.io/api/news?id=ae85b2ce02d8e9775a1a48c442a9aeb9829d4a74eebd317e9389f14b9128dd5b,Yahoo,company
AMZN,2025-11-13 15:33:00+00:00,The Best Artificial Intelligence (AI) Stock to Hold in Uncertain Times,Amazon combines a recession-resistant business with AI-driven growth.,https://finnhub.io/api/news?id=6aaa926db893aa51e98198856d1a752064d53267e2be6df5034dd9fbdbb18a53,Yahoo,company
AMZN,2025-11-13 13:10:00+00:00,Nvidia Stock Gets Price-Target Hikes. Why the Shares Are Falling.,"Nvidia stock is moving ahead of earnings on Nov. 19, amid a debate about potentially stretched valuations for companies linked to the AI boom.",https://finnhub.io/api/news?id=1e5a8037986748ed4493c5eea36b45a5a1953a039183b9e75c1c8e9b535c70a5,Yahoo,company
AMZN,2025-11-13 14:57:00+00:00,"Zacks Investment Ideas feature highlights: Walt Disney, Amazon and Netflix",Disney eyes growth through streaming and global park expansion as investors await key Q4 results for signs of renewed momentum.,https://finnhub.io/api/news?id=4c82190eb46cb50170a450c47528b495fbcfcd9bf32acdd6f5d4dae8e21268fd,Yahoo,company
AMZN,2025-11-13 14:33:00+00:00,Elon Musk bashes government for taxing the ‘daylight’ out of people. Here’s the #1 way to get rich and keep your cash,Why building wealth is not just about how much you earn.,https://finnhub.io/api/news?id=bc97aabb696ba83fe3e401672cbf1391108682df8e01e1dc42dc72e2a97e16ab,Yahoo,company
AMZN,2025-11-13 14:24:00+00:00,The robots have won. The smart trade now is investing in companies that make them.,"Amazon’s million-robot army ends the need for 160,000 new jobs. Walmart, Target and other retailers are reaching similar conclusions.",https://finnhub.io/api/news?id=911b268cf6a6795260bae2203986efcc0dfe532d5985e0bda63dcefb178ead60,Yahoo,company
AMZN,2025-11-13 13:55:29+00:00,UPS needs a win-win-win strategy for B2C delivery,"UPS could unite management, its union workforce and the cost-efficient crowd-sourced delivery model by trying a new triple-win strategy centered on the UPS Store. The post UPS needs a win-win-win strategy for B2C delivery appeared first on FreightWaves.",https://finnhub.io/api/news?id=959d62e1b33cea8efb58223486d77f8a9141a51a905629f649b8d5e74dde6107,Yahoo,company
AMZN,2025-11-13 12:37:41+00:00,Latest News In E-Commerce - AI Transforms African Payments Yet Faces Key Challenges,"Artificial Intelligence (AI) is significantly reshaping the payments and E-Commerce landscape in Africa, driven by enhancements in fraud detection and personalized user experiences through Generative AI (GenAI). Despite remarkable adoption and the value potential unlocked across multiple sectors, challenges such as governance gaps, infrastructure deficiencies, and workforce shortages hinder the scaling of AI applications. Regions including Nigeria, South Africa, and Egypt lead these...",https://finnhub.io/api/news?id=c7354c07481561aacdcb918fb33d92e5f9adee6dda1a802b4fb0936aeefb9fc9,Yahoo,company
AMZN,2025-11-13 12:15:01+00:00,Should You Buy the Post-Earnings Pop in Affirm Stock?,"After riding high on its latest earnings release, is now the right time to buy Affirm stock?",https://finnhub.io/api/news?id=9999e31147e68b014fe6dab0c320f348f26837e203bb90c0991a220c0636d42e,Yahoo,company
AMZN,2025-11-13 12:10:00+00:00,What Is One of the Best Retail Stocks to Own for the Next 10 Years?,The e-commerce leader is extending its advantage with artificial intelligence.,https://finnhub.io/api/news?id=69a8b36ded3850f77ff1058437c1d689739702e53f142a54c33a1feb3f151563,Yahoo,company
AMZN,2025-11-13 12:05:00+00:00,nvp capital Crosses $200M in AUM with Second Fund to Back Vertical AI Founders Transforming Legacy Industries,"With fresh backing from Prudential Financial, Rutgers University Endowment, Ford Foundation and Liberty Mutual Investments nvp powers seed-stage bets into category-defining companies nvp Capital co-founders Dan Borok, Vaughn Crowe - Managing partners. NEW YORK, Nov. 13, 2025 (GLOBE NEWSWIRE) -- nvp capital, a New York-based seed-stage venture firm investing globally in enterprise software and vertical AI, today announced the close of its second fund totaling $80M. Fund II includes capital from a",https://finnhub.io/api/news?id=fd2398d6fa895a23343c9deaf2d4f42f6dcbf4945d5f94c007d48508ba9baeb9,Yahoo,company
AMZN,2025-11-13 10:23:13+00:00,CoreWeave: The Efficiency Paradox Behind Every 'Buy-The-Dip' Rally,"CoreWeave, Inc.âs Q3 2025 earnings reveal strong revenue growth but weak margins and rising risks. Click for this CRWV update.",https://finnhub.io/api/news?id=ad35b0f777829d331e9c3886ded960d1a2f74efa6731634d78bb30562c56e502,SeekingAlpha,company
