ticker,datetime,title,summary,url,source,category
MSFT,2025-11-13 12:25:00+00:00,Big Tech’s Soaring Profits Have an Ugly Underside: OpenAI’s Losses,"Investors take a lot of comfort from the solidity of Big Tech earnings as worries grow about artificial intelligence overinflating valuations.  Quarterly profits soared at  Nvidia Alphabet Amazon  and  Microsoft  as AI-related revenue poured in (  Meta’s  were wiped out by tax).  Cash flows are mostly fine, albeit a lot is now going into building new data centers.",https://finnhub.io/api/news?id=077857855aed5e8d2945e2b088148289fced8ca795f389b9c8b4e0441a976bda,Yahoo,company
MSFT,2025-11-13 12:01:20+00:00,"Microsoft’s plan to fix its chip problem is, partly, to let OpenAI do the heavy lifting","Microsoft is taking a page from OpenAI's playbook, literally.",https://finnhub.io/api/news?id=e1a49d6724c45686502ea85f8ea198fd96b64685092dd8d64f272ab724f28c10,Yahoo,company
MSFT,2025-11-13 12:00:00+00:00,Compugen Launches Business Unit to Help Canadian Organizations Maximize Value on Microsoft Investments,"Compugen Inc., Canada's largest privately-owned and operated Technology Ally, is pleased to announce the launch of CxMSB (Compugen integrated Microsoft Solutions Business), a new business unit dedicated to helping Canadian organizations maximize the full potential of their Microsoft investments.",https://finnhub.io/api/news?id=5162305d18a2cf9289dba228a4e2361dc6e8856a2e9f062631d21e8a5d8147a4,Yahoo,company
MSFT,2025-11-13 12:00:00+00:00,RSA Announces New Solution to Enhance Security for Microsoft Entra ID,"BURLINGTON, Mass., November 13, 2025--RSA, the security-first identity leader, announced today that RSA® ID Plus for Microsoft, a new solution category that provides an enhanced security layer for Microsoft Entra ID, is now generally available. Now on the Microsoft Azure Marketplace, the first product, RSA ID Plus M1, includes key capabilities that defend organizations from emerging attacks and help them maintain operational continuity in both Microsoft and non-Microsoft environments.",https://finnhub.io/api/news?id=c0d261e44c070e50392d076fbc5aab90958ba18053202e1143154e1f9d0bc8e8,Yahoo,company
MSFT,2025-11-13 11:00:11+00:00,Big Tech’s Climate Strategists Feeling Strain of AI Power Needs,"On the tech giant’s 500-acre campus in Redmond, Washington, teams began holding regular “triage” meetings to confront serious questions posed by the artificial intelligence boom: Where would the company find the gigawatts — just one gigawatt can power nearly 750,000 US homes — needed for data centers?  The AI discussions were “interesting and terrifying all at the same time,” said Brian Janous, who served until August 2023 as Microsoft’s vice president of energy.",https://finnhub.io/api/news?id=718031b3a44b24a9f4462cc8695dd2097fb456340d3f63369d24ba4559989444,Yahoo,company
MSFT,2025-11-13 11:00:00+00:00,Wisr AI Systems Joins Canadian Chamber of Commerce Future of Artificial Intelligence Council,"Positioning Wisr AI at the Forefront of National AI Policy and Responsible InnovationVancouver, British Columbia--(Newsfile Corp. - November 13, 2025) - Wisr AI Systems Inc. (CSE: WISR) (""Wisr AI"" or the ""Company""), a leader in Agentic AI-driven cybersecurity and third-party risk intelligence, is pleased to announce that it has joined the Future of Artificial Intelligence Council, established by the Canadian Chamber of Commerce.This strategic appointment provides Wisr AI direct access to one of.",https://finnhub.io/api/news?id=14406a11589fa50c086d7b6968861d07fe92d735cddb1f18b7e2b75a7cc971a9,Yahoo,company
MSFT,2025-11-13 09:55:03+00:00,Petronas signs MoUs to advance seismic imaging and AI initiatives,"The MoUs involve organisations such as Beicip-Franlab, ConocoPhillips, Eliis, Microsoft, PTTEP, Shell, SLB and TotalEnergies.",https://finnhub.io/api/news?id=993889cceaad0afbfdfd29915dc8f363d9d8ef6623c5465cda1dd6f6343c89ee,Yahoo,company
MSFT,2025-11-13 09:00:00+00:00,Hitachi Solutions recognised as the winner of 2025 Microsoft Dynamics 365 Finance Partner of the Year,"Hitachi Solutions today announced it has won the Dynamics 365 Finance 2025 Microsoft Partner of the Year Award. It has also been selected as finalists for Build and Modernize AI Apps, Dynamics 365 Sales and Customer Insights, Dynamics 365 Supply Chain, and Low Code Application Development. In addition, Hitachi Solutions has won 2025 Microsoft Partner of the Year for Government. The company was honored among a global field of top Microsoft partners for demonstrating excellence in innovation and i",https://finnhub.io/api/news?id=78f0025741969ae7b21646b441ec4737d1309161c759e530a542f2d5cdc5b5e3,Yahoo,company
MSFT,2025-11-13 09:00:00+00:00,Hitachi Solutions Recognised as the Winner of 2025 Microsoft Government Partner of the Year,"Hitachi Solutions today announced it has won the Government 2025 Microsoft Partner of the Year Award. It has also been selected as finalists for Build and Modernize AI Apps, Dynamics 365 Sales and Customer Insights, Dynamics 365 Supply Chain, and Low Code Application Development. In addition, Hitachi Solutions has won 2025 Microsoft Partner of the Year for Finance. The company was honoured among a global field of top Microsoft partners for demonstrating excellence in innovation and implementatio",https://finnhub.io/api/news?id=fe39977e2a697dea88237add9e26c91f86ac7ea1eb41f39faed3abd035a30248,Yahoo,company
MSFT,2025-11-13 08:55:36+00:00,MSFU: Why This Could Be A Smart Long-Term Bet,"For aggressive investors, trading the Direxion Daily MSFT Bull 2X Shares ETF offers a leveraged way to amplify MSFT's daily performance. Click for more on MSFU.",https://finnhub.io/api/news?id=78cb22dd09669669b43e9b74931f073b295929c3692282eb5c876dfd996fc85b,SeekingAlpha,company
MSFT,2025-11-13 08:45:00+00:00,"Got $3,000? 2 Artificial Intelligence (AI) Stocks to Buy and Hold for the Long Term",These companies are rewarding investors through growing free cash flows.,https://finnhub.io/api/news?id=f0f5d257bc6e2cfd121adb5bb11c65683ebb5c5d1dc21ee4c004c4f466e6d9f0,Yahoo,company
MSFT,2025-11-13 07:06:52+00:00,Cisco shares climb on strong AI-fueled equipment demand,The networking equipment ​maker raised its annual profit and revenue forecast on robust cloud ‌demand.,https://finnhub.io/api/news?id=161a338169d2da209126b986f825216e0d54fcf534399d9223cd52325f2dd075,Yahoo,company
MSFT,2025-11-13 06:00:00+00:00,Tredence Named 2025 Microsoft Data & Analytics Platform Partner of the Year,"Tredence, a global AI and data science solutions provider, today announced it has won the 2025 Microsoft Partner of the Year Award for Data & Analytics Platform. Tredence was selected from a global field of Microsoft partners for its ability to accelerate AI innovation and deliver measurable business impact through Azure-powered analytics and AI solutions.",https://finnhub.io/api/news?id=d0cf2c2b711465628bfb8d5c31ad1742c392b7925f34c5963a5f9d156e00ea2d,Yahoo,company
MSFT,2025-11-13 05:50:00+00:00,Microsoft Names The Digital Neighborhood's Sulava Global Partner of the Year for Copilot and AI Agents,"Microsoft has named Sulava, an AI and Copilot pioneer within The Digital Neighborhood, as the winner of the 2025 Global Copilot and AI Agent Partner of the Year Award.""AI has become the new operating system for innovation and performance in business, and our more than 2,400 customers are proving what's possible when it's applied with purpose. Across our community of 1,500 consultants and engineers, we're reimagining how work gets done, where insight is instant, collaboration is fluid, and value",https://finnhub.io/api/news?id=b05c36479c132093d20068c50d03d9a655fedf9061ac811b8e51a3f1db7674ac,Yahoo,company
MSFT,2025-11-13 04:07:00+00:00,Windows president told 'Stop this nonsense. No one wants this',"I've used most Windows versions, with the oldest one being 3.11. When Windows 7 was released, it really felt like Microsoft had put a serious effort into creating a decent operating system. Unfortunately, since 7, the company hasn't had a release that would leave such a good impression. The ...",https://finnhub.io/api/news?id=33d585bb5c6991b59ba29d94f817c7fa85cf7eaf418894c7097798136bf8e239,Yahoo,company
MSFT,2025-11-13 03:51:32+00:00,"Chinese tech giant Tencent's quarterly revenue rises 15%, fueled by AI","Tencent on Thursday posted 15% year-on-year revenue growth, with AI boosting the Chinese tech giant's performance in advertising targeting and gaming.",https://finnhub.io/api/news?id=4b6e851cabd25f19b4dd98401605c0da4692d983df66838b7e2733a86234f156,CNBC,company
MSFT,2025-11-12 23:00:00+00:00,Cloocus Recognized as a Finalist for the 2025 Microsoft Partner of the Year - Gaming,Cloocus today announced it has been named a finalist for the 2025 Microsoft Partner of the Year Award (Gaming). The company was honored among a global field of top Microsoft partners for demonstrating excellence in innovation and implementation of customer solutions based on Microsoft technology.,https://finnhub.io/api/news?id=2d64b76125be1fae390d56bbf7cda63c32b0f78adfbe60186ab129f142af4a91,Yahoo,company
MSFT,2025-11-12 21:30:00+00:00,TTEC Digital recognized as the 2025 Microsoft Dynamics 365 Service Partner of the Year,"AUSTIN, Texas, Nov. 12, 2025 (GLOBE NEWSWIRE) -- TTEC Holdings Inc. (NASDAQ: TTEC), a leading global CX (customer experience) technology and services innovator for AI-enabled CX, today announced that TTEC Digital has won the 2025 Microsoft Dynamics 365 Service Partner of the Year Award. The company was honored among a global field of top Microsoft partners for demonstrating excellence in innovation and implementation of customer solutions based on Microsoft technology. “We are thrilled to be rec",https://finnhub.io/api/news?id=ab6bcec29ceec35d97850c549ad2845315445ba1dc2324257a91c668b30db390,Yahoo,company
MSFT,2025-11-12 21:09:00+00:00,This $70 Billion Hedge Fund Was Early to AI’s Big Winners. What It Sees Next for the AI Trade.,"Coatue saw energy as an early AI beneficiary. Why the firm thinks trucking, mortgages, and logistics could be next.",https://finnhub.io/api/news?id=09cd04c3b4b87463d7a88e54bd0a16a2cfee5c91d6c10e0ee116d8b03a8e08cb,Yahoo,company
MSFT,2025-11-12 21:05:00+00:00,Nebius Group NV (NBIS) Q3 2025 Earnings Call Highlights: Record Revenue Growth and Strategic ...,"Nebius Group NV (NBIS) reports a 355% revenue surge, major deals with Meta and Microsoft, and ambitious expansion plans amid capacity challenges.",https://finnhub.io/api/news?id=d67f92e4831767d0ceee12e97fc1f517b4accf37a1d76f2107a747ef89322225,Yahoo,company
MSFT,2025-11-12 21:00:00+00:00,Fractal Wins Microsoft Partner of The Year 2025,"Fractal Analytics Limited- (""Fractal"") (www.fractal.ai), a global provider of artificial intelligence solutions to Fortune® 500 companies, today announced, it has won the Retail and Consumer Goods 2025 Microsoft Partner of the Year Award. The company was honored among a global field of top Microsoft partners for demonstrating excellence in innovation and implementation of customer solutions based on Microsoft technology.",https://finnhub.io/api/news?id=fa9a4ff0048fbcf9ea41a178502017137152398d9657e9285a04cb45fed89a4b,Yahoo,company
MSFT,2025-11-12 20:05:00+00:00,Faros AI Recognized as the Winner of 2025 Microsoft for Startups Partner of the Year,"SAN MATEO, Calif., November 12, 2025--Faros AI, the AI transformation partner for software engineering organizations, today announced it has won the Microsoft for Startups 2025 Microsoft Partner of the Year Award. Faros AI was honored among a global field of top Microsoft partners for demonstrating excellence in innovation and implementation of customer solutions based on Microsoft technology.",https://finnhub.io/api/news?id=29c170d413c600620ccedb4bf42b6ba1f30635dfb1a0a149301836a781836d15,Yahoo,company
MSFT,2025-11-12 20:05:00+00:00,Hitachi Solutions Recognized as the Winner of 2025 Microsoft Government Partner of the Year,"Hitachi Solutions announced today it has won the Government 2025 Microsoft Partner of the Year Award. It has also been selected as finalists for Build and Modernize AI Apps, Dynamics 356 Sales and Customer Insights, Dynamics 365 Supply Chain, and Low Code Application Development 2025 Microsoft Partner of the Year. In addition, Hitachi Solutions has won 2025 Microsoft Partner of the Year for Dynamics 365 Finance globally. The company was honored among a global field of top Microsoft partners for",https://finnhub.io/api/news?id=788c7345159c1c03e4a35b173ae21d571599a30369d9ce8815753db996969795,Yahoo,company
MSFT,2025-11-12 20:05:00+00:00,"Cegeka, CTG Parent Company, Recognized as the Winner of 2025 Microsoft Dynamics 365 Supply Chain Partner of the Year","BUFFALO, N.Y., November 12, 2025--As a member of the Cegeka Group, CTG is proud to announce that Cegeka has earned the 2025 Microsoft Partner of the Year Award for Dynamics 365 Supply Chain. Microsoft honored Cegeka for its outstanding innovation and execution of industry solutions that drive business success, powered by Microsoft Dynamics 365 Supply Chain, the end-to-end platform that optimizes planning, production, inventory, and logistics.",https://finnhub.io/api/news?id=2c00df2fa1bd0c8cbe7bcecf49a456a28fe936c7e08b6a0c0ed8d3c3860f0bf5,Yahoo,company
MSFT,2025-11-12 20:05:00+00:00,Lightbeam Health Solutions Recognized as the Winner of 2025 Microsoft Healthcare and Life Sciences Partner of the Year,"Lightbeam Health Solutions, the proven, AI-enabled solutions and services leader in population health management, today announced it has won the Healthcare and Life Sciences 2025 Microsoft Partner of the Year Award. The company was honored among a global field of top Microsoft partners for demonstrating excellence in innovation and implementation of customer solutions based on Microsoft technology.",https://finnhub.io/api/news?id=a38a28522f5e79d632717ba1e260f7d24b32f8346e391446bbf6cf48e3885d0a,Yahoo,company
MSFT,2025-11-12 20:02:00+00:00,Willow Recognized as a Finalist for 2025 Microsoft Education Partner of the Year Award,"SEATTLE, November 12, 2025--Willow Technology Corporation Ltd. (""Willow""), ​a leading Operational AI company​​, ​today announced it has been named a finalist for the 2025 Microsoft Education Partner of the Year Award.",https://finnhub.io/api/news?id=b40c6b17ae0bcdbfc155a3fad7427e8093ed4dc762ec3548e09f9a01c61bb073,Yahoo,company
MSFT,2025-11-12 18:05:44+00:00,The Big Short's Big Bet,Read about Michael Burryâs bold bet against an AI-fueled stock market bubble.,https://finnhub.io/api/news?id=3fc365a4573d10e48ba33eac54e3e1614e628407968c2817f436e51abd3a55ab,SeekingAlpha,company
MSFT,2025-11-12 17:08:00+00:00,ADL and JLens Recommend AGAINST BDS-Aligned Shareholder Proposal at Microsoft Annual Meeting,"NEW YORK, November 12, 2025--JLens, a Registered Investment Advisor, and ADL (the Anti-Defamation League), today called upon shareholders of Microsoft Corporation (NASDAQ: MSFT) to vote AGAINST Proposal 9, a shareholder resolution that they believe represents a politically motivated, BDS-aligned campaign designed to stigmatize lawful business with Israel and expose Microsoft to significant financial, legal, and reputational risks rather than promote genuine human rights oversight.",https://finnhub.io/api/news?id=c51a6ef49407a0841d82cbb692d65316e522062053495c02673b9aa66bc7d637,Yahoo,company
MSFT,2025-11-12 16:27:17+00:00,OpenAI won't buy Intel's AI chips — even after Trump took a stake,Intel's absence from OpenAI's vendor list reflects more than just technical shortcomings. It's a Silicon Valley soap opera,https://finnhub.io/api/news?id=4fd69ea7755bde38ddc58e2e347f4367766124e1a9fad73f11b9648d78e5182a,Yahoo,company
MSFT,2025-11-12 16:21:52+00:00,Anthropic announces $50B investment in new US data centers to meet AI demand,"Artificial intelligence company Anthropic announced a $50 billion investment in computing infrastructure on Wednesday that will include new data centers in Texas and New York.  Anthropic, maker of the chatbot Claude, said it is working with London-based Fluidstack to build the new computing facilities to power its AI systems.  A report last month from TD Cowen said that the leading cloud computing providers leased a “staggering” amount of U.S. data center capacity in the third fiscal quarter of this year, amounting to more than 7.4 gigawatts of energy, more than all of last year combined.",https://finnhub.io/api/news?id=73bfd8e8d4ba38946ba6c394814416063b4c876a8c9176314b2464addabe2f9f,Yahoo,company
MSFT,2025-11-12 16:20:56+00:00,MSFT: Microsoft Unveils Multi-Billion Dollar AI Data Center in Portugal,Microsoft (MSFT) Bets Big on European AI with $10B Sines Investment,https://finnhub.io/api/news?id=3eb6e09d32b9cddddf2a1e1ecb93a39abe10d2eb62fa5633f20627670147997b,Yahoo,company
MSFT,2025-11-12 16:07:00+00:00,Inside Microsoft’s New AI ‘Super Factory’,The tech giant is building out huge data centers among the most advanced in the world as it rushes to meet demand for AI computing power.,https://finnhub.io/api/news?id=16de5bbdefe9b8c42552dc761e2e29f6416068a17779825a4eac92d69ac22c41,Yahoo,company
MSFT,2025-11-12 15:37:58+00:00,Defense startup Govini founder Eric Gillespie charged in child sex sting,Govini has a $900-million U.S. government contract and multiple deals with the Pentagon.,https://finnhub.io/api/news?id=3ba68f5591caf9e3164970e49104d803752c8d0a5615c45fa6b2c87e1b5549d3,CNBC,company
MSFT,2025-11-12 15:18:42+00:00,Microsoft Expands Danish Quantum Facility With Second Global Lab,New Lyngby site becomes company's largest quantum research hub worldwide.,https://finnhub.io/api/news?id=600fc84149eba65d43df1ad0d141b8fa0523d7725da2699f6a6eb73fe4f24a7f,Yahoo,company
MSFT,2025-11-12 15:17:05+00:00,Anthropic Will Spend $50 Billion to Build US Data Centers,"Anthropic PBC will spend $50 billion to build custom data centers in the US. They'll start coming online in 2026 according to the company. OpenAI, Meta Platforms Inc., Google, Microsoft Corp., Nvidia Corp. and other leading tech companies plan to collectively spend hundreds of billions of dollars on data centers to support AI. Bloomberg's Ed Ludlow reports.",https://finnhub.io/api/news?id=ee15f3518c34056cd72e55246f8835ac4ab580bed2653fe6cdaf1c3d8ae3b5b7,Yahoo,company
MSFT,2025-11-12 14:53:00+00:00,Arm Stock Delivered a Smashing Quarter. It Wasn't Enough.,"Arm showed off accelerating growth in its recent report, but the stock still fell.",https://finnhub.io/api/news?id=4ea4650cae551241b7226db944aa9cb823d927d48c1d5f932319f204ea6f7b93,Yahoo,company
MSFT,2025-11-12 14:21:57+00:00,Investors Now See Some Corporate Bonds as Safer Bets Than Government Debt,"In corporate boardrooms since the pandemic era, executives have dealt with the rise in interest rates by keeping budgets lean and reducing overall indebtedness.  Meanwhile, governments in rich countries continue to spend, with the average debt-to-output ratio across the Group of Seven industrialized nations set to keep rising until the end of this decade at least.  The result: Investors demand lower yields for bonds issued by Microsoft Corp., Airbus SE, L’Oreal SA, and Siemens AG than they do for their countries of origin.",https://finnhub.io/api/news?id=29d1473792cde98b6acc9d6893d8e0dc4713db63f9baa0495b2c2215dcad07d4,Yahoo,company
MSFT,2025-11-12 14:20:29+00:00,Microsoft announces more than $10bn in AI investment in Portugal,"The investment will see Microsoft, in collaboration with Nscale, Nvidia and Portugal’s Start Campus, install 12,600 next-generation NVIDIA GPUs in Sines.",https://finnhub.io/api/news?id=cd59a64c7e138fd5d8d1a685523c2154e6afb20ffc4fbb769446e11156dd1b15,Yahoo,company
MSFT,2025-11-12 14:05:00+00:00,eMazzanti Technologies Offers Complimentary Azure Master Classes for Business Leaders,"eMazzanti Technologies, a leading Managed Services Provider and Microsoft Solution Partner with more than 20 years of customer success, is pleased to announce a series of complimentary 60-minute Azure Master Classes for business leaders evaluating cloud adoption or seeking to optimize their existing Microsoft Azure environments.",https://finnhub.io/api/news?id=03fa5ccb3d49eeeb1fc02f444107c5fc5e3060a6b8a3a3a8875bd6ba7b78f262,Yahoo,company
MSFT,2025-11-12 14:03:00+00:00,"Marc Brown, Former Microsoft CVP, Joins Syncro Board of Directors Amid Strategic ITSM Initiatives and Accelerated Growth","TAMPA, Fla., November 12, 2025--Marc Brown, former Microsoft CVP, joins the Syncro Board of Directors amid strategic ITSM initiatives and accelerated growth.",https://finnhub.io/api/news?id=c569abae22944e5f6ca7dd6c99b7e00048d246342c33e567e02afeab3bef7bc8,Yahoo,company
MSFT,2025-11-12 14:02:00+00:00,Nokod Security Unveils Adaptive Agent Security for Real-Time Protection Across the Agent Development Lifecycle,"New solution delivers end-to-end runtime visibility, risk detection and security controls for AI agents built by no-coders and citizen developersNEW YORK and TEL AVIV, Israel, Nov. 12, 2025 (GLOBE NEWSWIRE) -- Nokod Security, the leading security platform for AI-assisted Citizen Application Development Platforms (CADP), today announced the launch of Adaptive Agent Security, a comprehensive solution that delivers real-time visibility, governance, and protection from threats across the Agent Devel",https://finnhub.io/api/news?id=db090e157533a6b72c52728857fa5000e0695f36369c605d0ceeb2a7d6381b83,Yahoo,company
MSFT,2025-11-12 14:00:00+00:00,"InfoSum introduces Beacons, the next generation of AI-ready technology for cross-cloud data collaboration","LONDON & NEW YORK, November 12, 2025--Reimagined infrastructure will deploy directly into customer environments across Amazon Web Services (AWS), Google Cloud, and Microsoft Azure",https://finnhub.io/api/news?id=917b86e8007f785574f1fb26d8083c4bf2af310ab357769bcec9ed2c32f44652,Yahoo,company
MSFT,2025-11-12 14:00:00+00:00,Preservica Integrates Active Digital Preservation with Microsoft 365 Archive,"BOSTON, MA AND OXFORD, UK / ACCESS Newswire / November 12, 2025 / Preservicais expanding its ongoing collaboration with Microsoft with a new integration to bring embeddedActive Digital Preservation™toMicrosoft 365 Archive . The latestPreserve365®integration ...",https://finnhub.io/api/news?id=b0e0878b745ac90be510cfa9c272ee1fea89e044738520e3e05fb8fe6db006cd,Yahoo,company
MSFT,2025-11-12 14:00:00+00:00,Corsica Technologies Accelerates National Growth and Enterprise Innovation Through Acquisition of AccountabilIT,"GREENVILLE, S.C., November 12, 2025--Corsica Technologies, a leading national managed service provider (MSP) and industry pioneer in AI-enabled automation, announced today the acquisition of AccountabilIT (AIT), a highly regarded MSP recognized for its robust cybersecurity offerings, deep Microsoft expertise, and trusted client relationships throughout the western region of the United States. This strategic move positions Corsica Technologies to deliver AI-enabled managed IT, cybersecurity and M",https://finnhub.io/api/news?id=c8e80ccdd0aafbcf2d27ccc38a4a420d005af995be01008c1db2860590287c39,Yahoo,company
MSFT,2025-11-12 13:28:00+00:00,Will AWS' Growing Capital Spending Boost or Burden Amazon Stock?,AMZN's more than $75 billion capital spending plan for AWS infrastructure positions the cloud leader to capitalize on surging AI demand despite near-term margin pressure.,https://finnhub.io/api/news?id=95c56392aa5482d538377eae215acdb69e6980d21ef540b792058ad8b53bb38f,Yahoo,company
MSFT,2025-11-12 13:05:00+00:00,Microsoft's AI Datacenter Expansion: A Game Changer for the Stock?,"MSFT's $34.9 billion fiscal Q1 capex surge funds global AI datacenter expansion, but capacity constraints persist through fiscal 2026 amid intensifying competition.",https://finnhub.io/api/news?id=bf9d47b6c64acf9517f7f28cfffc466f842f6cb46ea39a1d4dfa89fc2384fce2,Yahoo,company
MSFT,2025-11-12 13:00:00+00:00,"VEIR Successfully Demonstrates 3-Megawatt Superconducting Power Delivery for AI Data Centers, Eliminating Critical Growth Bottleneck","WOBURN, Mass., November 12, 2025--Superconducting tech startup VEIR demonstrates first-generation power delivery solution for critical AI data center energy bottleneck.",https://finnhub.io/api/news?id=7841d9b36fd0d47b9ae4c5d17ec98661685789c61df24ecd574ba1cc6d4df29d,Yahoo,company
MSFT,2025-11-12 12:59:00+00:00,"XiFin Achieves HITRUST i1 Certification for Key Cloud-Hosted Systems, Further Strengthening Its Commitment to Cybersecurity and Data Protection","SAN DIEGO, November 12, 2025--XiFin, Inc., a leader in revenue cycle management (RCM), including billing solutions enhanced with embedded artificial intelligence (AI), today announced that it has earned HITRUST i1 Certification for multiple platforms residing at Microsoft Azure, reinforcing its longstanding commitment to safeguarding sensitive healthcare and financial data through rigorous information security standards.",https://finnhub.io/api/news?id=35bcb97897df88df447c58610ce1efee4712a0a6bfa43a190a743e1bea89f91f,Yahoo,company
MSFT,2025-11-12 12:40:06+00:00,Groww raises nearly $750M in IPO as India’s retail investing boom continues,"The company's shares opened 12% above their issue price, at ₹112, and closed at ₹128.85, lending it a market cap of ₹795 billion (approximately $9 billion).",https://finnhub.io/api/news?id=67e6e760bfe99a52c5ddca13bf4074f4854ce434cb6bf5f40e83b0dbedc7536c,Yahoo,company
MSFT,2025-11-12 12:32:55+00:00,I'm Pressing Pause On IonQ (Downgrade) And Loading Up On QTUM Instead,Discover investment insights on IonQâs quantum computing growth and the QTUM ETF.,https://finnhub.io/api/news?id=5c524a3fc2b3550c87a2b1099664152781dd9ac624c1ddca2f3e880c71d625e0,SeekingAlpha,company
