ticker,datetime,title,summary,url,source,category,sent_positive,sent_neutral,sent_negative,sent_net
AAPL,2025-11-08 00:03:44+00:00,"Dividend Champion, Contender, And Challenger Highlights: Week Of November 9","Get the latest weekly updates on dividend changes, ex-dividend and pay dates for Dividend Champions, Contenders, and Challengers.",https://finnhub.io/api/news?id=0f24cb5e688ce530a1a3feef456bd575a4ec37a9f09b01feab5a82b5eee9fb0e,SeekingAlpha,company,0.027457596734166145,0.9318446516990662,0.040697745978832245,-0.0132401492446661
AAPL,2025-11-07 19:58:26+00:00,Arm Stock Triggers Sell Rule And Breaches Key Support Level,Arm stock triggered a sell rule from a recent buy point and breached a key support level after the company's earnings report.,https://finnhub.io/api/news?id=086e6d7d42ce64117b5e302bcc5d2f081486cb1a2ae28feadc5584397fa55d60,Yahoo,company,0.016036804765462875,0.03294806182384491,0.951015055179596,-0.9349782504141331
AAPL,2025-11-07 18:47:08+00:00,US telcos Q3 2025: Mobile carriers bundles and deals analysis,"US telco earnings in Q3 2025 show increasing convergence of mobile and cable services as players push bundled, cross‑service offers.",https://finnhub.io/api/news?id=52831f7135d2211c4989c19d07f1ca782475eca644b70bba728425dcc978bfad,Yahoo,company,0.9477955102920532,0.0363021194934845,0.015902487561106682,0.9318930227309465
AAPL,2025-11-07 18:18:03+00:00,I’m Watching For This Upcoming IPO After The Company Replaced Chinese Manufacturing,"Norfolk, Virginia based Mutant Inc. are stepping up their game to fill the new supply chain void created by tariffs. With departing Chinese suppliers no longer able to compete due to the reciprocal tariffs, Mutant Inc. is taking over supplying batteries and other energy solutions for clients old and new, which may include such entities ... I’m Watching For This Upcoming IPO After The Company Replaced Chinese Manufacturing",https://finnhub.io/api/news?id=86af03b8b4769ab707adfb6eadcaf2d29a3aa29c056adc43a54ab9e360c7d0e3,Yahoo,company,0.3476477265357971,0.5739527940750122,0.07839953899383545,0.26924818754196167
AAPL,2025-11-07 18:14:09+00:00,Warren Buffett vs. Michael Saylor: Who Made the Better Investment This Quarter,"Warren Buffett and Michael Saylor represent two starkly different investment philosophies in the market. Buffett, Berkshire Hathaway‘s (NYSE:BRK-A)(NYSE:BRK-B) legendary Oracle of Omaha, favors safe, liquid assets like U.S. Treasury bills to preserve capital for future opportunities in undervalued stocks. In contrast, Saylor, executive chairman of Strategy (NASDAQ:MSTR), bets aggressively on Bitcoin (CRYPTO:BTC) as a hedge ... Warren Buffett vs. Michael Saylor: Who Made the Better Investment Thi",https://finnhub.io/api/news?id=8d21d3ae7fa54bd3381d118837d78bf1ea7face7554ae2b6f29a72818df3fd1f,Yahoo,company,0.08342035859823227,0.8468601703643799,0.06971951574087143,0.01370084285736084
AAPL,2025-11-07 18:09:54+00:00,"Nvidia Hits $5 Trillion, But Can It Survive Without China?",CEO Jensen Huang shuts down China chip rumors as Wall Street weighs the limits of the AI supercycle.,https://finnhub.io/api/news?id=ef7252e1c766bbbb0f683ec3af6bb5f4e14618f82013ef79f5a4dbf61ef09774,Yahoo,company,0.01181652769446373,0.07549244910478592,0.9126909375190735,-0.9008744098246098
AAPL,2025-11-07 18:02:10+00:00,This Market Correction Will Separate The Wheat From The Chaff,Reallocating to high-quality Magnificent Seven stocks could help mitigate risks amid market corrections. Learn more about what's going on in the market.,https://finnhub.io/api/news?id=91875fab82db6a6db1d0161291f39a29dd18f6529d2f4b2635f200a85f7ad24b,SeekingAlpha,company,0.05879003554582596,0.9140529036521912,0.027157042175531387,0.03163299337029457
AAPL,2025-11-07 16:19:33+00:00,Should Rachel Reeves increase taxes on expensive homes? How readers voted,"Creating new, higher council tax bands on the most expensive homes is one option that's reportedly being considered.",https://finnhub.io/api/news?id=e8d34258f54448a815335da3cd5cdf2f28a18ef857396b8ca069c188a2d437ae,Yahoo,company,0.13335372507572174,0.8470292687416077,0.019616983830928802,0.11373674124479294
AAPL,2025-11-07 16:15:07+00:00,PRF: A Well-Diversified Large Value ETF,"The Invesco RAFI US 1000 ETF offers superior diversification, value, and dividend growth. Learn more about the fund.",https://finnhub.io/api/news?id=2cbcee9def8c766c55b59b0af1a2ae0de8d0512f4fe9b6e5e1716d4d05d3d9dd,SeekingAlpha,company,0.704993724822998,0.28684568405151367,0.008160633035004139,0.6968330917879939
AAPL,2025-11-07 16:06:52+00:00,Microsoft Eyes Longest Selloff Since 2011 as AI Trade Weakens,"Shares fell as much as 0.8% on Friday, and if they end the trading session lower it would be the longest period of declines for the software company since a nine-day drop that ended in November 2011.  The stock has declined 8.6% over the eight-day stretch, erasing nearly $350 billion in market valuation.  The stock hasn’t had a positive session since it reported its quarterly results in late October.",https://finnhub.io/api/news?id=d8061e9b51c366ae15c756b54548ca9dec71526d03ef273e9934d296f4af1a1b,Yahoo,company,0.00849579181522131,0.01687783934175968,0.974626362323761,-0.9661305705085397
AAPL,2025-11-07 15:39:21+00:00,"Alcoa, Ball and Unilever unveil ELYSIS zero-carbon smelted aerosol can",The partners describe the offering as among the lowest‑carbon options available.,https://finnhub.io/api/news?id=7238b5a3afa36c2bf564f27c314e7f33085e393bc0e57cf70074674000b58790,Yahoo,company,0.053407277911901474,0.711267352104187,0.2353254109621048,-0.18191813305020332
AAPL,2025-11-07 15:06:00+00:00,MP Materials Stock Jumps After Earnings. The Market ‘Has It Wrong’ on Rare Earths.,Shares of rare earth companies are down again after MP and USA Rare Earth reported third quarter numbers.,https://finnhub.io/api/news?id=4cc32aa1235cd236a0c7d638c861c9186958b8a383d53b1480403ed14ce08535,Yahoo,company,0.00861294474452734,0.0196517463773489,0.9717352986335754,-0.9631223538890481
AAPL,2025-11-07 14:34:18+00:00,Nvidia-Like Gains: This Quantum Computing ETF Could Deliver Multibagger Returns,"Quantum computing stocks have been on a tear in recent months, and while the rally has cooled down in recent days, many still see it as a golden ticket to multibagger gains. But buying individual stocks may not be the right way to gain exposure, and I’d look into ETFs like WisdomTree Quantum Computing Fund ... Nvidia-Like Gains: This Quantum Computing ETF Could Deliver Multibagger Returns",https://finnhub.io/api/news?id=6960adf78765135e64e671aeca6a99ceb10a512e2602d6968e911df61f5db9cc,Yahoo,company,0.4354223608970642,0.4973675012588501,0.06721022725105286,0.36821213364601135
AAPL,2025-11-07 14:12:05+00:00,Taiwan's Export Boom Ignites as AI Gold Rush Lifts Global Chip Demand,Record-breaking US shipments and trillion-dollar AI spending fuel Taiwan's fastest export surge since 2010.,https://finnhub.io/api/news?id=23b55c784c940aab68f8c9c535f26ceabcad159c427f95946eb2a010c649df15,Yahoo,company,0.7943048477172852,0.09867994487285614,0.1070152297616005,0.6872896179556847
AAPL,2025-11-07 13:08:08+00:00,Apple Warns EU Rules Could Make iPhones Less Safe,Company says forced app payment changes raise risks for users,https://finnhub.io/api/news?id=dc1c9d2d4f7795c838ed1abaf09e6be577a74648e3a484af870c670ddf7c6093,Yahoo,company,0.019468815997242928,0.03206362575292587,0.948467493057251,-0.928998677060008
AAPL,2025-11-07 13:01:32+00:00,"Top Funds Gobble Up These 4 Stocks — And Nibble On Nvidia, Palantir","While Nvidia, Palantir, Google and Apple earn a spot on the menu, the best mutual funds devour these four stocks.",https://finnhub.io/api/news?id=37701810cdacd38040200ec6f1d10636ed7202ce3115bfbe4cd65fb3e6e04e6e,Yahoo,company,0.03949151933193207,0.9213394522666931,0.03916897997260094,0.000322539359331131
AAPL,2025-11-07 12:38:01+00:00,Cloud AI Update - Atlas Compute Powers AI Growth With New Florida Data Center,"Atlas Compute has announced the development of a 240-megawatt AI-ready data center campus in Central Florida, with plans to expand up to 1 gigawatt of high-performance computing capacity. This initiative aims to bolster AI, cloud, and machine learning applications by utilizing state-of-the-art liquid-cooled facilities optimized for NVIDIA GPU-powered workloads. Designed in partnership with Penguin Solutions, the campus will feature advanced thermal management and compute-optimized...",https://finnhub.io/api/news?id=987bdd141dee6c32f40442a9d973f7bc4eeb1d4d5da086a097d5c1d6567d1a84,Yahoo,company,0.8048539757728577,0.18797053396701813,0.007175534497946501,0.7976784412749112
AAPL,2025-11-07 12:30:14+00:00,"Apple iPhone 17 Sales Soar in India, Fueling Market Momentum",India emerges as Apple's next big growth story after the U.S. and China,https://finnhub.io/api/news?id=565f0bf8bc12ba4e9f09faf72bf77cd79c500007976508cca901334f6a7a6c18,Yahoo,company,0.9365155696868896,0.04094545915722847,0.02253895252943039,0.9139766171574593
AAPL,2025-11-07 11:43:31+00:00,Affirm CEO says furloughed federal employees are starting to lose interest in shopping,"Affirm CEO Max Levchin said as the government shutdown drags on, there are signs of shifting shopping habits from federal workers.",https://finnhub.io/api/news?id=e08ae8c2ad918e5f213c473bc72a40b959856983966552cf8d529292430ba2c4,CNBC,company,0.018451234325766563,0.04218064993619919,0.9393680095672607,-0.9209167752414942
AAPL,2025-11-07 11:32:07+00:00,How Trump’s tariffs are crushing small businesses while big retailers weather the costs,"While large retailers like Walmart and Amazon are mostly brushing off Trump's tariffs, small businesses are being crushed under the weight of them.",https://finnhub.io/api/news?id=dba47902469e8f8a7b077ed3924bd196de2a04afba8a854fadfbc48833f6ef96,CNBC,company,0.034753985702991486,0.3195887804031372,0.6456573009490967,-0.6109033152461052
AAPL,2025-11-07 11:03:08+00:00,Tesla Stock: 6 Warning Signs Every Investor Should Know,Tesla may be on shakier ground than investors want to admit. Here are six red flags that could indicate deeper problems at a company tightly bound to Elon Musk.,https://finnhub.io/api/news?id=5f2c5a782dbea21fe548afa1fcbc3394c99d4fda9c757420dfba1656b8a5da81,Yahoo,company,0.014207061380147934,0.10430852323770523,0.88148432970047,-0.867277268320322
AAPL,2025-11-07 10:10:00+00:00,The Stock Market Has Only Done This 4 Times This Century. Is Warren Buffett Getting Nervous?,Berkshire Hathaway just revealed a record cash hoard.,https://finnhub.io/api/news?id=9f68de3646ec31e3d61f44e254ff5142a1e9a0d7599d4c5079aaa6f52a95651a,Yahoo,company,0.04808554798364639,0.796746015548706,0.15516845881938934,-0.10708291083574295
AAPL,2025-11-07 10:05:42+00:00,$1.7 trillion-dollar ETF giant State Street says 401(k) market about to face new low-cost challenger,"State Street SPDR ETFs are coming to 401(k) market in new low-cost, economies of scale challenge to the mutual fund status quo that dominates retirement plans. ",https://finnhub.io/api/news?id=b699aa6ea19b1924b0cfacbb3735c4277dcc4459154fea51f88a0bbe3e880270,CNBC,company,0.8949873447418213,0.09176909178495407,0.013243569992482662,0.8817437747493386
AAPL,2025-11-07 09:20:48+00:00,MP Materials CEO warns investors to approach suddenly hot rare earths industry with caution,"MP Materials CEO James Litinsky said he doesn't want investors ""to get burned,"" cautioning them about the industry's difficult economics. ",https://finnhub.io/api/news?id=19e9ed893ff6996ec4d4fbd9400632feac45922bfa88c80c3e8ffd1c77fdf059,CNBC,company,0.06306415051221848,0.38023361563682556,0.556702196598053,-0.4936380460858345
AAPL,2025-11-07 09:01:16+00:00,MP Materials Corp (MP) Q3 2025 Earnings Call Highlights: Record Production and Strategic ...,"MP Materials Corp (MP) reports significant production increases and strategic advancements, setting the stage for future profitability and expansion.",https://finnhub.io/api/news?id=3688ffe947c22e0e5f91860e8e077be82f95a3cbd32c571f5a14187056425007,Yahoo,company,0.9542818665504456,0.029770657420158386,0.01594739966094494,0.9383344668895006
AAPL,2025-11-07 09:00:00+00:00,Inside Corning’s Bold Bid to Revive the U.S. Solar Industry,The company is opening a massive plant in Michigan to make a critical component of solar panels. It’s going toe to toe with China.,https://finnhub.io/api/news?id=df89e0d150c0d9a113bd94ddf5856c5068761363717e95cbbce51c1099d7b5e8,Yahoo,company,0.8017776012420654,0.1884627640247345,0.009759573265910149,0.7920180279761553
AAPL,2025-11-07 07:46:31+00:00,UK house prices see fastest growth since January as mortgage approvals rise,"The average house price in the UK rose by 0.6% in October, or £1,647, bringing the cost of a typical home up to £299,862",https://finnhub.io/api/news?id=dcda32847f2b748ba52f0c804d030017a80fb1b766b79703d44c71eaf418d103,Yahoo,company,0.9428548812866211,0.03842586651444435,0.018719282001256943,0.9241355992853642
AAPL,2025-11-07 06:39:00+00:00,"Zacks Investment Ideas feature highlights Microsoft, Nvidia, Amazon, Alphabet and Apple","Microsoft, Nvidia, Amazon, Alphabet and Apple have been highlighted in this Investment Ideas article.",https://finnhub.io/api/news?id=d2eec7551356215d92f7e5395008f7d28aa23fc3e5adf62c83c913e6ddaaaddc,Yahoo,company,0.033747244626283646,0.9473521113395691,0.018900614231824875,0.01484663039445877
AAPL,2025-11-07 02:53:56+00:00,"This Dancing Elephant Stomps All Magnificent 7 Stocks Except Google, Even Eclipsing Nvidia","Trouncing six of the Magnificent Seven members this year, top funds bet on IBM stock as it even eclipses Nvidia.",https://finnhub.io/api/news?id=b9d31a14ca9e5e96e98027727a562a3e8dad134f9f6434d7e1174ed765c171cd,Yahoo,company,0.03818045184016228,0.5468708872795105,0.4149486720561981,-0.37676822021603584
AAPL,2025-11-06 19:44:19+00:00,Apple could make $133 billion a year on humanoid robots by 2040: Morgan Stanley,Morgan Stanley predicts Apple could generated $133 billion a year from humanoid robots by the year 2040.,https://finnhub.io/api/news?id=c125e263ad3c5bd66014dffce290d398a771fa20c7a8df5f82b796b5fa1b311d,Yahoo,company,0.2182794064283371,0.7646272778511047,0.017093366011977196,0.2011860404163599
AAPL,2025-11-06 19:22:42+00:00,"Duolingo: Speaking Growth Fluently, Despite the AI Noise","Duolingo is a strong growth story, as AI fears seem overstated and its vast user base, brand, and monetization potential point to significant upside.",https://finnhub.io/api/news?id=76d6f032f1d7bbbdb9e02dc2fff59a393b3dcee9d81dea52d80ddf8702df0b6d,Yahoo,company,0.9506630301475525,0.03757230564951897,0.01176468562334776,0.9388983445242047
AAPL,2025-11-06 18:58:38+00:00,Apple Regains Safe-Haven Status as AI Trade Looks Shakier,"It was a replay of Tuesday’s session, when Apple eked out an advance and the broader index sank 2.1%.  Over the past month, Apple has risen more than 5%, while the tech-heavy index is up less than 0.5%.  The outperformance is a return to form for Apple, whose cash-generating prowess and rock-solid balance sheet have in past bouts of turbulence left it relatively unscathed.",https://finnhub.io/api/news?id=7468b4d9fb50d418a0baa271860190945d081114e3f30f7f22e3ec4ce9e344f5,Yahoo,company,0.9343395829200745,0.01924724318087101,0.04641318321228027,0.8879263997077942
AAPL,2025-11-06 18:21:19+00:00,Tech stocks suffer fresh sell-off over AI bubble fears,Over $420bn (£320bn) was wiped off the value of the biggest seven US tech giants on Thursday afternoon as a fresh sell-off took hold.,https://finnhub.io/api/news?id=b54052bfa628f42b7565d3114d5fc791c51b785429345347244fd64c6b825d89,Yahoo,company,0.010247863829135895,0.01993170566856861,0.969820499420166,-0.9595726355910301
AAPL,2025-11-06 18:14:24+00:00,‘Jenga Tower’ US Economy Teeters as Middle Class Pulls Back Spending,"This dichotomy between the haves and have-nots isn’t new, but the economic strain is now bleeding from the lowest earners to the middle class, creating an even starker divide that some economists say makes the economy more susceptible to a downturn.  The richest 10% of households are fueling nearly half of total US spending, thanks to a stock market surge that has boosted wealth and in turn propelled economic output this year.  Meanwhile, lower-income families are pulling back in the face of tight budgets, still-high living costs and a raft of corporate layoffs.",https://finnhub.io/api/news?id=d98ee64dabe366ad71670ff86f9be3b86bcbdf1f05ae00c8c6a25e35de6904cd,Yahoo,company,0.017005978152155876,0.02854357846081257,0.9544503688812256,-0.9374443907290697
AAPL,2025-11-06 17:43:00+00:00,"AI ETF Helps Roundhill Double in Size to $10 Billion. It’s ‘Only the Beginning,’ Says CEO.",Roundhill saw inflows of more than $5.5 billion this year. Its actively-managed AI ETF is up 56% this year.,https://finnhub.io/api/news?id=7a886cb4756fa632ba2701994fa143fa175719b19f22c3ef8daad3b5364d4039,Yahoo,company,0.9486595988273621,0.03874962031841278,0.012590802274644375,0.9360687965527177
AAPL,2025-11-06 17:33:00+00:00,Apple could reboot Siri to finally please users,"Apple’s (AAPL) next major AI move could potentially come from an unlikely source: Google. According to Bloomberg, the iPhone maker is closing in on a deal worth nearly $1 billion per year to power Siri with Google’s Gemini AI, one of the more surprising collaborations in Big Tech history. For ...",https://finnhub.io/api/news?id=7e8caf7e46029d27a76b81f4edeaea9c3cb7c2d329fe7f9381507b301903015b,Yahoo,company,0.8331555128097534,0.15781523287296295,0.009029317647218704,0.8241261951625347
AAPL,2025-11-06 17:29:03+00:00,"Exclusive-SAP to offer concessions to settle EU antitrust probe, stave off fine, sources say","BRUSSELS (Reuters) -SAP, Europe's largest software maker, is set to make a formal offer of concessions shortly to ​settle an EU antitrust investigation and stave off a possible hefty fine, people ‌with direct knowledge of the matter said.  The European Commission, which started an investigation into SAP's software practices in September, is expected to seek market feedback from rivals and customers in the coming weeks,⁠ the people said.",https://finnhub.io/api/news?id=61f400901ae953dc1810e9158a9f03b722d9c60fe1a3c6f01300822f828dbac3,Yahoo,company,0.4016009271144867,0.5165373682975769,0.0818617194890976,0.3197392076253891
AAPL,2025-11-06 17:23:32+00:00,Huawei Debuts Ultrathin iPhone Air Rival Priced at $590,"The new Huawei Mate 70 Air measures 6.6mm thick and costs 4,199 yuan ($590), significantly undercutting the $999 iPhone Air on price but failing to match its extreme thinness.  Apple introduced the Air branding to its smartphone lineup for the first time with the new phone launched alongside its iPhone 17 generation this fall — and Huawei is openly going against it by adopting the same moniker.  China’s smartphone makers have shown a greater willingness to confront Apple this year.",https://finnhub.io/api/news?id=4a05d18f9a723e2f14b36e54eb4a54b134d76b3920df3520bda86fbe6e2dac23,Yahoo,company,0.14977213740348816,0.42788079380989075,0.42234712839126587,-0.2725749909877777
AAPL,2025-11-06 17:05:17+00:00,"Qualcomm Growth Could Slow in Q2 After Strong Q4, BofA Says","Qualcomm (QCOM) reported strong Q4 results but growth could slow in fiscal Q2, BofA Securities said",https://finnhub.io/api/news?id=b855e3ff63a6f28c0ee01ff486948160fa0779835c46e590f50a9c827463ad94,Yahoo,company,0.011221123859286308,0.03464534506201744,0.9541335105895996,-0.9429123867303133
AAPL,2025-11-06 16:34:05+00:00,"Snap Faces User Growth Uncertainty Amid Age Verification Rollout, Morgan Stanley Says","Snap (SNAP) delivered Q3 results ahead of Morgan Stanley's expectations, but its forward user growth",https://finnhub.io/api/news?id=509121071987f9ea610ac1520742bbcac528325272aaeac99096fbb8506a660d,Yahoo,company,0.799294650554657,0.03115365281701088,0.16955165565013885,0.6297429949045181
AAPL,2025-11-06 16:24:52+00:00,Apple’s Record Quarter Hints at Something Huge Coming: Is AAPL Stock a Buy Now?,"Besides a stellar quarter, Apple’s $1 billion AI move could propel its stock higher.",https://finnhub.io/api/news?id=15f51dc8def39e9dcb0d3359e350d70404b1ee57476c3ee545ba1eaabd8d37d9,Yahoo,company,0.9339666366577148,0.04636259004473686,0.01967078447341919,0.9142958521842957
AAPL,2025-11-06 16:20:57+00:00,Six of the ‘Magnificent Seven’ Tech Stocks Are Sliding,"It's an ugly day for the ""Magnificent Seven"" tech stocks. Shares of the big tech behemoths, who have led the market's monster artificial-intelligence rally over the past few years, declined Thursday after a brief reprieve in the prior session.",https://finnhub.io/api/news?id=a9ad8d84e93e021bab61dbb516e474ab6fb1a340f389b6fc08d012cff738a3b5,Yahoo,company,0.009755516424775124,0.017798522487282753,0.9724460244178772,-0.9626905079931021
AAPL,2025-11-06 15:35:01+00:00,Jim Cramer resets AI stock ‘buy’ list for rest of 2025,"CNBC’s ""Mad Money"" host Jim Cramer isn’t beating around the bush with his revamped AI buy list. In a market that’s overflowing with a ton of hype, his latest AI stock picks underscore a disciplined twist with speculation. Instead of chasing the flashy start-ups or profitless plays, Cramer handpicks ...",https://finnhub.io/api/news?id=523a5c49f25fc639a4336606699f868f8f69a5b6947694b8765915ce0a7f7ec2,Yahoo,company,0.08047632873058319,0.8974021077156067,0.022121569141745567,0.058354759588837624
AAPL,2025-11-06 15:25:02+00:00,"Apple Stock ‘Won’t Work’ Until This 1 Thing Happens, According to Analysts","Apple’s upbeat forecast thrilled Wall Street, but analysts warn the stock momentum won’t sustain until a notable iPhone replacement cycle.",https://finnhub.io/api/news?id=4783427bd26ee40a1172e3c9dcfeb51f721f7a6e340048e0a0e7ba592fcbddb2,Yahoo,company,0.23723480105400085,0.1555800586938858,0.6071851253509521,-0.3699503242969513
AAPL,2025-11-06 15:20:03+00:00,Apple: iPhone 17 Cycle Setting Up A Classic Holiday Beat,Apple Inc.'s iPhone 17 sales outpace iPhone 16 with strong margins. Click for my updated look at AAPL stock prospects following its fiscal Q4 earnings.,https://finnhub.io/api/news?id=4ced50e40fd869aee8c6c6fe2c2f95e54d79935fb5e72ad845ea24cbf14d6a53,SeekingAlpha,company,0.571871280670166,0.39944133162498474,0.028687432408332825,0.5431838482618332
AAPL,2025-11-06 15:16:08+00:00,This 'Big Short' Investor Owns Every Magnificent 7 Stock Except The One He Thinks Has A Cult-like Following,"""Big Short"" investor Steve Eisman's portfolio includes every stock in the Magnificent 7 except for one, whose shareholders he likened to a cult for their unwavering belief in its long-term future. ""I will confess that of the Mag 7, I own every single one of them except for Tesla,"" said Eisman, during a recent appearance on the ""Lemonade Stand"" business podcast. The Magnificent 7 includes Nvidia Corp. (NASDAQ:NVDA), Microsoft Corp. (NASDAQ:MSFT), Apple Inc. (NASDAQ:APPL), Alphabet Inc. (NASDAQ:GO",https://finnhub.io/api/news?id=cf82ae32b7682dd98478cc8b1d3a06678774d6b54f812e477b97c0b591de69b4,Yahoo,company,0.02955590933561325,0.9468861222267151,0.02355792373418808,0.005997985601425171
AAPL,2025-11-06 13:54:20+00:00,Wall Street Lunch: Nvidia's Jensen Takes U-Turn After Saying China Will Win AI Race,Nvidia (NVDA) CEO Jensen Huang is backtracking on his bold prediction that China will beat the U.S. in the AI race.,https://finnhub.io/api/news?id=e69b41af2dd2a1db91a028a25371e0fd7917aa21200dc3a054c879164de16994,SeekingAlpha,company,0.2217452973127365,0.7069555521011353,0.07129917293787003,0.15044612437486649
AAPL,2025-11-06 13:38:02+00:00,Warner Bros. Discovery Q3 2025 Earnings Reveal Why Buyers Are Circling,"Warner Bros.'s balance sheet is also making progress as FCF accretion expands, contributing favorably to its ongoing deleveraging efforts. Read why WBD is a Hold.",https://finnhub.io/api/news?id=5670008e46a6329a3c06311007b2263e3f1a55938a603716be9aa65ab8776c8b,SeekingAlpha,company,0.8954967856407166,0.09300263971090317,0.011500566266477108,0.8839962193742394
AAPL,2025-11-06 12:59:50+00:00,BST: AI-Focused Portfolio With A Monthly Payout,The BlackRock Science and Technology Trust offers tech exposure and a 7.25% monthly yield. Learn about its new growth strategy and key holdings.,https://finnhub.io/api/news?id=8919fb4ed5998fde95373add2d0dffc3ec0fc9d77f896532f0299023ac2b44bc,SeekingAlpha,company,0.15789368748664856,0.8335993885993958,0.00850696675479412,0.14938672073185444
AAPL,2025-11-06 12:24:11+00:00,"Apple: There's A Time To Be Greedy, But Not Now",Apple's strong iOS ecosystem and AI plans could drive growth. Read why investors need to be patient with AAPL stock.,https://finnhub.io/api/news?id=e1b74ebf93db7ea5ad0bfb031797e6d25a957b35a1ca55815d761e8c8ec82bc7,SeekingAlpha,company,0.08822625875473022,0.8908166289329529,0.020957088097929955,0.06726917065680027
AAPL,2025-11-06 10:05:25+00:00,Cramer's Stop Trading: Apple,Jim Cramer breaks down why he's keeping an eye on shares of Apple.,https://finnhub.io/api/news?id=e0838dd888778e269226014afdd46e29ee9c49c059606d7f3733d5f08c6cfe6c,CNBC,company,0.032482363283634186,0.8644184470176697,0.10309914499521255,-0.07061678171157837
AAPL,2025-11-06 09:01:05+00:00,Jim Cramer's top 10 things to watch in the stock market Thursday,The S&P 500 was headed for a higher open this morning after investors yesterday shook off some of the AI-stock valuation worries.,https://finnhub.io/api/news?id=b2817639c545eb8e1d2cbf38d0f5cc0b75ebfbc62919186e95042461dfa83ab3,CNBC,company,0.7652648091316223,0.11421762406826019,0.1205175444483757,0.6447472646832466
AAPL,2025-11-06 07:30:00+00:00,AI Completely Broke The Market - And Most Investors Haven't Noticed Yet,"The current market is dominated by the Mag 7 stocks, driving massive AI-related CapEx and creating a highly concentrated S&P 500. Discover the full analysis here.",https://finnhub.io/api/news?id=4feb287bd0646f98967309a281c886ae82ad10dac872e632a38d8f8b08eac868,SeekingAlpha,company,0.025231221690773964,0.7008285522460938,0.27394017577171326,-0.2487089540809393
