ticker,datetime,title,summary,url,source,category
AAPL,2025-11-17 12:46:27+00:00,Peter Thiel’s Fund Sold Off Entire Nvidia Stake Last Quarter,"The Thiel Macro fund now counts Apple Inc., Microsoft Corp. and a reduced stake in Tesla Inc. as its main bets, according to a 13F filing.  Thiel’s move comes at a time of rising concerns about an AI investment bubble, which turned Nvidia into the world’s most valuable company.",https://finnhub.io/api/news?id=843a1a127c789eb5b10be47dd588e058bdf9e550e46b440af8ee50e6cf975634,Yahoo,company
AAPL,2025-11-17 12:39:58+00:00,Jim Cramer Discusses NVIDIA (NVDA) Ahead Of Earnings,We recently published 10 Stocks Jim Cramer Talked About & Revealed Why He’s Critical Of OpenAI. NVIDIA Corporation (NASDAQ:NVDA) is one of the stocks Jim Cramer talked about. Cramer discussed AI GPU giant NVIDIA Corporation (NASDAQ:NVDA)’s upcoming earnings and the narrative surrounding the firm. His comments included the firm’s China orders and the firm’s Vera […],https://finnhub.io/api/news?id=7433b9412b2afe7591b596de5662002cdb76c08573736d49bb9f33d20e494f36,Yahoo,company
AAPL,2025-11-17 12:11:00+00:00,Netflix Stock Split Kicks in Today. What It Means as Streaming War Heats Up.,"Splits don't change the value of a company, but they are designed to make a stock more affordable for individual investors.",https://finnhub.io/api/news?id=675fbab763836dcc8da541e202d891f64780dc0e13eb79d6a166c830bcc92c72,Yahoo,company
AAPL,2025-11-17 11:40:00+00:00,"These Stocks Are Moving the Most Today: Alphabet, Apple, Nvidia, Dell, XPeng, Tesla, E.W. Scripps, and More",Alphabet rises after Berkshire Hathaway discloses it bought $4.3 billion worth of shares in the parent company of Google in the third quarter.,https://finnhub.io/api/news?id=daf08534b2a0025f637623e7b7c4ba50a13a05a4a3b4c466f372ac5eb065f6f6,Yahoo,company
AAPL,2025-11-17 11:24:06+00:00,Google-parent Alphabet's shares jump as Berkshire reveals big stake,"STORY: Alphabet's shares rose 5.5% in premarket trading on Monday (November 17).Investors jumped in after investing giant Berkshire Hathaway disclosed a stake in the tech firm.It marked what could be one of the final major moves by the group under Warren Buffett's leadership.A filing on Friday showed Berkshire owned 17.85 million shares in Google's parent as of September 30.Reuters calculations show the stake could be worth about $4.93 billion as of the stock's close.Berkshire's move comes as concerns grow over Big Tech's heavy artificial intelligence spending and whether AI valuations are too high.Buffett is due to end his 60-year run as CEO of Berkshire at the end of the year. It was unclear who made the specific purchase at Berkshire, though Buffett usually oversees the larger investments.Berkshire has traditionally avoided tech stocks.While Apple is the group's largest stock holding, Buffett argues it is a consumer-products company rather than a technology bet.",https://finnhub.io/api/news?id=2d13d2d470a3e73c8e253aeb57f12f6a589db933d2e96a246781cd263759f8d0,Yahoo,company
AAPL,2025-11-17 10:03:49+00:00,Bored with index funds? Here are tips for buying individual stocks.,You've heard about people who made a mint on Nvidia. Now you want to invest in individual stocks. But how much is too much? We have tips.,https://finnhub.io/api/news?id=85d2e37617c45a4a417159d8b3953a50a21b51efd53c2f1d0914cb661227189b,Yahoo,company
AAPL,2025-11-17 10:01:46+00:00,"Stocks to Watch Monday: Alphabet, XPeng, Tesla","↗️ Alphabet (GOOG, GOOGL): Warren Buffett’s Berkshire Hathaway (BRK.A, BRK.B) added Google's parent company to its portfolio last quarter and further shrunk its stake in Apple (AAPL). Alphabet shares jumped more than 5% in premarket trading.",https://finnhub.io/api/news?id=a270967f218c0bd56600d2b36f3ace410a109602cb6b5b644d8f4465ea3f0fd6,Yahoo,company
AAPL,2025-11-17 09:57:00+00:00,Best Stock to Buy Right Now: Apple vs. Amazon,Which company has better long-term growth prospects?,https://finnhub.io/api/news?id=135a2baad9a5cf8ce2ebf77bad23a345ae63f4a56f2f8c52794b00a33e41b3bc,Yahoo,company
AAPL,2025-11-17 09:52:55+00:00,Alphabet shares jump after Berkshire makes rare tech bet with $4.9 billion stake,"The stock purchase, a rare bet on technology by ‌Berkshire, comes amid growing concerns over heavy AI spending as tech behemoths splurge hundreds of billions of dollars to build data centers and buy chips ‌that power them.  A filing showed on Friday that Berkshire owned 17.85 million shares in Google's parent as of September 30.",https://finnhub.io/api/news?id=af5685c1a831c71152af009a5f971933a619abe7d0abe2faf04115290cca3795,Yahoo,company
AAPL,2025-11-17 09:52:11+00:00,Michael Burry Just Torched Big Tech's AI Profit Party,"Big Tech's profit story has been running hot for years, but a new wrinkle just arrived from a voice investors tend to monitor.  Michael Burry (Trades, Portfolio)  the Scion Asset Management chief best known for his bet against the housing market before the 2008 crisis  hinted this week that tech giants like Meta (NASDAQ:META) and Alphabet (NASDAQ:GOOG) may be benefiting from earnings that look stronger because of longer depreciation schedules on their servers and chips.",https://finnhub.io/api/news?id=d452c342513befebd018fed1071dbb8ba1709647a4bf2e6586a0efa6cc4e6df2,Yahoo,company
AAPL,2025-11-17 09:32:35+00:00,"Trending tickers: Alphabet, Bitcoin, Netflix, Alibaba and WPP",The latest investor updates on stocks that are trending on Monday.,https://finnhub.io/api/news?id=f44fcca35cb185d0befc3b653f7ae62ac387a92643f8b999fed2384facda725e,Yahoo,company
AAPL,2025-11-17 06:54:07+00:00,Wall Street Breakfast Podcast: Who Leads Apple Next?,"Apple said to step up CEO succession planning as Tim Cook may leave next year. Trumpâs $2,000 tariff rebate may need Congress nod. Franchisee of Dairy Queen rival files for bankruptcy.",https://finnhub.io/api/news?id=2111686fa1531c2420c3ddb227c985bc3a7cea1d9fc55d3c5b0a690baa30535c,SeekingAlpha,company
AAPL,2025-11-17 06:00:00+00:00,Tax-saving steps to take ahead of the budget,"Pre-budget rumours might push you to consider your financial planning, and what works for you, but it's important not to rush into anything you may come to regret later.",https://finnhub.io/api/news?id=af0467613a8c633d711a434b3c7a395869e80337ffb0c3f250553634f3a54057,Yahoo,company
AAPL,2025-11-17 04:44:06+00:00,1 Cash-Producing Stock to Keep an Eye On and 2 We Find Risky,"A company that generates cash isn’t automatically a winner. Some businesses stockpile cash but fail to reinvest wisely, limiting their ability to expand.",https://finnhub.io/api/news?id=d8023734780983df1be6f6aa6d29711aeb2a1649e3cbf8f7e468aafce5128d93,Yahoo,company
AAPL,2025-11-17 03:13:54+00:00,Is Apple's Valuation Justified After AI Product Launches and a 22% Share Price Gain?,"Ever find yourself wondering if Apple stock is actually a smart buy at today's price, or if the market buzz has gotten ahead of itself? Apple's share price has gained 8.0% over the last month and is up a robust 21.6% in the past year, hinting at strong growth momentum and a possible shift in how investors see the company's risks and rewards. Apple has made headlines this month with new product launches, including an upgrade to its iPad lineup and continuous innovations in AI. These...",https://finnhub.io/api/news?id=25181e1a3682ad51820ea9534590385a1878aac839d3b4fb3e4da3077d69fff8,Yahoo,company
AAPL,2025-11-17 02:08:00+00:00,27% of Warren Buffett's $320 Billion Portfolio Is Invested in 3 Artificial Intelligence (AI) Stocks,"The legendary investor's portfolio may not feature many tech players, but it does includes a few companies that are using AI to enhance their products and services.",https://finnhub.io/api/news?id=73da6e11c88e22aac1a25574703b0942ac1af2774586212e42eaf8f0b548e6b3,Yahoo,company
AAPL,2025-11-16 23:14:08+00:00,Apple Hits $4T: Is the Tech Giant Still a Buy After Slowing Growth?,"Apple nears $4T market cap, but faces slowing growth as Nvidia tops $4.6T. Analysts remain bullish despite iPhone reliance and revenue headwinds.",https://finnhub.io/api/news?id=31ec776c4f60020c3769acb72d2b13d25a68f99a95f6174adbbcb5e18a7990f2,Yahoo,company
AAPL,2025-11-16 19:35:55+00:00,Are we nearing the end of Apple’s Tim Cook era?,"Apple is getting serious about succession planning, according to a new report.",https://finnhub.io/api/news?id=38e95a9ee7c90a14ed85fe336ac0037a7599c15313a72765830d5563af93bdfb,Yahoo,company
AAPL,2025-11-16 18:08:54+00:00,Wall Street Brunch: Nvidia Week,Will the marketâs most important company shine or disappoint? Disney back on YouTube. Apple prepares iPhone overhaul.,https://finnhub.io/api/news?id=db022a404f436d07aae0372ccd7f5fab75c0bda7653dce19da5bc4d612a3ad95,SeekingAlpha,company
AAPL,2025-11-16 16:33:00+00:00,Prediction: This Will Be Wall Street's Next Trillion-Dollar Stock,Drugs for weight loss and diabetes are taking Eli Lilly to new heights.,https://finnhub.io/api/news?id=827e2ccf96452c67e133ea43b8caeb54a32763895b6f9dd5dd7dff956976e272,Yahoo,company
AAPL,2025-11-16 14:15:00+00:00,What Is 1 of the Best Artificial Intelligence (AI) Stocks to Buy Now?,"There are many, but this one has a great advantage.",https://finnhub.io/api/news?id=06455e7798674f82e6d6555908e1e43b7471ccb169d0d880852355ccf6c94177,Yahoo,company
AAPL,2025-11-16 14:00:00+00:00,2 Warren Buffett Stocks I'd Sell Right Now,Even the best investors make mistakes sometimes.,https://finnhub.io/api/news?id=3f5b77287efa0e429fa0140eb96c2767a62e357dcbd79fd33623d6283f2221dd,Yahoo,company
AAPL,2025-11-16 12:12:47+00:00,Masimo (MASI) Is Up 5.6% After Winning $634 Million Verdict Against Apple - Has The Bull Case Changed?,"Earlier in November 2025, a federal jury in California ruled that Apple owes Masimo US$634 million for infringing patents related to blood-oxygen reading technology used in the Apple Watch. This verdict reinforces Masimo's stance on intellectual property protection and could influence future partnerships and competitive positioning within the medtech sector. We'll explore how this major legal win, particularly the sizable damages award, may impact Masimo's investment outlook and industry...",https://finnhub.io/api/news?id=4a111948fb8dfde84a3efb18b11a6f146a4c48ed255c2f8915805ff59e2d7e7f,Yahoo,company
AAPL,2025-11-16 12:00:00+00:00,WhatsApp Is Breaking Through Apple’s Walled Garden,It’s the world’s most popular messaging app—except in the U.S. That’s changing because of large groups.,https://finnhub.io/api/news?id=61a9006fc13fa0847cca6f0bb7759bb63cfa55c134024a0a43623883072827b2,Yahoo,company
AAPL,2025-11-16 09:50:00+00:00,"Meet the Newest Supercharged Growth Stock to Join Nvidia, Apple, Microsoft, Amazon, Alphabet, Meta, and Taiwan Semiconductor Manufacturing in the $1 Trillion Club. It's Still a Buy Right Now, According to Certain Wall Street Analysts.",Achieving a $1 trillion market cap is no small feat.,https://finnhub.io/api/news?id=588ac5715c54626c873dd3887936a2158538d4cac41ac0b8a399eeb9ef5dc7c9,Yahoo,company
AAPL,2025-11-16 09:00:00+00:00,"From Zero To $1,000,000 Retirement Dividend Portfolio","Read here for wealth-building strategies for every age: maximize compounding in your 20s, focus on growth, then shift to income assets for a secure retirement.",https://finnhub.io/api/news?id=7f697b462001e43a91b5b8af1999e3b980e41aa907a6e23511703cf8774d83f1,SeekingAlpha,company
AAPL,2025-11-16 06:23:09+00:00,Berkshire Hathaway: Warren Buffett Preaches Patience - I'm Following His Lead,"Berkshire Hathaway's capital allocation is disciplined, with prudent moves like reducing Apple and adding Alphabet. Read why BRK.B stock is a Hold.",https://finnhub.io/api/news?id=9d1886d3aac3645311d6f6c0938862208c4bd06fa739d70b4bdc49b780e4c7e2,SeekingAlpha,company
AAPL,2025-11-16 06:00:59+00:00,'I've always loved space since childhood – now I run the world's biggest space fund',"Mark Boggett is CEO of the world’s first listed space tech fund, leading global space investor Seraphim Space.",https://finnhub.io/api/news?id=0e72a82b246af51794467e74f24c450828876d8e832b457624148d100866e02f,Yahoo,company
AAPL,2025-11-16 03:01:15+00:00,"If You Invested $10K In Apple Stock 10 Years Ago, How Much Would You Have Now?","Apple Inc. (NASDAQ:AAPL), one of the world's biggest companies with a market capitalization of $4.05 trillion, designs, manufactures, and markets smartphones, personal computers, and tablets, along with related software and services. The company is ...",https://finnhub.io/api/news?id=7ad8b6bc087e5a89236806ffb44e91d5e2397173efe7e8d9b88996ee4feed0c1,Yahoo,company
AAPL,2025-11-15 23:47:08+00:00,Apple Just Hit a $4 Trillion Milestone: Do Experts Think It’s Time To Buy?,"Apple just recently crossed a $4 trillion market cap, but growth lags rivals. Is Apple stock a buy now, or should investors wait? Here’s what experts say.",https://finnhub.io/api/news?id=0af4eea0b2bb9295c32c659527051787eba92949108b803f57c94dd0ca518972,Yahoo,company
AAPL,2025-11-15 22:09:55+00:00,Former Fed governor's stock trades violated the central bank's ethics rules,"A former Federal Reserve governor who retired in August listed several stock trades in her financial disclosure documents for 2024 that violated the central bank's ethics rules.  The transactions are outlined in a report released Saturday by the U.S. Office of Government Ethics, which reviewed Adriana Kugler's financial disclosures after the Fed referred them to its inspector general earlier this year.  Kugler, who unexpectedly stepped down from the Fed board Aug. 8, disclosed more than a dozen individual stock trades, including several made during financial trading “blackout periods” around the time the Federal Reserve's policymaking committee meets to set interest rates and other monetary policy.",https://finnhub.io/api/news?id=39242489bb704f43549a281c13255e407aec08113424f6389727c87c36db2771,Yahoo,company
AAPL,2025-11-15 21:23:00+00:00,"Warren Buffett’s Berkshire snaps up major tech stock, trims favorite","Berkshire Hathaway’s (BRK.A, BRK.B) latest 13F filing delivered just the kind of signal for which Warren Buffett is famous. Following years of leaning on Apple (AAPL) as the crown jewel of its stock portfolio, the firm has just trimmed its stake again, continuing a trend that has quietly reshaped ...",https://finnhub.io/api/news?id=d25ae52a326b0fb8df530ce0b4a2ad0f848f2ba45e1cca288419c174145d9ada,Yahoo,company
AAPL,2025-11-15 21:07:41+00:00,Jury says Apple owes Masimo $634M for patent infringement,A federal jury in California ruled Friday that Apple must pay medical device maker Masimo $634 million for infringing a patent on blood oxygen monitoring technology.,https://finnhub.io/api/news?id=da59b44e3746d2bf01383b8880878a77552f7fa6e56f0ba0db54cdcc0862a399,Yahoo,company
AAPL,2025-11-15 20:07:18+00:00,"Apple is ramping up succession plans for CEO Tim Cook and may tap this hardware exec to take over, report says","John Ternus, Apple's senior VP of hardware engineering, could take control of the company as soon as next year, sources told the Financial Times.",https://finnhub.io/api/news?id=1b941099d7b9f0555677d2d20ebefdfeea142fdaf614e194176dd67e242bd583,Yahoo,company
AAPL,2025-11-15 18:25:00+00:00,‘Streamflation’: Major streaming services have hiked prices by up to 172% since 2019. Is it still worth it?,"With a full slate costing over $200, is this just cable all over again?",https://finnhub.io/api/news?id=697ed02192bcd7b3f14ad3d81f06c54edfaf9711cd3e525d917b998eb10f58e5,Yahoo,company
AAPL,2025-11-15 18:15:00+00:00,"Meet the Unstoppable Stock That Could Join Apple, Nvidia, Microsoft, Alphabet, Amazon, Meta, and Taiwan Semiconductor in the $1 Trillion Club by 2030.",These players may continue to benefit from the AI boom.,https://finnhub.io/api/news?id=9bc1765f67cc3d24b157486bf23712d2bdf8534f66b43f825ee26278d926b22a,Yahoo,company
AAPL,2025-11-15 17:33:34+00:00,"Despite AI bubble fears, Warren Buffett’s Berkshire Hathaway loads up on shares of hyperscaler Alphabet amid huge rally",Berkshire Hathaway revealed in a regulatory filing late Friday that it purchased 17.8 million shares of Google parent Alphabet during the third quarter.,https://finnhub.io/api/news?id=583149268bee8b531e43439b80ece6154fe3d76f8d6ff2e9ccb9d817633e8566,Yahoo,company
AAPL,2025-11-15 17:00:00+00:00,10 Office Technologies That Changed Everything,"How did the shabby offices of the late 1700s, with their dim lights, coal-burning fireplaces and quill pens, evolve into the sleek, high-tech work environments that we know today?  Mechanical innovations dominated the 19th century; digital and electronic breakthroughs defined the 20th century, as seen in the launch of everything from financial spreadsheets to email.  One enduring theme: From the 1860s onward, an outsize share of these office-related innovations emerged in the U.S. As the French traveler Alexis de Tocqueville wrote nearly 200 years ago, America’s leading minds weren’t drawn to poetry, music or the arts.",https://finnhub.io/api/news?id=b48c36a061fec5f725c61d605c78a1ae3c0b1523f1528adddb31c23534c26803,Yahoo,company
AAPL,2025-11-15 16:36:37+00:00,Apple Just Secured More Than Half of Taiwan Semi’s Most Valuable Asset,"Apple (NASDAQ:AAPL) continues to dominate the tech landscape as a powerhouse in consumer electronics and services, with its stock delivering robust returns for investors amid the artificial intelligence (AI) boom. Valued at over $4 trillion, the company thrives on its integrated ecosystem, where custom silicon plays a pivotal role in driving performance gains across iPhones, ... Apple Just Secured More Than Half of Taiwan Semi’s Most Valuable Asset",https://finnhub.io/api/news?id=96f5a78632123bf90ffe79dca26a4df4177268c627b9f56cc0b9112b50897d47,Yahoo,company
AAPL,2025-11-15 14:30:37+00:00,This Critical AI Stock Is Now Building Factories in the U.S.,"In the high tech universe, there is only a single common road that Nvidia (NASDAQ: NVDA), Advanced Micro Devices (NASDAQ: AMD), Apple (NASDAQ: AAPL), Qualcomm (NASDAQ: QCOM), Broadcom (NASDAQ: AVGO) and many others must go to get their chips made, no matter where they hail from. That road inevitably leads to Taiwan Semiconductor Manufacturing Company Ltd. ... This Critical AI Stock Is Now Building Factories in the U.S.",https://finnhub.io/api/news?id=3e80e88630cfcddefe6479a11616f401c66fd61a86adc6a52f7e7eb4084e9552,Yahoo,company
AAPL,2025-11-15 11:05:11+00:00,Former Fed Gov. Adriana Kugler violated trading rules while at central bank: ethics report ,The Federal Reserve's internal watchdog was notified earlier this year about stock trades from 2024 disclosed by then-Gov Adriana Kugler.,https://finnhub.io/api/news?id=dad76bef87cbe4ec214b95b0f4934bced37283efe4ec9ffd6884b36cdaf116c9,CNBC,company
AAPL,2025-11-15 08:42:33+00:00,Apple: The Walled Garden Built To Withstand An AI Downturn,"Apple shows resilient sentiment and capital security with limited AI cycle exposure, macro pressures and a $300 target ahead. See why AAPL stock is a hold.",https://finnhub.io/api/news?id=08fb1eccce2cd354714af910d44196026c03f48a6fa81ee6a06c4adb83c8f366,SeekingAlpha,company
AAPL,2025-11-15 07:13:29+00:00,Berkshire Hathaway's surprising new tech stake,There was a notable surprise in Berkshire Hathaway's end-of-Q3 equity portfolio snapshot.,https://finnhub.io/api/news?id=ae3ee951c5aab4e4957064d24ba519d3af8af254079672e811a8a57448f85ed4,CNBC,company
AAPL,2025-11-15 06:10:36+00:00,BofA Reaffirms Bullish Stance on Alphabet (GOOGL) As AI And Cloud Growth Accelerate,"Alphabet Inc. (NASDAQ:GOOGL) is among the most fantastic stocks every investor should pay attention to. On November 6, Bank of America Securities analyst Justin Post reaffirmed his Buy rating on Alphabet Inc. (NASDAQ:GOOGL) with a $335 price target. The analyst’s bullish stance was supported by the company’s growth trajectory in AI and cloud. Alphabet recently introduced […]",https://finnhub.io/api/news?id=abb6244716bedf6832c9047a928259ac98725edcae71804df0b4cad6bce33eea,Yahoo,company
AAPL,2025-11-15 05:14:26+00:00,Engie (ENXTPA:ENGI) Valuation: Assessing the Impact of Major Renewable Energy Agreements and Capacity Growth,"Engie (ENXTPA:ENGI) is making waves in the green energy market, supported by new power purchase agreements with global giants like Apple and AstraZeneca. Recent renewable energy projects in Italy highlight the company’s momentum. See our latest analysis for Engie. The momentum behind Engie is translating into the stock’s performance, with a strong year-to-date share price return of 40% and a 1-year total shareholder return of nearly 54%. Big-ticket renewable deals and upbeat earnings...",https://finnhub.io/api/news?id=4369dd5195a8dc68dbe06c35a2d163e5e92f4b60be879f1de2f281f0734c2616,Yahoo,company
AAPL,2025-11-15 04:23:05+00:00,Did Engie’s (ENXTPA:ENGI) 15-Year Apple Renewable Deal Just Redefine Its Revenue Strategy?,"Engie announced that it has signed a 15-year renewable Power Purchase Agreement with Apple, under which it will install 173 MW of new wind and agrivoltaic capacity in Southern Italy, with 80% of the electricity dedicated to Apple and the remainder going into the national grid. This long-term partnership not only underscores Engie's ability to deliver tailored decarbonization solutions for major global clients but also signals the company's ongoing expansion in the European renewables...",https://finnhub.io/api/news?id=091a187335d55486a87ff08d4cabb8c680b2d80e030b58a2b927102c1c2871e4,Yahoo,company
AAPL,2025-11-15 04:15:51+00:00,US jury says Apple must pay Masimo $634 million in smartwatch patent case,"(Reuters) -A federal jury in California said on Friday that Apple owes medical-monitoring technology company Masimo $634 million for infringing a ​patent covering blood-oxygen reading technology.  The jury agreed with Masimo that the Apple ‌Watch's workout mode and heart rate notification features violated Masimo's patent rights, a Masimo spokesperson confirmed.  An Apple ‌spokesperson said that the company disagrees with the verdict and will appeal.",https://finnhub.io/api/news?id=4f2a98a952b0531c80cb8a52fbe2a4de2f7a2fa8d7c3ad12539b3ea118e13c8b,Yahoo,company
AAPL,2025-11-15 03:38:13+00:00,"Apple intensifies succession planning for CEO Tim Cook, FT reports","John Ternus, Apple's senior vice president of hardware engineering, is ⁠widely seen as ‌Cook's most likely successor, the FT reported, citing several ‍people familiar with discussions.  Apple did not immediately respond to a Reuters request for comment.  The newspaper quoted people ​familiar with discussions inside the iPhone maker ‌as saying its board and senior executives had recently intensified preparations for Cook to hand over the reins after more than 14 years.",https://finnhub.io/api/news?id=d97c9f9ba0754fcf9fd75c6cc81e7809e821db3784c23bb6f97a7b974c03df73,Yahoo,company
AAPL,2025-11-15 03:30:09+00:00,Apple intensifies succession planning for CEO Tim Cook,"Apple is stepping up its succession planning efforts, as it prepares for Tim Cook to step down as chief executive as soon as next year. Several...",https://finnhub.io/api/news?id=559319eb57034717d177db11f2b6f6094d166cad603e59e69bbc0867483975e2,Yahoo,company
AAPL,2025-11-15 01:55:00+00:00,Masimo Issues Statement on California Jury Verdict Finding Patent Infringement by Apple and Awarding Masimo $634 Million in Damages,"IRVINE, Calif., November 15, 2025--Masimo (NASDAQ: MASI) today issued the following statement in response to the jury verdict announced in the U.S. District Court for the Central District of California, which confirmed the validity of Masimo Patent No. 10,433,776, found Apple infringed this patent, and awarded Masimo $634 million in damages:",https://finnhub.io/api/news?id=5280806df1f1299845673473cfd74fc3a70248ecd18a905d31080dab01ec671c,Yahoo,company
AAPL,2025-11-15 00:08:00+00:00,Berkshire Added $4 Billion Alphabet Stake and Further Pared Apple Stock,"Warren Buffett’s conglomerate was a net seller of stocks during the third quarter, but it did add a position in Google’s parent company.",https://finnhub.io/api/news?id=d46a536e151cd731622c3feaa5e1735d58a933ad6f6b119ee4b30dbb0ce1bfa7,Yahoo,company
AAPL,2025-11-14 23:56:00+00:00,Berkshire Hathaway Bought Alphabet Shares in the Third Quarter. Here’s What It Sold.,"The filing, released on Friday, detailed the firm’s equity holdings of U.S.-listed securities as of Sept. 30.  Alphabet made up 1.6% of Berkshire’s portfolio by the end of September.  In the third quarter, Berkshire sold $10.6 billion worth of  Apple  shares, $1.9 billion worth of  Bank of America  stock, and $1.2 billion worth of holdings of  VeriSign  a provider of domain registry services, the report showed.",https://finnhub.io/api/news?id=05ea2a137da67b3af3e76b04ec16db4cd3e51d26dd4cb2350ef79d4efaa29684,Yahoo,company
AAPL,2025-11-14 22:29:09+00:00,"Berkshire Hathaway reveals $4.3 billion stake in Alphabet, cuts Apple","Investing.com -- Berkshire Hathaway disclosed a $4.3 billion stake in Google’s parent Alphabet, making the company its 10th largest equity holding as of September 30, according to a regulatory filing with the U.S. Securities and Exchange Commission on Friday.",https://finnhub.io/api/news?id=df51c7513fc33849f3797ae83f1f0a22192257b4e1230cbc69e825d0e864606e,Yahoo,company
AAPL,2025-11-14 22:08:00+00:00,"Liberty All-Star® Growth Fund, Inc. October 2025 Monthly Update","BOSTON, November 14, 2025--Liberty All-Star® Growth Fund, Inc. October 2025 Monthly Update",https://finnhub.io/api/news?id=4b965a227e780281fe6af7b28de74e3ec853875d9f572e633ca7ca24833be4e6,Yahoo,company
AAPL,2025-11-14 22:01:48+00:00,Warren Buffett's Strategic Moves: Apple Inc. Sees a -3.33% Portfolio Impact,Exploring the Oracle of Omaha's Latest Investment Decisions,https://finnhub.io/api/news?id=d604f67c20761d870f8f29abed11e6926470b5a4ab6e3e0cb5067a7a0ea9c34a,Yahoo,company
