ticker,datetime,title,summary,url,source,category,sent_positive,sent_neutral,sent_negative,sent_net
NVDA,2025-11-03 16:06:35+00:00,Jim Cramer Says “Lisa Su at AMD is Challenging Nvidia at Its Own Game”,"Advanced Micro Devices, Inc. (NASDAQ:AMD) is one of the stocks Jim Cramer had in this week’s game plan. Cramer highlighted the company’s competition with NVIDIA, as he stated: “After the close, we have two huge winners so far this year, well, one for many, many years, well, actually both of them really, AMD and Axon. […]",https://finnhub.io/api/news?id=5dcfe4e4b1f25fc74c86b580b9dbac224cf1459ec6c33b1a5125a3d8e039f62b,Yahoo,company,0.09716074913740158,0.8595728278160095,0.0432664193212986,0.05389432981610298
NVDA,2025-11-03 15:51:27+00:00,"Sentiment in Nvidia Turns Negative, Down to 41/100 At Market Open (NVDA)","No other company has been as important as NVIDIA (NASDAQ: NVDA) in 2025, but today retail investors are souring on earth’s first $5 trillion company. At market open sentiment has collapsed down to a bearish 41/100, a sharp reversal from a high of 89/100 as recently as October 26th. This is despite share opening over ... Sentiment in Nvidia Turns Negative, Down to 41/100 At Market Open (NVDA)",https://finnhub.io/api/news?id=dcba937d814de718446b0b801fdae5e3c4b1efda098661a0623186267fd85c7d,Yahoo,company,0.012507189065217972,0.016763776540756226,0.9707289934158325,-0.9582218043506145
NVDA,2025-11-03 15:42:46+00:00,"Wall Street Loves Nvidia, Palantir and Cisco","With the major indices rocketing higher on cooling trade tensions, inflation, hot earnings, and unstoppable AI momentum, analysts are still upgrading big tech names. Nvidia (NASDAQ: NVDA): Loop Capital just reiterated its buy rating on the stock, with a price target of $350 a share, up from $250. The firm believes NVDA is about to ... Wall Street Loves Nvidia, Palantir and Cisco",https://finnhub.io/api/news?id=7e1da6132b6ea38ea79309554c6e85fcdb9262a1fbb93e748f3d77cfb429d088,Yahoo,company,0.9477483630180359,0.032809142023324966,0.019442498683929443,0.9283058643341064
NVDA,2025-11-03 15:16:05+00:00,Here's Michael Saylor's Year End Bitcoin Price Target,"Bitcoin would reach $150,000 by year end, according to Strategy (NASDAQ:MSTR) Chair Michael Saylor. “Our expectation right now is end of the year, it [Bitcoin] should be about $150,000,” Saylor told CNBC on Monday on the sidelines of the Money 20/20 ...",https://finnhub.io/api/news?id=357a3725640c6be6227edc2b14c8f094b09370a82708249ea5b7ef457b9ee936,Yahoo,company,0.12256569415330887,0.8618003129959106,0.015633996576070786,0.10693169757723808
NVDA,2025-11-03 14:35:00+00:00,Agentic AI Aims to Cut Down Emergency Response Time When Disasters Strike,"Leidos and NVIDIA are developing autonomous agents to help speed life-saving tasks and decisions in emergency management command and control, called C2AI NORTHAMPTON, MA / ACCESS Newswire / November 3, 2025 /Three Points to Remember Disaster response ...",https://finnhub.io/api/news?id=f9211f4198c577fb58396bdd2fe707faccf5a195696a48fd3c8f65162bab92ca,Yahoo,company,0.059052031487226486,0.889648973941803,0.051298946142196655,0.007753085345029831
NVDA,2025-11-03 14:09:20+00:00,Analyst Says NVIDIA (NVDA) Price/Sales Ratio is a ‘Big Number’ – ‘We Shall See’,We recently published Top 9 AI and Non-Tech Stocks to Watch Amid Latest Earnings Season. NVIDIA Corporation (NASDAQ:NVDA) is one of the top AI and non-tech stocks. Guy Adami from CNBC recently commented on NVIDIA Corp (NASDAQ:NVDA) announcement that the company expects $500 billion in GPU sales between the Blackwell generation and next year’s Rubin […],https://finnhub.io/api/news?id=1a54f38819eaaabeb71a7ffe64cc4413e55e86ae53ee5d0bc6460449ae95d887,Yahoo,company,0.4617087244987488,0.5254955291748047,0.0127957072108984,0.4489130172878504
NVDA,2025-11-01 12:47:56+00:00,Quantum Computing Stocks: Third Quarter Earnings Preview,Quantum computing stocks continue to be volatile heading into Q3 earnings reports. IonQ reports late Wednesday.,https://finnhub.io/api/news?id=77d83b0bbe43a43d108df0b58f5998ed27f8ec9e4620fade424bd1418baf3581,Yahoo,company,0.010070409625768661,0.03543704003095627,0.9544926285743713,-0.9444222189486027
NVDA,2025-11-03 14:07:26+00:00,NVIDIA Corporation (NVDA): Uniquely Positioned at the Center of the Global AI Computing Cycle,"Columbia Threadneedle Investments, an investment management company, released its “Columbia Global Technology Growth Fund” third-quarter 2025 investor letter. A copy of the letter can be downloaded here. Markets continued their upward journey in the third quarter, driven by strong earnings growth, continued enthusiasm around artificial intelligence (AI), and easing trade tensions. The composite returned 12.06% […]",https://finnhub.io/api/news?id=1912683d9a48887e6e46352bea3d186168b22c630b0587b3b14ae8d70c90e5ac,Yahoo,company,0.9484843611717224,0.03557980805635452,0.015935787931084633,0.9325485732406378
NVDA,2025-11-03 14:00:00+00:00,F5 Leverages NVIDIA RTX PRO Server to Deliver High-Performance Enterprise AI Infrastructure,"SEATTLE, November 03, 2025--F5 (NASDAQ: FFIV) today announced the integration and validation of F5 BIG-IP Next for Kubernetes, part of the F5 Application Delivery and Security Platform (ADSP), with NVIDIA RTX PRO 6000 Blackwell Server Edition, the leading universal data center platform for enterprise and industrial AI. This integration expands the collaboration between F5 and NVIDIA to enhance high-performance traffic management, intelligent security, and scalability for advanced AI applications",https://finnhub.io/api/news?id=aadcba56e307434ceee57f56628294797651fea38182c70ffbd2b4a3378873d5,Yahoo,company,0.8498611450195312,0.1431862860918045,0.006952603347599506,0.8429085416719317
NVDA,2025-11-03 09:54:41+00:00,AVL: The Broadcom Lever Riding The Wave Of AI,Explore AVL's 2x leveraged exposure to Broadcom (AVGO) and the AI sector.,https://finnhub.io/api/news?id=cc1eb10e55d617f7baef3bfc9b1f84bc9a275ee1963df8c9142fc2a05e9f4937,SeekingAlpha,company,0.14719238877296448,0.8357126116752625,0.017095064744353294,0.13009732402861118
NVDA,2025-11-03 07:31:48+00:00,Wall Street Breakfast Podcast: FDA Executive Controversy,Executive accused of making false statements about a drug and soliciting a bribe. Baiduâs Apollo Go hits driverless ride landmark. Trump says only U.S. will get access to Nvidiaâs Blackwell.,https://finnhub.io/api/news?id=c9522068ab0746be207f2431378635f72a5866cbe5f5217bd477365ddbbdc003,SeekingAlpha,company,0.05365918204188347,0.6252048015594482,0.3211359977722168,-0.26747681573033333
NVDA,2025-11-03 02:12:36+00:00,Nvidia enters into 'major' partnership with South Korea to build a sovereign AI infrastructure,"Nvidia has announced a major agreement with the South Korean government, Samsung, SK Group, Hyundai, LG, and NAVER to deploy 260,000 graphics processing units as part of a national artificial...",https://finnhub.io/api/news?id=5882c4060fa4324671bf10acd842d483966a1e24ff20776c541965410c08636c,Finnhub,company,0.934273898601532,0.052717890590429306,0.013008159585297108,0.9212657390162349
NVDA,2025-11-02 16:34:00+00:00,Prediction: AMD Will Be Worth More Than Broadcom by 2030,It might be a mistake to overlook AMD simply because of Nvidia's dominance.,https://finnhub.io/api/news?id=e83b6a8cf83f4217b0a0b8f9592984d55bd1a13593add2082c61a21d5c759aae,Yahoo,company,0.08130684494972229,0.4090873599052429,0.5096058249473572,-0.4282989799976349
NVDA,2025-11-02 16:33:00+00:00,Investors ask whether $5 trillion Nvidia can sustain our faith in AI,Nvidia is the first company in history to attain a market cap of more than $5 trillion. The milestone marks the end of a run that has made the chip designer the de facto engine of the artificial-intelligence age and a reflection of market psychology itself. The chip giant's value has come to ...,https://finnhub.io/api/news?id=c9dc1976c5e3acdd7f146bcc16143d32768a8ff917ef969725f510338c96b539,Yahoo,company,0.3903147578239441,0.5886865854263306,0.020998654887080193,0.3693161029368639
NVDA,2025-11-02 16:30:00+00:00,Is Nvidia Stock a Buy?,"Nvidia just revealed $500 billion in pending artificial intelligence (AI) revenue through 2026, but analysts question whether returns justify the spending.",https://finnhub.io/api/news?id=7b074707413cbf9ad633175a07e3bb251498923f4589dc00d167fad13c842874,Yahoo,company,0.21609707176685333,0.6783090233802795,0.10559392720460892,0.11050314456224442
NVDA,2025-11-02 15:46:02+00:00,"Ferrari Is Getting Into Crypto, But It Will Only Be Available To 100 People","Ferrari (NYSE:RACE) is racing into the cryptocurrency market in the hopes of attracting young tech entrepreneurs, according to Reuters. The sports car brand is working with Italian fintech company Conio to launch the Token Ferrari 499P. The digital ...",https://finnhub.io/api/news?id=29f8ac162dd6548c728ddb0c6c53ccecf5f10f0fee1d4dc07267f6fb6950eec4,Yahoo,company,0.25944313406944275,0.7330330014228821,0.0075238728895783424,0.2519192611798644
NVDA,2025-11-02 15:45:00+00:00,The Single Best AI Stock: Could It Surge 148% by 2030?,Taiwan Semiconductor is a predetermined winner in the AI arms race.,https://finnhub.io/api/news?id=19d9b13bbdd1735d692bde39b794523015c67fe537407d0fedd401d6b160d536,Yahoo,company,0.7978232502937317,0.19066239893436432,0.011514308862388134,0.7863089414313436
NVDA,2025-11-02 14:45:00+00:00,"Finally, Some Good News for Intel Stock Investors",The semiconductor company is getting its footing with new management at the helm.,https://finnhub.io/api/news?id=f39f8256df5e05e81f400699e5f8a257ab8361fdd4b4b48ee8ccb67ee7289c02,Yahoo,company,0.9231048226356506,0.062393657863140106,0.0145014813169837,0.9086033413186669
NVDA,2025-11-02 14:30:00+00:00,AMD's Stock Has Doubled This Year. Here's Why It's Not Too Late to Invest.,The semiconductor stock looks far less expensive when factoring in its long-term prospects.,https://finnhub.io/api/news?id=4cf86f96b72e55a56c3b0bdd5ee08576a1b11e8175a29d0907c421cf81bb318c,Yahoo,company,0.22526311874389648,0.7589802742004395,0.015756579115986824,0.20950653962790966
NVDA,2025-11-02 14:00:00+00:00,Has Qualcomm Stock Finally Turned a Corner?,The stock trades near its highest point this year after Qualcomm announced its AI accelerators.,https://finnhub.io/api/news?id=ac9a1c381f85e25e388bcc83263b2f7934dcb1dd6be558848cbaa7f17e61aded,Yahoo,company,0.37255898118019104,0.0530264638364315,0.5744145512580872,-0.20185557007789612
NVDA,2025-11-02 14:00:00+00:00,Nvidia is worth $5 trillion. Here’s what it means for the market,"The chipmaker at the heart of the artificial intelligence revolution is not only by far the biggest company on the planet, it also may be the most influential stock in Wall Street history.  Nvidia has been the primary driver of the market’s gains since the start of 2023, delivering massive returns to shareholders and minting billions for Chief Executive Officer Jensen Huang.",https://finnhub.io/api/news?id=2a1ec93567be98dd9e9fe2ae44445461ec4ab556fe30ff1c87d501a04ee88437,Yahoo,company,0.28646400570869446,0.7008599638938904,0.012676030397415161,0.2737879753112793
NVDA,2025-11-02 13:37:00+00:00,IBM Stock Is Outperforming Nvidia's This Year. Are Shares a Buy?,IBM shares are outperforming Nvidia's in 2025 as the company sees its strongest revenue growth in years.,https://finnhub.io/api/news?id=ef9dde0b5ddba38d3fd802812a4cec2ab9ddf57e34c02c4245c84e1d84c0ae6b,Yahoo,company,0.8268424272537231,0.05526193976402283,0.11789564788341522,0.7089467793703079
NVDA,2025-11-02 12:00:00+00:00,This AI Stock Is Poised for Explosive Growth Over the Next 5 Years,Nvidia projects huge data center capital expenditure growth from now until 2030.,https://finnhub.io/api/news?id=6aef489e131b1af628c4b010c4dbc9ef770b46ea83782c550f823253c130c630,Yahoo,company,0.8955177664756775,0.09078651666641235,0.013695692643523216,0.8818220738321543
NVDA,2025-11-02 11:24:40+00:00,Nvidia (NVDA) Remains Top Pick at Cantor Despite Market Bubble Concerns,"NVIDIA Corporation (NASDAQ:NVDA) is one of the AI Stocks on the Market’s Radar. On October 30, Cantor Fitzgerald reiterated an “Overweight” rating on the stock with a $300 price target. The firm said that the stock is too inexpensive to ignore despite AI bubble fears. The firm said that despite talks of an “AI bubble,” Nvidia is […]",https://finnhub.io/api/news?id=6165d9c5b16d37a535da5c3f363612b28b5ee72edc1a7a7b34ae088828cf1ccf,Yahoo,company,0.26097720861434937,0.6902781128883362,0.04874470829963684,0.21223250031471252
NVDA,2025-11-02 11:07:00+00:00,Prediction: AMD's Stock Could Soar on Nov. 4,AMD's financial results may play second fiddle to the commentary surrounding its AI business.,https://finnhub.io/api/news?id=afaedfb58a4591512e26cc704596574c6c59e846c11807040d584755b9233e34,Yahoo,company,0.06752528250217438,0.23955176770687103,0.6929229497909546,-0.6253976672887802
NVDA,2025-11-02 10:42:00+00:00,"Is Nvidia Still a Safe Bet if the ""AI Bubble"" Deflates?",The problem with bubbles is you never know when they will pop or how long the fallout will linger.,https://finnhub.io/api/news?id=bdfc2573fac841b2db3467678f2390061e6df2c54b910e9abf89d5fcebbae9c0,Yahoo,company,0.026041846722364426,0.5557265877723694,0.4182315766811371,-0.39218972995877266
NVDA,2025-11-02 10:30:06+00:00,IBM’s quantum bet could finally pay off,"Investing.com -- IBM is betting its next big turnaround will come from the smallest things imaginable. At a recent event, executives including CFO James Kavanaugh and research head Jay Gambetta said the company’s quantum computing roadmap remains on track to deliver commercial gains before 2030. If it works, it could restore IBM’s reputation for technological leadership and justify a valuation premium that looks generous by past standards.",https://finnhub.io/api/news?id=08ae25b8838143bd375dbb9e9f348d3b21eb2e10ac050033736e7fac65a23484,Yahoo,company,0.9248300194740295,0.06332681328058243,0.011843079701066017,0.9129869397729635
NVDA,2025-11-02 10:25:00+00:00,Jensen Huang Just Gave Investors 1 Incredible Reason to Buy Nvidia Stock Hand Over Fist,Wall Street analysts are underestimating Nvidia's growth potential.,https://finnhub.io/api/news?id=a7f1e8cf13b7fc32e61bee2a06e739964dec1fbd03474a69498c88d55c49b771,Yahoo,company,0.2045922875404358,0.24133345484733582,0.5540741682052612,-0.34948188066482544
META,2025-11-07 19:18:01+00:00,What Is One of the Best Magnificent Seven Stocks to Buy Now?,This is one of the cheapest tech leaders investors can buy.,https://finnhub.io/api/news?id=a251011988fff06ccdef1d582ec960ed7c7910276afaf7645a1cec786daf077f,Yahoo,company,0.1037999838590622,0.8837904334068298,0.012409631162881851,0.09139035269618034
META,2025-11-07 18:32:30+00:00,Meta to invest $600 billion in U.S. infrastructure over next three years,"Investing.com -- Meta Platforms announced Friday it will invest $600 billion in U.S. infrastructure and jobs over the next three years, focusing on artificial intelligence data centers as the company accelerates its AI development plans.",https://finnhub.io/api/news?id=31f5429819ea3ca139e108aa46d44fd3e6e13ef841a409b30bd303e330c680c7,Yahoo,company,0.28543809056282043,0.7061938047409058,0.008368131704628468,0.27706995885819197
META,2025-11-07 18:17:00+00:00,Meta Stock Is Dragged Further Into Bear Market Territory by Heavy AI Spending,"Meta Platforms  shares extended their post earnings slump in early Friday trading, dragging the Facebook parent into a mini-bear market decline that echoes larger concerns over artificial intelligence spending.  Meta  shares have also fallen more than 20% on an intraday basis since last Wednesday, when the company posted a mixed set of third-quarter earnings.  Operationally, Meta appeared to be firing on all cylinders: its much-maligned Reality Labs division saw a 270% increase in revenue, although it still booked a $4.4 billion loss.",https://finnhub.io/api/news?id=4027d491f6d48b70d90405b7a88274ffa04543886879b153351c2613f6ea6b81,Yahoo,company,0.008607570081949234,0.01670057885348797,0.9746919274330139,-0.9660843573510647
META,2025-11-07 17:59:01+00:00,Meta plans $600 billion US spend as AI data centers expand,"Meta has doubled down on AI, with a target of achieving superintelligence, a theoretical milestone where machines outthink humans.  It has pledged hundreds of billions of ⁠dollars to build several ‌large AI data centers and plans bigger outlays to meet compute needs.  CEO Mark Zuckerberg told U.S.‍ President Donald Trump that Meta will invest ""at least $600 billion"" in the U.S. over the next several years ​at a White House dinner in September.",https://finnhub.io/api/news?id=5ea913d12b7b5aa46329c23b8ef0a05a52cf687ca45caae4eb2ae99304551ea5,Yahoo,company,0.497914582490921,0.47786518931388855,0.02422015368938446,0.47369442880153656
META,2025-11-07 17:46:17+00:00,"Big Tech may win reprieve as EU mulls easing AI rules, document shows","BRUSSELS (Reuters) -Apple, Meta Platforms and other tech giants may win ​a reprieve from the EU's landmark artificial intelligence ‌rules as regulators consider easing sections of the legislation as part of a drive ‌to simplify a slew of regulations adopted in the last two years.  The move by the European Commission came amid intense lobbying by big tech companies and criticism from the U.S. administration against ⁠the AI Act adopted ‌last year, which applies risk-based rules to artificial intelligence.  EU tech chief Henna Virkkunen will present ‍the so-called Digital Omnibus on November 19 according to a Commission agenda.",https://finnhub.io/api/news?id=ecaafb213756f08e3a2854f7974234e3d1517b91e9849116d6c979b7a3802fa0,Yahoo,company,0.31639760732650757,0.3495301306247711,0.3340722322463989,-0.017674624919891357
META,2025-11-07 17:02:42+00:00,Snap Has a $400 Million Catalyst Right Now. Does It Make SNAP Stock a Buy?,"Snap has announced a $400 million deal with Perplexity AI, and shares popped about 15% on strong quarterly results.",https://finnhub.io/api/news?id=8238e322bd319e6f7df915b0989eabccc5aeebacae5bcdc94b42d6e6d8a633f3,Yahoo,company,0.9351611733436584,0.04065597429871559,0.024182915687561035,0.9109782576560974
META,2025-11-07 16:12:47+00:00,Jim Cramer Thinks Meta (META)’s Mark Zuckerberg is Spending Billions to “Keep Sam Altman Out”,"We recently published 10 Stocks Jim Cramer Discussed Including His Palantir Deep Dive. Meta Platforms, Inc. (NASDAQ:META) is one of the stocks Jim Cramer recently discussed. Even though Meta Platforms, Inc. (NASDAQ:META)’s shares fell after its third-quarter earnings report, Cramer has continued to defend the stock. According to media reports, the shares dipped after management […]",https://finnhub.io/api/news?id=c32f923bfe672206952ffffe8c45cdae7bfb85a42faea64378676d537f4f8d02,Yahoo,company,0.015416190959513187,0.02505517192184925,0.9595286250114441,-0.9441124340519309
META,2025-11-07 16:07:00+00:00,Leaked Meta docs reveal disturbing details of its advertising business,"Meta Platforms generates a significant amount of revenue from advertising. Meta reported third-quarter total revenue of $51.2 billion, a 26% year-over-year increase. Of that total, about $50 billion came from advertising. Meta has nearly 4 billion monthly global usersacross its family of ...",https://finnhub.io/api/news?id=5b39d0731ff10a0460e3c8fa9dc93e38a6bebbace73854942923b14cc41e8b24,Yahoo,company,0.6763601303100586,0.3088156580924988,0.014824138022959232,0.6615359922870994
META,2025-11-07 11:22:00+00:00,October in Review: 10 Top Technology Press Releases,"With thousands of press releases published each month, it can be difficult to keep up with everything on PR Newswire. To help tech journalists and consumers stay on top of the month's most popular releases and newsworthy trends, here's a recap of some of the past month's most read- and engaged-with stories.",https://finnhub.io/api/news?id=3faf24c3f7dfbe2e188648feddfb050093d3064a9716bc275f291e701583e8c3,Yahoo,company,0.03490358591079712,0.9227374792098999,0.04235892742872238,-0.0074553415179252625
META,2025-11-07 10:16:26+00:00,Meta Platforms: The Latest Splurge Is A Bridge Too Far,"Meta Platforms, Inc. raised $30 billion in debt to continue fund its aggressive AI expansion plans. Learn more about META stock here.",https://finnhub.io/api/news?id=495b836a4ae4d7b5edf2ff9ebd8bb5af6e27bb7b47a014542fbe7fc63777acd0,SeekingAlpha,company,0.08882001787424088,0.8952221274375916,0.015957878902554512,0.07286213897168636
META,2025-11-07 09:48:00+00:00,Stock-Split Watch: 2 AI Stocks That Look Ready to Split,Stock splits have come alive again. Here's a look at which two AI stocks might be next.,https://finnhub.io/api/news?id=47edfbaf105d7884b2548460e16b09a1d5e19425b02b858feeada2198995d5c8,Yahoo,company,0.07371484488248825,0.9106652140617371,0.015619983896613121,0.05809486098587513
META,2025-11-07 09:45:00+00:00,1 Surefire Artificial Intelligence (AI) Stock to Buy on the Dip,"The recent drop makes the stock highly attractive, relative to its growth potential.",https://finnhub.io/api/news?id=29ed81650874cf501145614e9a62a81797bba92e86941dcc4292c2cecd8fda2e,Yahoo,company,0.9271016716957092,0.05742903798818588,0.015469269827008247,0.911632401868701
META,2025-11-07 09:25:00+00:00,My Advice? Don't Get Distracted by Oracle Stock's Latest Slump.,Oracle is rapidly expanding its cloud infrastructure.,https://finnhub.io/api/news?id=190f8d3daf0babca639a208a58efdd2710f2f1c90727830099fc75d43fc26281,Yahoo,company,0.8441790342330933,0.10617734491825104,0.04964364692568779,0.7945353873074055
META,2025-11-07 04:46:37+00:00,3 Cash-Producing Stocks with Warning Signs,"A company that generates cash isn’t automatically a winner. Some businesses stockpile cash but fail to reinvest wisely, limiting their ability to expand.",https://finnhub.io/api/news?id=6dc9873cffbdd96f9634f0babeae19aa4e8ec88dec58101beb05a6a8bb915395,Yahoo,company,0.013247028924524784,0.0279751755297184,0.9587778449058533,-0.9455308159813285
META,2025-11-06 21:30:00+00:00,Fluor and NuScale Announce Agreement Regarding Stake Monetization,"IRVING, Texas & CORVALLIS, Ore., November 06, 2025--Fluor and NuScale Power announced that they have reached an agreement regarding the conversion and monetization of Fluor’s remaining stake in NuScale.",https://finnhub.io/api/news?id=9b9e747afca4a69b05c1480e3c497cf5f3b2e796a8a38abda743087a436bb230,Yahoo,company,0.8229802250862122,0.16419744491577148,0.012822255492210388,0.8101579695940018
META,2025-11-06 21:20:51+00:00,"Meta estimates that it earns 10% of its revenue from scams, report says","These fraudulent ads purport to offer a product or service that isn't actually real, and may be intended to solicit payments from less savvy users.",https://finnhub.io/api/news?id=799864bbe74c20e1f04f6a0bcbe44f3a42a5981f8354d231f19eb0fa5ed698b8,Yahoo,company,0.02265292778611183,0.4511038661003113,0.526243269443512,-0.5035903416574001
META,2025-11-06 21:15:00+00:00,NuScale Power Reports Third Quarter 2025 Results,"CORVALLIS, Ore., November 06, 2025--NuScale Power announced results for the third quarter ended September 30, 2025.",https://finnhub.io/api/news?id=4d42b1add91a39ee3c8b86993976eaf006f8984b651fc0839199f0f70cfd83ac,Yahoo,company,0.03864262253046036,0.7228400111198425,0.2385173887014389,-0.19987476617097855
META,2025-11-06 18:41:28+00:00,"Meta is making billions of dollars from scam ads on Facebook, Instagram and WhatsApp, report says","Meta is making billions of dollars every year from ads marketing scams and illegal products on its platform, according to a new report from Reuters.",https://finnhub.io/api/news?id=914596556a6a87fe038a033593be2649cbbce6efe395b5fda7d01182a4a45400,Yahoo,company,0.02010168507695198,0.305463582277298,0.6744347810745239,-0.654333095997572
META,2025-11-06 16:56:51+00:00,Duolingo Q3: Just Like Meta In 2022,"Duolingo, Inc. is rated Buy with long-term price target of $335, seeing attractive risk-reward for long-term investors. Read more on DUOL stock here.",https://finnhub.io/api/news?id=25f0bc19d98a92077d1085b7190303371e2f9e3c674cab287fdc967c45861235,SeekingAlpha,company,0.298599511384964,0.6928059458732605,0.008594590239226818,0.29000492114573717
META,2025-11-06 16:14:49+00:00,Nebius Launches Token Factory to Boost Open AI Models,"The new platform promises faster, cheaper, and smarter AI deployment",https://finnhub.io/api/news?id=bd9eb18116ffc88c761457c35b6e19973eccbee5f9f5a5fc35483e76dc9b4f75,Yahoo,company,0.7759712934494019,0.2156280130147934,0.008400734513998032,0.7675705589354038
META,2025-11-06 15:30:44+00:00,Meta Platforms (NASDAQ: META) Stock Price Prediction for 2025: Where Will It Be in 1 Year (Nov 6),"Meta Platforms is shifting its focus and riding a powerful, bullish trend. Investors should consider the wide range of Meta stock price targets and formulate a strategy for all possible outcomes.",https://finnhub.io/api/news?id=c0d1536817714ca606a04813c0873922a7164a3873d3179e3b52a388d9e14e1b,Yahoo,company,0.5012514591217041,0.4874151051044464,0.011333446949720383,0.4899180121719837
META,2025-11-06 14:30:00+00:00,Pinterest Stock Tumbled After Earnings. How We’re Thinking About Our Pick.,"FEATURE  Stick a pin in our Pinterest stock pick.  We recommended buying Pinterest stock in June, and our recommendation just hasn’t worked. Since then, the stock has dropped 25% to $26—including a 22% plunge on Wednesday after the company released third-quarter earnings.",https://finnhub.io/api/news?id=1553dd3e0d131f722b4b0ec2d6f4225246140c482592d816d0958a6d722ad48a,Yahoo,company,0.0070081413723528385,0.018045511096715927,0.9749463200569153,-0.9679381786845624
