ticker,datetime,title,summary,url,source,category,sent_positive,sent_neutral,sent_negative,sent_net
GOOGL,2025-11-03 13:01:35+00:00,Gemini 3 Anticipation Builds Amid OpenAI Rivalry. Is Google Stock A Buy?,Google seems to be in the artificial intelligence winners circle. But it may have to share it with OpenAI. Will Gemini 3 make a difference?,https://finnhub.io/api/news?id=8b72393bf7209eb223698eb03248079c912c80a068f0ddeee7cc538ad67b1bea,Yahoo,company,0.13304385542869568,0.8485209345817566,0.018435167148709297,0.11460868827998638
GOOGL,2025-11-03 13:01:16+00:00,Alphabet: AI Earnings Balances Dismal Ad Spend Outlook... For Now,"Get key insights on Alphabet Inc.'s Q3 FY2025 results, including ad revenue trends and AI investments. Click for my updated look at GOOGL stock post earnings.",https://finnhub.io/api/news?id=d7a2b9b7697af5f615dcd43cc579b39516750c85334e7c97a3cc929d2710750e,SeekingAlpha,company,0.020781058818101883,0.3927268087863922,0.5864920616149902,-0.5657110027968884
GOOGL,2025-11-03 12:48:21+00:00,"Cipher Mining announces $5.5bn Amazon AI lease, posts in-line Q3 EPS; shares jump","Investing.com -- Cipher Mining on Monday reported third-quarter earnings that were roughly in line with market expectations, while revenue fell short of estimates.",https://finnhub.io/api/news?id=29ada4b5c2910cf795a974eec6a038a7d4ecf0f7d82c63271b7f2f3ef04cea0b,Yahoo,company,0.02224789373576641,0.019028913229703903,0.9587231278419495,-0.936475234106183
GOOGL,2025-11-03 12:19:54+00:00,Stock Futures Rising Ahead of Key Earnings. Markets Build on a Strong October.,"Stock futures were climbing Monday as investors geared up for another batch of quarterly earnings, with data analytics software developer Palantir and chip maker Advanced Micro Devices among the listed companies set to report this week.  Futures tracking the Dow Jones Industrial Average were up 15 points, or less than 0.1%.  S&P 500 futures added 0.4%, and contracts tied to the tech-heavy Nasdaq 100 gained 0.7%.",https://finnhub.io/api/news?id=c75e7610558ecedb094d817bf3d9538cf3a56428df3f016d9156b814f1e96ac0,Yahoo,company,0.9384305477142334,0.03270178660750389,0.02886759489774704,0.9095629528164864
GOOGL,2025-11-03 12:06:22+00:00,Canadian quantum computing firm Xanadu to list on Nasdaq via $3.6 billion SPAC deal,"The Canadian quantum computing firm expects to fetch nearly $500 million through the SPAC deal, including a $275 million  private investment in public equity.  Quantum computers are widely regarded to have the potential to solve problems beyond the capability of classical computers.  Qubits - the building blocks of quantum computing - can compute in minutes the reactions of trillions of atoms or cells over time, making them invaluable for medicinal and materials science breakthroughs.",https://finnhub.io/api/news?id=08c6028d268d5e1f4f5891767175e834af992bcb910042f86cd6a1690ddc2a36,Yahoo,company,0.2030816376209259,0.7866604328155518,0.01025792583823204,0.19282371178269386
GOOGL,2025-11-03 11:42:41+00:00,Alphabet Is Still The World's Most Efficient AI Monetizer,Alphabet Inc.âs Q3 revenue soars to $102B as AI-driven growth powers Google Services and Cloud. Click for my updated look at GOOG stock post earnings.,https://finnhub.io/api/news?id=b6ca70b8fedc8703322756587330f7f22140be1ed5e002fde04b6070315a8da2,SeekingAlpha,company,0.688451886177063,0.2926049828529358,0.018943140283226967,0.669508745893836
GOOGL,2025-11-03 11:42:00+00:00,Nvidia Stock Gains. Why U.S. Spending on AI Chips Is Outweighing China Curbs.,Nvidia stock was rising despite President Donald Trump signaling the U.S. will continue to curb exports of the company’s chips to Chinese customers.,https://finnhub.io/api/news?id=fb6257c7d1f4e8e1992bcd08b73e37f10057ff6d70d1c2f547a82e62ab392872,Yahoo,company,0.9398714303970337,0.023564893752336502,0.03656367212533951,0.9033077582716942
GOOGL,2025-11-03 11:29:12+00:00,"Meta: Gloomy Ad Revenue Outlook, Risky AI Bets Doubled","Meta Platforms, Inc. posted Q3 revenue growth but has shrinking EPS and muted ad gains. Click for my updated look at META earnings and why I maintain a Hold rating.",https://finnhub.io/api/news?id=57207ba7c3a7ac5abb6a2c5a031454bc9c91e2d237b7f6ad6ba6c37b0e6ce624,SeekingAlpha,company,0.017007313668727875,0.05202149599790573,0.9309712052345276,-0.9139638915657997
GOOGL,2025-11-03 11:00:37+00:00,Alphabet Vs. Meta: AI Circular Financing Winner,"Meta Platforms, Inc. & Alphabet Inc. are compared on CapEx strategies, AI investments, & strategic positioning. Read more on GOOGL & META stocks here.",https://finnhub.io/api/news?id=ec63b93081b705f035da1827531e40ddbc3bffe3132260d4fd8c30177f816147,SeekingAlpha,company,0.051540642976760864,0.9321892857551575,0.016270076856017113,0.03527056612074375
GOOGL,2025-11-03 06:00:26+00:00,JOET: Lagging Competitors Despite Good Fundamentals And Time-Proven Strategy,"The Virtus Terranova U.S. Quality Momentum ETF has a portfolio of 125 large and mid-cap stocks blending quality, momentum, and equal-weight methodology. Learn more on JOET ETF here.",https://finnhub.io/api/news?id=a048efc0350d61921ff1ef38cc1224c8462aad40f041a3be1ae362804a565a25,SeekingAlpha,company,0.12410164624452591,0.8659387826919556,0.009959548711776733,0.11414209753274918
GOOGL,2025-11-03 02:15:00+00:00,American Century Equity Income Fund Q3 2025 Key Contributors/Detractors And Notable Trades,Shares of Norfolk Southern climbed on the announcement that Union Pacific (UNP) would buy Norfolk Southern at a premium. Read more here.,https://finnhub.io/api/news?id=32aa42b0cc9e10c35b9c158076ccbcd933a5cfe31a2ddc1ad8bfdc7923554944,SeekingAlpha,company,0.6609033942222595,0.2771475613117218,0.06194905564188957,0.59895433858037
GOOGL,2025-11-02 17:14:04+00:00,TeraWulf (WULF): Valuation Insights Following Google-Backed Data Center JV and Expansive AI Pivot,"TeraWulf, fresh off announcing a large-scale data center joint venture with Fluidstack, is catching investor attention for more than its bitcoin mining roots. With Google backing $1.3 billion of lease obligations, this project marks a shift in the company's growth outlook. See our latest analysis for TeraWulf. TeraWulf’s latest partnerships and funding activities have clearly captured the market’s imagination, fueling a dramatic rally. A 30% share price return over the past month and a...",https://finnhub.io/api/news?id=fa1b55a6256cc06dcfe89fc46eb4dbcd87ff2312f9f068f773805e3139b72ca3,Yahoo,company,0.940781831741333,0.04593547806143761,0.013282733969390392,0.9274990977719426
GOOGL,2025-11-02 16:01:43+00:00,Quantum Threat to Bitcoin: How Panic Could Break Crypto Before Physics Does,Experts say the real danger to Bitcoin isn’t quantum machines—it’s human panic and slow preparation.,https://finnhub.io/api/news?id=b62f5b846ae5f7b70be2ea90cbec3f6ff190fe0ca2117986568ba5d222274882,Yahoo,company,0.02873884327709675,0.7991465926170349,0.17211458086967468,-0.14337573759257793
GOOGL,2025-11-02 16:00:00+00:00,Meta has an AI product problem,Meta's AI spending is starting to make Wall Street nervous.,https://finnhub.io/api/news?id=0af6b4f67ad6e89978ea25537fa7beaf4cd8f8ce3ff63795736eb878a80be9f9,Yahoo,company,0.010337324813008308,0.04537351429462433,0.9442891478538513,-0.933951823040843
GOOGL,2025-11-02 15:13:00+00:00,You Won't Believe What Elon Musk Just Said About Quantum Computing (Spoiler Alert: It's Good News),Elon Musk had some encouraging thoughts following Alphabet's latest quantum breakthrough.,https://finnhub.io/api/news?id=d8fa6db8f194be30b0f060bbb708dbbe3ce005527e5fce87b329cdc0954259b5,Yahoo,company,0.7058249115943909,0.2641664147377014,0.030008574947714806,0.6758163366466761
GOOGL,2025-11-02 12:19:25+00:00,How Investors May Respond To Lockheed Martin (LMT) Integrating Google AI Into National Security Operations,"In late October 2025, Lockheed Martin and Google Public Sector announced a collaboration to bring Google's advanced generative AI, including Gemini models, into Lockheed Martin's secure AI Factory, aiming to accelerate multi-modal data analysis, R&D, and logistics across critical national security programs. This move signals a significant shift toward integrating cutting-edge AI solutions in defense, potentially reshaping operational efficiency, product development, and digital...",https://finnhub.io/api/news?id=ce97ed18ed24e93012cab7a4d8afa0552076c32af85b650e431ee5dd51fa445b,Yahoo,company,0.8864007592201233,0.10484926402568817,0.008750000968575478,0.8776507582515478
GOOGL,2025-11-02 11:26:09+00:00,"Meta’s (META) AI Push Mirrors Metaverse Risks, Says Oppenheimer","Meta Platforms, Inc. (NASDAQ:META) is one of the AI Stocks on the Market’s Radar. On October 30, Oppenheimer downgraded the stock to “Perform” from Outperform without a price target. The firm said that there’s “too much uncertainty” surround the company’s AI investments following Q3 earnings. “Downgrading META to Perform (from Outperform) as risk/reward properly reflected after-hours.” According […]",https://finnhub.io/api/news?id=2969ab61dee975785169fbfcf5b6697883cda7e3c898586df1975d8b9b04153f,Yahoo,company,0.019508251920342445,0.07929447293281555,0.9011973142623901,-0.8816890623420477
GOOGL,2025-11-02 11:23:24+00:00,Bank of America Stays Bullish on Alphabet (GOOGL) as AI Leadership Strengthens,"Alphabet Inc. (NASDAQ:GOOGL) is one of the AI Stocks on the Market’s Radar. On October 30, Bank of America reiterated the stock as “Buy” and raised its price target on the stock to $335 per share from $280 following earnings. “We see Alphabet as well positioned long term with leading AI technology to apply to search, […]",https://finnhub.io/api/news?id=0ff68721aff4132559b953634e0dcf3ae9223d930ce1340a7f5ba6e7270fc64f,Yahoo,company,0.9301593899726868,0.05758332833647728,0.012257266789674759,0.917902123183012
GOOGL,2025-11-02 09:00:00+00:00,Amazon: Disbelieving Buyers Are Late Yet Again (Rating Downgrade),"Amazon shows strong AWS growth with AI initiatives and robust e-commerce, but free cash flow remains pressured. Check out why AMZN stock is downgraded to hold.",https://finnhub.io/api/news?id=5a000a104c8d54ad77711184bbac14e7fdebc9192f2195dcaae7b58246cf8e44,SeekingAlpha,company,0.31437164545059204,0.1547517478466034,0.530876636505127,-0.2165049910545349
GOOGL,2025-11-01 22:32:00+00:00,PayPal Shares Soar on OpenAI Partnership. Is It Too Late to Buy the Stock?,PayPal forges another big AI partnership.,https://finnhub.io/api/news?id=4f883008b435afaa1be8dd0162a03801e5813c7de1023a9a3482373e58cd4cdb,Yahoo,company,0.16060180962085724,0.8016659021377563,0.037732236087322235,0.122869573533535
GOOGL,2025-11-01 19:31:15+00:00,"Alphabet (GOOGL)’s Conference Call Was “A Tour De Force,” Says Jim Cramer",We recently published 10 Stocks on Jim Cramer’s Radar. Alphabet Inc. (NASDAQ:GOOGL) is one of the stocks Jim Cramer recently discussed. Alphabet Inc. (NASDAQ:GOOGL)’s earnings report saw its shares jump by 4% after it beat analyst revenue and EPS estimates and reported a $155 billion cloud backlog. Cramer discussed the earnings report and compared the […],https://finnhub.io/api/news?id=29a124b79cced494a5d3ca7a3df502eeb35e32df8296d4fc6ef42418a85960bf,Yahoo,company,0.3802984356880188,0.5866315960884094,0.0330699123442173,0.3472285233438015
GOOGL,2025-11-01 10:55:28+00:00,Alphabet: Rally Catches Up To Reality,"Alphabet's Cloud backlog hits $155B with 34% revenue growth and AI adoption driving demand, while margins reach 23.7%. Check out why GOOG stock is a hold.",https://finnhub.io/api/news?id=567decbe07f212a8c815a51fb6043915df97edb8efacc1e96454750c66f70968,SeekingAlpha,company,0.4265103340148926,0.5414727330207825,0.03201698139309883,0.39449335262179375
GOOGL,2025-11-01 10:36:49+00:00,Cipher Mining: 'Google Premium' Can Push Shares Higher,Cipher Mining pivots to AI HPC workloads with a $3B Google/Fluidstack partnership and 72% projected 2025 revenue growth. Check out why CIFR stock is a buy.,https://finnhub.io/api/news?id=f459cd852f3423547750ad7e2384a1f80d51ebac3a4006d03e4c52849ae9b24e,SeekingAlpha,company,0.5170396566390991,0.4724830985069275,0.010477259755134583,0.5065623968839645
GOOGL,2025-11-01 10:15:00+00:00,5 Top Artificial Intelligence (AI) Stocks to Buy in November,The AI arms race will intensify heading into 2026.,https://finnhub.io/api/news?id=e04c0f48358d9d08e0bb4f2efbe040e2c20f17c41bd40dab37edd9d151ea8833,Yahoo,company,0.24508465826511383,0.7409165501594543,0.013998769223690033,0.2310858890414238
GOOGL,2025-11-01 08:44:00+00:00,Could Google Parent Alphabet Become the Nvidia of Quantum Computing?,"Being Google's parent should be enough for Alphabet, even if it doesn't ultimately dominate the quantum chip market.",https://finnhub.io/api/news?id=6bbf544a8ab39c1e0fc8baad55ed107f6fff793cff16b59879ed1edb45af1c54,Yahoo,company,0.21268245577812195,0.7794386744499207,0.00787887442857027,0.20480358134955168
AMZN,2025-11-07 19:24:00+00:00,"Affirm Eyes Card Payments as Next Era of Buy Now, Pay Later","Buy now, pay later companies like Affirm are aiming to compete more closely with credit-card companies.",https://finnhub.io/api/news?id=e2f84f80f405f870eb47eccf012234f47102e36ac3381490a76ab5dd5b38e7b1,Yahoo,company,0.665359616279602,0.3269602358341217,0.007680128328502178,0.6576794879510999
AMZN,2025-11-07 19:11:48+00:00,BETA Technologies (BETA): Assessing Valuation After Billion-Dollar IPO and High-Profile Investor Backing,"BETA Technologies has just completed its initial public offering on the New York Stock Exchange. The company raised over $1 billion and reached a multibillion-dollar valuation. The IPO attracted high-profile investors, including GE Aerospace and Amazon. See our latest analysis for BETA Technologies. BETA Technologies’ public debut pressured the share price slightly. After a strong open above IPO pricing, the 1-day share price return settled at -3.5%, while year-to-date the stock remains close...",https://finnhub.io/api/news?id=1c372e29683aecfeac6ec3fabd7ac06b572c6eef1847de4778d6d609d8d16f34,Yahoo,company,0.8077214956283569,0.03980351984500885,0.15247498452663422,0.6552465111017227
AMZN,2025-11-07 18:26:48+00:00,Amazon Brings Temu Competitor App To 14 New Countries. These E-Commerce Stocks Are Falling.,"Amazon on Friday announced Amazon Bazaar, a low-cost shopping app that will ship products to 14 countries in Asia, Africa and Latin America.  Amazon stock was lower, while U.S. shares of competitors in global markets such as MercadoLibre, Sea Limited and Temu parent PDD Holdings also fell on a down day for markets overall.",https://finnhub.io/api/news?id=108e3d15e3030a202c1beaddb2c27db3278305c48efcde430e86e39f51538c23,Yahoo,company,0.00746500538662076,0.018406614661216736,0.9741283655166626,-0.9666633601300418
AMZN,2025-11-07 18:02:28+00:00,Why Progyny Stock Is Soaring Today,"Progyny generates nearly $200 million in free cash flow annually and holds over $300 million in cash, yet it has a market cap of only $1.9 billion. It could be a bargain as stock-based compensation dwindles.",https://finnhub.io/api/news?id=0be9b0a001d208b7e70ba0171c7960aa9722027582d9216d4cbdfd8213afdc35,Yahoo,company,0.016210637986660004,0.043317753821611404,0.9404715895652771,-0.9242609515786171
AMZN,2025-11-07 17:31:26+00:00,Ray Dalio Warns That Things Aren't As Good As They Appear Despite New Highs In The Stock Market: 'You Can't Look At The U.S. As A Whole Nowadays',"Bridgewater Associates founder Ray Dalio is skeptical of the U.S. economy despite a soaring stock market and rising GDP, and his flaws point to future economic challenges if they are not addressed. He warned of a country that heavily depends on the top 1% of its workers. The stock market and economy are heavily tied to artificial intelligence, which has created a rosy picture, as many industries and workers face challenges. ""You can't look at the U.S. as a whole nowadays,"" Dalio said at the Fort",https://finnhub.io/api/news?id=d96c8abdf85ffefd5eb508d01fd417cbf52db0eb3347081bae5118d56030b63c,Yahoo,company,0.053590670228004456,0.3086409270763397,0.6377683281898499,-0.5841776579618454
AMZN,2025-11-07 16:42:00+00:00,Western Digital and Seagate Soar Despite the AI Selloff. Why Wall Street Remains Bullish.,Data storage is an important part of AI. That’s why Western Digital and Seagate are among the top gainers in the S&P 500 this year.,https://finnhub.io/api/news?id=70eb49f6f41f33fe137019ac0b773be0d7a77c83210be834cc636f475b4bdb31,Yahoo,company,0.4019269645214081,0.5759302377700806,0.022142786532640457,0.3797841779887676
AMZN,2025-11-07 16:37:15+00:00,"Trade Desk Faces Growing Competition, Wedbush Says","Trade Desk (TTD) is expected to expand its revenue, but growing competition from Amazon's (AMZN) dem",https://finnhub.io/api/news?id=8166a97f1e4a17e1c706141b3848e1b3fc5a210b30c76417bc5d3c2c562cc091,Yahoo,company,0.9537783265113831,0.02809077501296997,0.018130887299776077,0.935647439211607
AMZN,2025-11-07 16:30:32+00:00,Jim Cramer Discusses His Trading Strategy & Eaton (ETN),"We recently published 8 Stocks Jim Cramer Talked About. Eaton Corporation plc (NYSE:ETN) is one of the stocks Jim Cramer recently discussed. Cramer discussed industrial and electrical equipment provider Eaton Corporation plc (NYSE:ETN) as part of his Morning Take. These remarks came a day after his morning appearance, where he had commented: “It’s a really […]",https://finnhub.io/api/news?id=7f3d11364af8e8fcb9cbcc77cb99b1e451b08b212b505d879a4fb8b6e06e4b3d,Yahoo,company,0.03857571259140968,0.935225784778595,0.0261984933167696,0.012377219274640083
AMZN,2025-11-07 16:12:39+00:00,Jim Cramer Is Surprised By Amazon.com (AMZN) Owning NVIDIA GPUs,"We recently published 10 Stocks Jim Cramer Discussed Including His Palantir Deep Dive. Amazon.com, Inc. (NASDAQ:AMZN) is one of the stocks Jim Cramer recently discussed. Cramer has frequently discussed Amazon.com, Inc. (NASDAQ:AMZN) before and after its latest earnings report. Ahead of the earnings, he wondered whether the firm’s decision to focus on in-house Trainium AI […]",https://finnhub.io/api/news?id=e9802ab2cee437fbd30ad5f2a44d349fecc81ab3fa7ff2b642fe5461e7cd47c5,Yahoo,company,0.04152121767401695,0.9350609183311462,0.023417923599481583,0.01810329407453537
AMZN,2025-11-07 15:58:42+00:00,Meta Stock Falls Again As Social Media Giant Replaces Amazon As Magnificent Seven Laggard,"Meta Platforms stock fell early Friday, putting the Facebook parent company on pace for declines in six out of the past seven trading days.  With its year-to-date gain whittled down to 4%, Meta is the new Magnificent Seven laggard.  Meta's slide kicked off with its third-quarter earnings report on Oct. 29.",https://finnhub.io/api/news?id=889d160864da89513bba6d65bd34a65dcc332b6296560ca8541c66f3dcab84e1,Yahoo,company,0.014731950126588345,0.010471892543137074,0.9747961163520813,-0.960064166225493
AMZN,2025-11-07 15:55:07+00:00,Amazon Prime or Amazon Stock? Here’s What That $139 Annual Fee Could Be Worth if You Invested It Over 10 Years,What if you invested your Amazon Prime fee instead of spending it? See how $139 a year could grow in Amazon stock over a decade.,https://finnhub.io/api/news?id=4cf0ff71e7a92c9c0098836fcad398ed5f3c25c175c35962f868a9ec453cf71f,Yahoo,company,0.04148687422275543,0.9361920952796936,0.022321030497550964,0.019165843725204468
AMZN,2025-11-07 15:14:31+00:00,Amazon takes low-cost ecommerce service global,"The expansion ⁠of the ‌service comes at a time when U.S. President Donald ‍Trump's sweeping import tariffs are denting consumer sentiment, especially of lower-income groups,​ who are on a constant ‌hunt for cheaper deals.  The new app, similar to Amazon Haul, will deliver a majority of products priced under $10 and some as low as $2,⁠ ranging from home ​goods to fashion, ​according to the e-commerce giant.  Some of the newer markets ‍for the ⁠low-cost ecommerce service include Hong Kong, the Philippines and Taiwan, ⁠it said.",https://finnhub.io/api/news?id=28d8529a4bf97a9a934fc3d05c306f55fe509465f985ceeb225f5ba774e8d284,Yahoo,company,0.1367540806531906,0.5902306437492371,0.2730153501033783,-0.13626126945018768
AMZN,2025-11-07 13:20:40+00:00,We Think That There Are Issues Underlying Amazon.com's (NASDAQ:AMZN) Earnings,"Amazon.com, Inc. ( NASDAQ:AMZN ) just reported some strong earnings, and the market reacted accordingly with a healthy...",https://finnhub.io/api/news?id=1373c380774c1f0ae47d7acf63d5137f4cf0c97ad4fa4bbaaf6bfcdecb7444f9,Yahoo,company,0.9464762806892395,0.02347579225897789,0.03004785254597664,0.9164284281432629
AMZN,2025-11-07 11:19:53+00:00,"Why Is Bitcoin Down Today, What’s The Next Big Thing? (Crypto Weekly Round-Up)","Why is Bitcoin down today? Moreover, how do I profit from the inevitable US financial crash that will occur when the AI bubble pops? I have $73 in my bank account. I need help here. We don’t know what… Or when… But something financial, good or bad, will happen… For ...",https://finnhub.io/api/news?id=5b19cec50e33b9be9c85298c1e915b1cbd61c7a10f7d4a4777c857a44534d981,Yahoo,company,0.06110486388206482,0.7768986225128174,0.16199654340744019,-0.10089167952537537
AMZN,2025-11-07 11:13:11+00:00,"The Week in Numbers: Musk's massive payday, Nintendo powers up","STORY: From Elon Musk's massive payday to Nintendo's Switch 2 power-up, this is the The Week in Numbers. :: The Week in Numbers:: $1 trillion$1 trillion is how much Tesla CEO Elon Musk could get in the carmaker's stock over the next decade.Although required payments would take the value down to $878 billion.It comes after he won shareholder approval for the largest corporate pay package in history.A majority of Investors endorsed his vision to adapt the EV maker into an AI and robotics heavyweight.Tesla's board had warned Musk could leave if the compensation plan didn't go through.:: $38 billion$38 billion is the value of a deal signed between OpenAI and Amazon.The seven-year agreement allows the ChatGPT maker to buy cloud services from Amazon.It marked OpenAI's first big push to power its AI ambitions after a recent restructure gave it more operational and financial freedom.It also gives the firm access to hundreds of thousands of Nvidia graphics processors to train and run its AI models.:: 10%10% was how many flights U.S. transport authorities ordered cut at 40 major airports.Although the plan was later changed to 4% of domestic flights before ramping up to a full 10% cut by November 14.The call was made while the longest government shutdown in U.S. history drags on.It has forced 13,000 air traffic controllers and 50,000 transport security agents to work without pay, causing staff shortages and flight delays.:: $342 million$342 million was the operating profit Nissan drove to during the most recent quarter.It was the Japanese automaker's best quarterly result in more than a year and easily beat forecasts.The profit was largely thanks to Nissan's efforts to lower fixed costs under a turnaround plan and stronger sales in North America.:: 19 millionAnd 19 million is how many Switch 2 consoles Nintendo now expects to sell for the financial year.It's higher than the Japanese gaming giant first thought it would be.Customers have been drawn to titles like ""Mario Kart World"" and ""Donkey Kong Bonanza.""Nintendo also raised its full-year operating profit forecast by 16% to $2.45 billion.",https://finnhub.io/api/news?id=3bdadd0b225f90b37d5b5268588c7456aa52b52fe9c087e8d29d834e5997c4fa,Yahoo,company,0.428396612405777,0.09479660540819168,0.47680675983428955,-0.04841014742851257
AMZN,2025-11-07 10:30:00+00:00,My 5 Favorite Stocks to Buy Before 2026,These stocks can still skyrocket before the year is out.,https://finnhub.io/api/news?id=b99973dfd9ca74c91d20da06bc84b37250cb7ce25a41741eebb14c86f93896a5,Yahoo,company,0.050129830837249756,0.6851344704627991,0.26473572850227356,-0.2146058976650238
AMZN,2025-11-07 09:05:00+00:00,This Controversial Decision Is Already Paying Off for UPS Stock,"Earlier this year, UPS announced it would be slashing its Amazon-related business in half.",https://finnhub.io/api/news?id=395b1156d695f55650b7c44ed7c1d090c6d99f68d05197aa1a516deedc457da1,Yahoo,company,0.007137727923691273,0.029759857803583145,0.9631023406982422,-0.9559646127745509
AMZN,2025-11-07 08:45:00+00:00,"Is Amazon a Buy, Sell, or Hold in 2025?",Amazon has experienced both tough times and growth in recent years.,https://finnhub.io/api/news?id=3068390ce46610c7ecfed55e09eba7a2370435ea63a778f368ff8aab069794d8,Yahoo,company,0.49271756410598755,0.4261268973350525,0.08115551620721817,0.4115620478987694
AMZN,2025-11-07 08:15:00+00:00,"This Stock Is Up 1,500% Since Its IPO: Here's Why It Might Split in 2026",A stock split makes shares more accessible to a broader range of investors.,https://finnhub.io/api/news?id=60de9b5a38602236e7c2e102d455696df4071f75a59eaf06eed36062172e8c5b,Yahoo,company,0.4118022322654724,0.5772956609725952,0.010902108624577522,0.4009001236408949
AMZN,2025-11-07 05:13:40+00:00,Affirm Holdings Inc (AFRM) Q1 2026 Earnings Call Highlights: Strategic Partnerships and ...,"Affirm Holdings Inc (AFRM) extends its Amazon partnership and sees increased consumer engagement, despite competitive pressures and market challenges.",https://finnhub.io/api/news?id=4d326933cf8e320c3cd76b92a6dde4393a23671b1265250a831c361275af044a,Yahoo,company,0.954566478729248,0.032290372997522354,0.013143169693648815,0.9414233090355992
AMZN,2025-11-07 03:31:45+00:00,Q3 Earnings Highlights: Amazon (NASDAQ:AMZN) Vs The Rest Of The Online Retail Stocks,"The end of the earnings season is always a good time to take a step back and see who shined (and who not so much). Let’s take a look at how online retail stocks fared in Q3, starting with Amazon (NASDAQ:AMZN).",https://finnhub.io/api/news?id=77440226298ba44a3d23e4e64a1464ef5a4546bcd76050b4cbd1e4e163d419a0,Yahoo,company,0.05507886782288551,0.8948167562484741,0.05010439455509186,0.004974473267793655
