ticker,datetime,title,summary,url,source,category,sent_positive,sent_neutral,sent_negative,sent_net
MSFT,2025-11-04 14:10:00+00:00,Veeam Extends Support for Microsoft Sentinel to Elevate Security Intelligence and Data Resilience,"SEATTLE, November 04, 2025--Veeam App for Microsoft Sentinel empowers organizations with real-time backup intelligence and automated threat response for enhanced cyber resilience",https://finnhub.io/api/news?id=799c6cbbdd8412ed77e83b07e00d31ec930a179af4a92914395ac63c69b18282,Yahoo,company,0.904455840587616,0.08616100996732712,0.009383189491927624,0.8950726510956883
MSFT,2025-11-04 14:06:00+00:00,"Conversational Computing Platform Forecast Report 2025: A $107.16 Billion Market by 2034, Driven by Rising Adoption of Messaging App Bots and Voice-Based Virtual Assistants for Customer Service","Opportunities in the conversational computing market include rising demand for chatbots in customer service, expanding use of voice-based assistants, and growth in key regions such as North America and Asia-Pacific. Companies like Amazon, Google, and Microsoft drive innovation, enhancing market growth potential. Conversational Computing Platform Market Conversational Computing Platform Market Dublin, Nov. 04, 2025 (GLOBE NEWSWIRE) -- The ""Conversational Computing Platform Market Report and Forec",https://finnhub.io/api/news?id=3b884cff1c353f91d9f82a04eea50e6a608032d6842d0b59d7d78ed0761c1d7e,Yahoo,company,0.7658554911613464,0.22488394379615784,0.009260516613721848,0.7565949745476246
MSFT,2025-11-04 14:00:00+00:00,Mercy Advances Groundbreaking AI Tool for Nursing Through Collaboration with Microsoft Dragon Copilot,"Mercy is helping lead the way in transforming nursing care through technology. In collaboration with Microsoft, Mercy is playing a key role in the development of the first commercially available ambient AI solution for nurses within Microsoft Dragon Copilot.",https://finnhub.io/api/news?id=97ea97f71960468bce2c076d2ead3f60a2d0cea029e283a87b512a2db0c32bb4,Yahoo,company,0.5543959736824036,0.43669450283050537,0.008909541182219982,0.5454864325001836
MSFT,2025-11-04 14:00:00+00:00,Former Cisco Systems COO Maria Martinez Joins Alkira's Advisory Board,"Alkira®, the leader in Network Infrastructure as a Service (NIaaS), today announced the appointment of Maria N. Martinez to its advisory board.",https://finnhub.io/api/news?id=33fd3d340cbbe7caa5631515ada138491420b0909c09ca15cf050f515baac6b4,Yahoo,company,0.03467399999499321,0.932729184627533,0.03259682655334473,0.0020771734416484833
MSFT,2025-11-04 13:29:30+00:00,Sam Altman pushes back an critics of OpenAI’s finances,Altman said OpenAI’s revenue is “growing steeply” and that the company expects strong demand across its consumer and enterprise businesses,https://finnhub.io/api/news?id=52d28bd325d26ce58a602f493fb760392eb7860be70379da87eb223744e6ae7b,Yahoo,company,0.9277095794677734,0.035850588232278824,0.03643978014588356,0.8912697993218899
MSFT,2025-11-04 13:10:41+00:00,"Wall Street Lunch: 'Big Short' Investor Michael Burry Bets Against Nvidia, Palantir",Burryâs hedge fund Scion Asset Management has bought put options on 1 million shares of Nvidia and 5 million shares of Palantir.,https://finnhub.io/api/news?id=24a843f0c60e9ab68245d31f5b3cf427b37d2be02aab6136fe5cd5574dd6ddfa,SeekingAlpha,company,0.07274335622787476,0.9016144275665283,0.02564224973320961,0.047101106494665146
MSFT,2025-11-04 13:00:00+00:00,Hornetsecurity boosts Microsoft 365 security against compromised accounts with new Teams Protection functionality,"Leading cybersecurity provider Hornetsecurity today announced major enhancements to its Teams Protection solution, powered by its AI Cyber Assistant, with the rollout of new functionality to address the increasing prevalence of Microsoft Teams as an attack vector and help protect end users against the growing incidence of attacks via compromised accounts.",https://finnhub.io/api/news?id=fad5d4e3b9c26b5e240786c143166533d37ec23a0f714564344e4904a7adc006,Yahoo,company,0.9453250169754028,0.04049442708492279,0.014180496335029602,0.9311445206403732
MSFT,2025-11-04 12:50:24+00:00,IREN Stock Jumps After Microsoft Signs Multi-Billion Dollar GPU Deal,IREN Lands Game-Changing $9.7B Microsoft Contract,https://finnhub.io/api/news?id=daedc12a1136434be8ec1856f84894bcb80ffd86f17287aa9c3f6bbbbc8ffb76,Yahoo,company,0.5539193749427795,0.35283634066581726,0.09324435144662857,0.46067502349615097
MSFT,2025-11-04 12:45:00+00:00,Infinum Named Microsoft Solutions Partner for Digital & App Innovation,"Leading digital product development company Infinum has been named a Microsoft Solutions Partner for Digital & App Innovation, joining Microsoft's network of certified partners.",https://finnhub.io/api/news?id=49964428a1aad092f33aa7a3b7ff35b0a13f49ba2717c5f00e0c2a3401570752,Yahoo,company,0.7969526648521423,0.19544513523578644,0.00760222552344203,0.7893504393287003
MSFT,2025-11-04 12:25:33+00:00,Microsoft Sets AI Inference Record With Azure ND GB300 v6,Test powered by Nvidia GPUs reaches 1.1 million tokens per second,https://finnhub.io/api/news?id=e05572e7e3fa73ce901f1ab9be8a484ffb6e7cd0cf7b08d2dfa2a16cc80464d3,Yahoo,company,0.580650806427002,0.39424970746040344,0.02509952522814274,0.5555512811988592
MSFT,2025-11-04 12:01:02+00:00,"IREN Limited: $9.7B Microsoft Catalyst, But I Remain Cautious Into Q1 On Dilution Risk",IREN Limited's $9.7B Microsoft deal and Sweetwater hub expansion could boost AI cloud growth and GPU capacity. Click for my IREN earnings preview.,https://finnhub.io/api/news?id=134300d9293026f7739033b8542f59738789c15ddc1a4cb44ffe4b9cd625ff26,SeekingAlpha,company,0.7068502902984619,0.2660668194293976,0.02708291821181774,0.6797673720866442
MSFT,2025-11-04 12:00:02+00:00,Bull Put Spread Provides Opportunities for Long-Term Microsoft Bulls,Microsoft (MSFT) has seen some heavy selling in recent days but is holding nicely above the 50-day moving average. This long-term bull put spread will profit if Microsoft stays above 430.,https://finnhub.io/api/news?id=b403b08d72ae772774fe019d29bb84c47dd30225c2d56f2556f62cda226a8630,Yahoo,company,0.9205995202064514,0.029724033549427986,0.049676354974508286,0.8709231652319431
MSFT,2025-11-04 12:00:00+00:00,This Famous Method of Valuing Stocks Is Pointing Toward Some Rough Years Ahead,"For the second time ever, U.S. stocks have crossed a valuation milestone, suggesting low future returns.",https://finnhub.io/api/news?id=b42eeaef8ed6082f0506df38ab3acc7d45bd1c6311faf3c5e52ded7195e1a49a,Yahoo,company,0.011751421727240086,0.019362490624189377,0.9688860774040222,-0.9571346556767821
MSFT,2025-11-04 10:30:01+00:00,"Scale AI's life after Meta deal has been rocky, but CFO insists it's not a 'zombie company'","Five months after Scale AI's high-profile founder was hired by Meta, the startup is trying to show that it's still on a growth trajectory. ",https://finnhub.io/api/news?id=13910384d9799df076aae80101df7b03bc052401f6fa67446706fe179ce3abee,CNBC,company,0.5233820080757141,0.4516037702560425,0.025014175102114677,0.49836783297359943
MSFT,2025-11-04 10:02:03+00:00,Palantir stock drops 8% on valuation concerns as CEO Karp rips short seller 'market manipulation',Wall Street analysts raised concerns about Palantir's elevated valuation and famed hedge fund manager Michael Burry revealed a short position.,https://finnhub.io/api/news?id=6961edafcaeafc65d506f4bea620519adb744d1c7af007f83fc26dc9051560cf,CNBC,company,0.011363779194653034,0.018906723707914352,0.969729483127594,-0.958365703932941
MSFT,2025-11-04 09:00:01+00:00,"Instacart rolls out AI tools for grocers, Sprouts will be first to use its Cart Assistant","Instacart's AI Solutions, a suite of artificial intelligence tools for grocers, includes agentic inventory tracking and an AI shopping assistant.",https://finnhub.io/api/news?id=5c194f0ad431f42dcfc1ff1c9a322259fc794b2ea880c35115150fceef49c866,CNBC,company,0.1692846268415451,0.8224321603775024,0.008283214643597603,0.1610014121979475
MSFT,2025-11-04 08:15:01+00:00,Amazon's new subsea internet cable Fastnet will have the capacity to stream 12.5 million HD movies simultaneously,"Amazon is building a subsea fiber-optic cable called Fastnet to connect Maryland's Eastern shore to County Cork, Ireland.",https://finnhub.io/api/news?id=bafce3556dfd9a7b079902d7ce820a5fe03e7a4572fd797039fa0392c5606940,CNBC,company,0.21368440985679626,0.7780728340148926,0.00824274867773056,0.2054416611790657
MSFT,2025-11-04 06:40:00+00:00,Markets Face a Big Risk From This AI Spending Spree. What to Watch.,Markets Face a Big Risk From This AI Spending Spree. What to Watch.,https://finnhub.io/api/news?id=5aba2d53cb9f4bb00add1e2873651c0b959c24bbcc61c0a9ea81c14fe63758f0,MarketWatch,company,0.02996373362839222,0.7810605764389038,0.18897564709186554,-0.15901191346347332
MSFT,2025-11-03 19:24:46+00:00,These 2 Blue Chips Took Massive Hits. Are Either Worth Picking Up?,"With a big week of earnings just wrapped up, stock pickers might be feeling a bit of pain, even though the Nasdaq 100 is still just a hair shy of its all-time highs. Undoubtedly, it was a pretty choppy earnings season if you look underneath the hood, with the likes of Chipotle Mexican Grill (NASDAQ:CMG) ... These 2 Blue Chips Took Massive Hits. Are Either Worth Picking Up?",https://finnhub.io/api/news?id=56a76aaa99efd2f2fafe867b95e303472d183b6e465a44cba316e88cf0d84908,Yahoo,company,0.09824833273887634,0.40749064087867737,0.4942610263824463,-0.39601269364356995
MSFT,2025-11-03 16:53:16+00:00,Microsoft's $9.7 billion deal with IREN shows bitcoin miners' AI pivot is paying off,IREN said that it struck a five-year agreement making Microsoft its largest customer.,https://finnhub.io/api/news?id=59124a7185d1e2a0815e0b514d35ec8030ca6a9a4e41269cd7194d4e237ac5d7,Yahoo,company,0.944384753704071,0.038480859249830246,0.01713434047996998,0.9272504132241011
MSFT,2025-11-03 19:09:23+00:00,This Bitcoin Miner's Stock Is Soaring on a $9.7B AI Data Center Deal With Microsoft,Shares of IREN jumped to a record high Monday after the Australian Bitcoin miner and data center company said it inked a $9.7 billion deal with Microsoft.,https://finnhub.io/api/news?id=fa8dad1215dd5bc88d2520ef049446b13268df523d60c280a5f231e431e32f0e,Yahoo,company,0.9391606450080872,0.03439081832766533,0.02644851990044117,0.912712125107646
MSFT,2025-11-03 19:09:00+00:00,Equities Mostly Rise Intraday Amid Amazon Boost as Markets Await Week's Key Earnings,US benchmark equity indexes were mostly higher after midday Monday amid a jump in Amazon.com (AMZN),https://finnhub.io/api/news?id=6b710a8664ba9129bb9d27ae0ca2758fbe49832385b4441ab07935200b23531c,Yahoo,company,0.9315856099128723,0.027778342366218567,0.04063614085316658,0.8909494690597057
MSFT,2025-11-03 18:53:18+00:00,OpenAI signs $38 billion deal to use Amazon's cloud platform,"STORY: OpenAI, the maker of ChatGPT, has signed a seven-year, $38 billion deal to buy cloud services from Amazon.It's the company's first big push to power its AI ambitions after a restructuring last week that gave it greater operational and financial freedom.The agreement, announced on Monday, will give OpenAI access to hundreds of thousands of Nvidia graphics processors to train and run its artificial intelligence models.It underscores the AI industry's insatiable appetite for computing power as companies race to build systems that can rival or surpass human intelligence.OpenAI CEO Sam Altman has said the startup is committed to spending $1.4 trillion to develop 30 gigawatts of computing resources - enough to roughly power 25 million U.S. homes.The deal is also a major vote of confidence for Amazon's cloud unit, Amazon Web Services, which some investors feared had fallen behind rivals Microsoft and Google in the AI race.Those fears were somewhat eased by strong growth reported in the September quarter.Amazon shares hit an all-time high on Monday, with the company set to add nearly $140 billion to its market value.",https://finnhub.io/api/news?id=4e8fba37198f51db9674d73516d9c08fe682040e9303c6eac7766e136bd8c897,Yahoo,company,0.8691256642341614,0.11924304068088531,0.011631378903985023,0.8574942853301764
MSFT,2025-11-03 18:49:19+00:00,Sector Update: Tech Stocks Mixed Monday Afternoon,"Tech stocks were mixed Monday afternoon, with the Technology Select Sector SPDR Fund (XLK) rising 0.",https://finnhub.io/api/news?id=5a51b168d1bcda9839a157e0070845517fe42298082dc7e0545373fa856819d6,Yahoo,company,0.9186323285102844,0.019574008882045746,0.06179356947541237,0.856838759034872
MSFT,2025-11-03 18:38:07+00:00,"Stock Market Today: Dow Down, But Amazon Leaps On OpenAI Move; This Stock Soars On Microsoft Deal (Live Coverage)",Stock Market Today: The Dow Jones index slips Monday. Amazon stock soars on deal with OpenAI. Kimberly-Clark plunges.,https://finnhub.io/api/news?id=0f5e750015673b217394c44043decb4a288e021cfcf3ff50f0e81f6140117ca7,Yahoo,company,0.013215114362537861,0.037318889051675797,0.9494659900665283,-0.9362508757039905
MSFT,2025-11-03 18:34:09+00:00,"US Equity Indexes Mixed as Amazon Helps Consumer Discretionary, Technology Buck Declining Trend",US equity indexes traded mixed after midday Monday as Amazon.com's (AMZN) $38 billion deal with the,https://finnhub.io/api/news?id=5107940486aeb694ae5394beab7e2f21d1c919f8be2d497f5e0548b6e41a2b4c,Yahoo,company,0.2443671077489853,0.042350493371486664,0.7132823467254639,-0.4689152389764786
MSFT,2025-11-03 18:31:09+00:00,Elon Musk Calls Out Sam Altman Over Tesla Roadster Refund: 'This Issue Was Fixed and You Received a Refund Within 24 Hours',"Elon Musk and Sam Altman are once again in a public spat, this time over a car. The latest clash centers on the OpenAI CEO's canceled reservation for the long-delayed Tesla Inc. (NASDAQ:TSLA) Roadster, reigniting tensions between two of Silicon ...",https://finnhub.io/api/news?id=a8833eab2d4cc607ed20eb826f1b15aa15a7df318bb48b702a6248e62ab2a668,Yahoo,company,0.010496067814528942,0.06116862967610359,0.9283353090286255,-0.9178392412140965
MSFT,2025-11-03 18:26:59+00:00,Hippocratic AI valued at $3.5 billion in latest financing round,"(Reuters) -Hippocratic AI raised $126 million in its latest funding round led by Avenir Growth, it said on Monday, valuing the healthcare company at $3.5 billion and underscoring venture capital's",https://finnhub.io/api/news?id=87d106b6fd41794dc803433201ad043a5b0f7091188ef3bdd287c6c36c6f7c70,Yahoo,company,0.9458749294281006,0.03486049920320511,0.01926458813250065,0.9266103412955999
MSFT,2025-11-03 18:25:26+00:00,Cloud startup Lambda unveils multi-billion-dollar deal with Microsoft,(Reuters) -Artificial intelligence cloud startup Lambda said on Monday it has entered into a multi-billion-dollar agreement with Microsoft to deploy tens of thousands of AI chip leader Nvidia's,https://finnhub.io/api/news?id=3fe0ba06a1372b0958f3b6a87a574298c41f34582b403948e439d61f8fceb900,Yahoo,company,0.9397532939910889,0.04269483685493469,0.017551928758621216,0.9222013652324677
MSFT,2025-11-03 18:17:00+00:00,2 Artificial Intelligence (AI) Stocks You Can Buy and Hold for the Next Decade,Recent earnings results highlight these companies as big-time AI winners.,https://finnhub.io/api/news?id=8901ab6790974d9d333bcd98145d5f40965471ded6e73c399859e26d37ac5c73,Yahoo,company,0.5850682258605957,0.4008614122867584,0.014070323668420315,0.5709979021921754
MSFT,2025-11-03 18:15:05+00:00,"Amazon & OpenAI team up, Microsoft partners with startup Lambda","Yahoo Finance's John Hyland outlines some of the top stories on Wall Street as part of Monday's Market Minute, including Amazon's (AMZN) OpenAI (OPAI.PVT) deal, Microsoft (MSFT) partnering with Lambda (LAMD.PVT), and Ford (F) and Hyundai's (005380.KS) declining electric vehicle (EV) sales. Stay up to date on the latest market action, minute-by-minute, with Yahoo Finance's Market Minute.",https://finnhub.io/api/news?id=f8b090387b9c9de7ae5e21b8aa78e2c0aaf303e6a792d96d543b5f2ced25a033,Yahoo,company,0.07790087163448334,0.8780057430267334,0.04409338906407356,0.033807482570409775
MSFT,2025-11-03 17:41:27+00:00,Morning Minute: Tether Prints $10 Billion in Profit,"Stablecoin giant Tether has tripled its USDT supply since 2023, and generating profits that would make major banks jealous.",https://finnhub.io/api/news?id=61e04da44351f888c3dc33e40bfc018feec1dd707e80a7c599c121bf6a42be38,Yahoo,company,0.9246049523353577,0.02680746652185917,0.048587556928396225,0.8760173954069614
MSFT,2025-11-03 17:32:47+00:00,Amazon Web Services Signs $38 Billion Cloud Deal With OpenAI,Amazon.com (AMZN) secured a $38 billion deal with OpenAI that allows the Microsoft-backed (MSFT) art,https://finnhub.io/api/news?id=5f92e6dc5f0e89e18ae24d943d3a61015b82bafa130a1b45ff82ed9433507be6,Yahoo,company,0.9235388040542603,0.06648007780313492,0.009981131181120872,0.9135576728731394
MSFT,2025-11-03 17:29:00+00:00,"This chart shows the risk of an AI bubble is growing, says a stalwart stock-market bull","This chart shows the risk of an AI bubble is growing, says a stalwart stock-market bull",https://finnhub.io/api/news?id=a5b90a7fc81096e5cca0f253f809b42303f52fd281fd72b4289a47ed3072813b,MarketWatch,company,0.1597561091184616,0.795446515083313,0.04479736462235451,0.1149587444961071
MSFT,2025-11-03 17:10:58+00:00,IREN's Got Room For More Than Just Microsoft,"IREN Limited stock surged after a $9.7B, 5-year Microsoft deal. Click for why analysts are bullish and how AI demand could boost IREN stock further.",https://finnhub.io/api/news?id=565c7371f49b9db5f9acfc854db021c9a2bc46d46f51b4480a05c150e0cdd5de,SeekingAlpha,company,0.7718127965927124,0.2114887535572052,0.016698522493243217,0.7551142740994692
MSFT,2025-11-03 17:00:52+00:00,"Verizon, AWS expand tie up with new fiber network to power AI applications","Verizon (VZ) announced a deal with Amazon (AMZN) Web Services on Monday to build high-capacity fiber routes connecting AWS data centers, aiming to strengthen infrastructure for the next generation of artificial intelligence applications.",https://finnhub.io/api/news?id=d1d7837043f9c78a1b1889e42f545abbf67b51b4fb0c247629945b0e77144d47,Yahoo,company,0.9069204926490784,0.08516404032707214,0.007915522903203964,0.8990049697458744
MSFT,2025-11-03 17:00:00+00:00,Lambda Announces Multibillion-Dollar Agreement With Microsoft to Deploy AI Infrastructure Powered by Tens of Thousands of NVIDIA GPUs,"SAN FRANCISCO, November 03, 2025--Lambda, the Superintelligence Cloud, today announced a multibillion-dollar agreement with Microsoft to deploy AI infrastructure powered by tens of thousands of NVIDIA GPUs, including NVIDIA GB300 NVL72 systems.",https://finnhub.io/api/news?id=9103478f1753587a3b63d5ad43ebf69da3f3e2ae0d89f6e224fb62f63aa855b5,Yahoo,company,0.9193660020828247,0.06873165816068649,0.011902336962521076,0.9074636651203036
MSFT,2025-11-03 16:57:02+00:00,"Nvidia Could Jump 75% as GPU Shipments Set to Double, Says Loop Capital",Analysts see explosive growth driven by rising AI chip demand,https://finnhub.io/api/news?id=ca72e6147362137a73dbe9b0637fcd519d9214ed5dab3a3ab81e21e713635c19,Yahoo,company,0.94046950340271,0.03221743181347847,0.027313129976391792,0.9131563734263182
MSFT,2025-11-03 16:40:00+00:00,Barry Diller’s IAC Inks AI Deal With Microsoft. That Isn’t Why the Stock Is Sliding.,Barry Diller’s IAC Inks AI Deal With Microsoft. That Isn’t Why the Stock Is Sliding.,https://finnhub.io/api/news?id=13450914a7df324341ae81395f7d5e84deec869a953fbb624880b7a2d9138f08,MarketWatch,company,0.038984812796115875,0.34294456243515015,0.618070662021637,-0.5790858492255211
MSFT,2025-11-03 16:37:23+00:00,Stock Market Today: Indexes End Mixed But Palantir Pops; This Tech Stock Drops Amid AMD Lawsuit (Live Coverage),Stock Market Today: Indexes End Mixed But Palantir Pops; This Tech Stock Drops Amid AMD Lawsuit (Live Coverage),https://finnhub.io/api/news?id=eb89ca7a7603e89018ac2be6b047755a823e0a7084263be47250627feebae584,DowJones,company,0.012098613195121288,0.04759123921394348,0.9403101205825806,-0.9282115073874593
MSFT,2025-11-03 16:24:58+00:00,"Iren, Cipher Mining Surge On AI Cloud Deals With Microsoft, Amazon Web Services","Iren, Cipher Mining Surge On AI Cloud Deals With Microsoft, Amazon Web Services",https://finnhub.io/api/news?id=f042c4cc82009ff75bb0df06cfc3cddbf3aa1683934272b9b40186d6cd52a6ad,DowJones,company,0.1401502937078476,0.8315203189849854,0.028329404070973396,0.1118208896368742
MSFT,2025-11-03 16:21:58+00:00,The Play On Marvell Technology,"MRVL expects 40% revenue growth in FY26, with strong insider buying and a $7 billion share repurchase program supporting the stock. Read the latest analysis on the stock here.",https://finnhub.io/api/news?id=8eb1e44473622f1bdb6e42f712b4a9de759a58898bd967f459a41df348e1d174,SeekingAlpha,company,0.31739386916160583,0.6729072332382202,0.009698922745883465,0.30769494641572237
MSFT,2025-11-03 16:19:00+00:00,Amazon Stock Jumps on $38 Billion OpenAI Deal. What We Know.,Amazon Stock Jumps on $38 Billion OpenAI Deal. What We Know.,https://finnhub.io/api/news?id=a0e8d26960146af180682e639ce0597d2ec02c16850c76b5e38ad120975426c0,MarketWatch,company,0.10702181607484818,0.872158944606781,0.020819243043661118,0.08620257303118706
MSFT,2025-11-03 16:12:08+00:00,This Is Why AI Is Not a Bubble and Nvidia will Reach $10 Trillion,"Nvidia (NASDAQ:NVDA) is at the forefront of the artificial intelligence (AI) revolution, providing the essential GPUs that drive this transformative technology. In contrast to the dotcom bubble of the late 1990s, when massive investments in internet infrastructure led to 97% of America’s fiber optic cables remaining “dark” — laid but unused as demand lagged behind ... This Is Why AI Is Not a Bubble and Nvidia will Reach $10 Trillion",https://finnhub.io/api/news?id=9a00c3c6886a4fda705741446cbc22c409a08349cab61c97b03beb20248efc54,Yahoo,company,0.13408079743385315,0.8457732796669006,0.020145894959568977,0.11393490247428417
MSFT,2025-11-03 16:10:36+00:00,700 Billion Reasons Why These Are 3 Must-Buy Stocks for 2026,"per share The cloud computing sector is experiencing explosive growth, with combined backlogs from major providers like Microsoft (NASDAQ:MSFT), Amazon (NASDAQ:AMZN), and Alphabet (NASDAQ:GOOG)(NASDAQ:GOOGL) now exceeding $700 billion. This vast pipeline represents the core of the AI economy, channeling demand for GPU shipments, data center constructions, and intensive model training cycles. As AI adoption accelerates ... 700 Billion Reasons Why These Are 3 Must-Buy Stocks for 2026",https://finnhub.io/api/news?id=73cb64b5a97b8493861f818bbcff263e9b8448209201d62b667d9160c84b7e8e,Yahoo,company,0.38727816939353943,0.5914624333381653,0.021259408444166183,0.36601876094937325
MSFT,2025-11-03 16:01:14+00:00,Hyperscalers Adding Fuel To The Fire As The AI Narrative Remains Intact,Discover how rising hyperscaler CapEx could drive the AI bull market through 2026.,https://finnhub.io/api/news?id=3158fce82f1387d89ac59f3e7471a286aa35572abc1e763fd448a2dce03a3df4,SeekingAlpha,company,0.1125006377696991,0.8483097553253174,0.03918962553143501,0.07331101223826408
MSFT,2025-11-03 15:59:51+00:00,OpenAI and Amazon sign 38 billion-dollar deal for AI computing power,The agreement comes less than a week after OpenAI altered its partnership with its long-time backer Microsoft.,https://finnhub.io/api/news?id=fbe83d8de5a736e0c3956099eb091a4f4f25247a59017c4a319bcff0dee75766,Yahoo,company,0.8410664796829224,0.1441219449043274,0.014811588451266289,0.8262548912316561
MSFT,2025-11-03 15:44:16+00:00,Big Tech's rising AI investments show market bubble 'still has a good ways to go',"Alphabet, Amazon, and Meta raised their capital expenditure forecasts in the tech giants' most recent earnings reports.",https://finnhub.io/api/news?id=4f7d30b47554d89d5f88bd51ef4f4cd6d56894ab324ec061bf74cb49ca16e5c6,Yahoo,company,0.8689895272254944,0.0713125690817833,0.05969791114330292,0.8092916160821915
MSFT,2025-11-03 15:44:09+00:00,"Microsoft to ship 60,000 Nvidia AI chips to UAE under US-approved deal","Microsoft said Monday it will be shipping Nvidia's most advanced artificial intelligence chips to the United Arab Emirates as part of a deal approved by the U.S. Commerce Department.  The Redmond, Washington software giant said licenses approved in September under “stringent” safeguards enable it to ship more than 60,000 Nvidia chips, including the California chipmaker's advanced GB300 Grace Blackwell chips, for use in data centers in the Middle Eastern country.  The agreement appeared to contradict President Donald Trump's remarks in a “60 Minutes” interview aired Sunday that such chips would not be exported outside the U.S.",https://finnhub.io/api/news?id=696d7366fdfdcefbe73fa78e7cd33ea84ceee3d8f63824fd118e98e808368e5f,Yahoo,company,0.23827123641967773,0.7268000841140747,0.034928686916828156,0.20334254950284958
MSFT,2025-11-03 15:35:11+00:00,Amazon Stock Rallies To Record Highs On $38 Billion OpenAI Cloud Deal,"Amazon (AMZN) stock rallied to record highs on Monday, after announcing a $38 billion cloud deal with ChatGPT creator OpenAI. It is Amazon Web Services' first cloud contract with OpenAI, which has long been a key partner for Amazon rival Microsoft (MSFT). Amazon announced the ""multiyear, strategic partnership"" with OpenAI is a news release, which AWS said will allow OpenAI...",https://finnhub.io/api/news?id=036cc18e2377b4f86696ec730e9aaaec8a34c053b92a77f7bbc7a74c3f007965,Yahoo,company,0.9326838254928589,0.05315442010760307,0.014161678031086922,0.918522147461772
MSFT,2025-11-03 15:26:14+00:00,Crypto stock surges after $9.7B Microsoft deal,"AI cloud computing company and Bitcoin (BTC) miner IREN (NASDAQ: IREN) signed a multi-year GPU cloud services contract with Microsoft on Oct. 3. Under the agreement, IREN will supply Microsoft with access to NVIDIA GB300 GPUs through its vertically integrated AI Cloud platform. Following ...",https://finnhub.io/api/news?id=1c080312005cd6da9705f09589070aee268942b1ee17186d623111d42a96df6d,Yahoo,company,0.937069833278656,0.046928975731134415,0.016001176089048386,0.9210686571896076
