ticker,datetime,title,summary,url,source,category
GOOGL,2025-11-23 22:07:00+00:00,3 Artificial Intelligence Stocks You Can Buy and Hold for the Next Decade,Artificial intelligence (AI) isn't going anywhere.,https://finnhub.io/api/news?id=b62dc8c6663b727b94ff295e0a1043c6229feb8a70fd7e81f06a4a617e9073d1,Yahoo,company
GOOGL,2025-11-23 21:00:52+00:00,On Running Shoes Won't Be Running Black Friday Deals Despite 'Price-Competitive Environment',"Swiss footwear company On Holding (NYSE:ONON) will offer no Black Friday deals in an effort to solidify itself as a premium brand, company officials recently said. ""We’re going into this holiday season with a full price strategy,"" On Executive co-Chairman Caspar Coppetti said during the company's Q3 earnings call last week. ""So we have no discounts coming up, and that’s against the backdrop of a very price-competitive environment. So we’re really staying true to the discipline that the premium s",https://finnhub.io/api/news?id=28ed51725af2c53fcda6c3ee1f2e5537580f51c7d83aec517c2199fa8dbd1079,Yahoo,company
GOOGL,2025-11-23 19:05:00+00:00,2 Top Dividend Stocks for Growth-Oriented Investors,Who says you have to choose between the two?,https://finnhub.io/api/news?id=a4320e1c3f14ef6c5a15e58fdf0f3f2882cdcbaabfa4454351255b9f6b8e1efe,Yahoo,company
GOOGL,2025-11-23 17:45:00+00:00,"AI is too risky to insure, say people whose job is insuring risk","Major insurers including AIG, Great American, and WR Berkley are asking U.S. regulators for permission to exclude AI-related liabilities from corporate policies. One underwriter describes the AI models’ outputs to the FT as ""too much of a black box.""",https://finnhub.io/api/news?id=3f38fc0ff8e2aa9fa41510436f8c110bb55d8693100b48d6cef23b0294ec9a57,Yahoo,company
GOOGL,2025-11-23 15:45:00+00:00,"Steven Cress' 6 Picks: 3 Dividend Income, 3 AI Growth Stocks","Steve Cress, head of Quant at Seeking Alpha, picks 3 dividend and 3 AI stocks.",https://finnhub.io/api/news?id=06ab5ad64e39605105592585c099c9d696af95fedaaf79e9c61d1e50580d3c16,SeekingAlpha,company
GOOGL,2025-11-23 13:25:00+00:00,Alphabet Is Well Positioned for the Next Decade of AI Growth,Alphabet is about a lot more than search and ads.,https://finnhub.io/api/news?id=031cc201833f8c9db9cc8d98e3393484ad0603d4f48b3c2a31b0657f8488d1ef,Yahoo,company
GOOGL,2025-11-23 10:03:00+00:00,"As Google eyes exponential surge in serving capacity, analyst says we’re entering ‘stage two of AI’ where bottlenecks are physical constraints","The rush to increase serving capacity may be a sign that there is no AI bubble, said one expert.",https://finnhub.io/api/news?id=a3836968d4d0f837b252a9a2d66b1a7ceb13f24fc817f0952f45e2436c58ad20,Yahoo,company
GOOGL,2025-11-23 08:41:00+00:00,Netflix vs. Alphabet: Which Growth Stock Is a Better Buy?,It's a good time to look at both of these high-profile stocks.,https://finnhub.io/api/news?id=2d4f336969cd0a3723bd2d0a10356439e1e808dca1c17f03d39598090f72b0b3,Yahoo,company
GOOGL,2025-11-23 06:05:00+00:00,Why Berkshire Hathaway's Stake in Alphabet Could Be Just the Start of Many More Tech Moves to Come,Berkshire's recent filings reveal that the company now owns nearly 18 million shares of Alphabet.,https://finnhub.io/api/news?id=693a5cb9f9390720801b3fddf693165abf3a45400a71a938db319d4967c74b5f,Yahoo,company
GOOGL,2025-11-23 05:56:58+00:00,Jim Cramer Wonders Whether OpenAI Will be Able to Beat Alphabet (GOOGL),"We recently published 10 Stocks Jim Cramer Talked About. Alphabet Inc. (NASDAQ:GOOGL) is one of the stocks Jim Cramer discussed. When it comes to Alphabet Inc. (NASDAQ:GOOGL), Jim Cramer just can’t stop being optimistic about the firm. Over several previous appearances, he has discussed the firm’s YouTube business, its cloud computing platform, and its quantum […]",https://finnhub.io/api/news?id=a3292eee9cc2b64f9ae257fbc4f8eb0926e18d0194522684e325468acfb31db3,Yahoo,company
GOOGL,2025-11-22 17:22:00+00:00,Alphabet Stock Has Surged Since Warren Buffett's Berkshire Hathaway Bought a Stake in the Tech Giant. Is It Too Late to Buy?,The stock has surged this year. Have investors missed out if they haven't already bought into the growth story?,https://finnhub.io/api/news?id=95a83c5264c4c9a6ec972b560e002dc3d8a4ba32f2a5dc61b4e98dd763ffd990,Yahoo,company
GOOGL,2025-11-22 17:00:00+00:00,"Quantum Computing Stocks: How the Quantum Computing Players Stack Up by Patents (Yes, Nvidia Has Such Patents)","IBM, Alphabet, and Microsoft (in that order) had the most U.S. quantum computing patents awarded in 2024.",https://finnhub.io/api/news?id=5b81af29d428361512ac40bc8c77c2e3814a8f4dc18cda67294dfb52d5d28801,Yahoo,company
GOOGL,2025-11-22 16:00:00+00:00,"'You're A Good Freak,' Dave Ramsey Tells $10 Million Caller Worried About His Fiancée — And Warns Why Her Family Could 'Screw Up Everything'","A caller named William from Dallas asked ""The Ramsey Show"" how to handle a prenup before getting married. He said he and his fiancée had a large financial gap between them and wanted guidance before taking the next step. Host Dave Ramsey heard him outline his financial details and replied during the show: ""You're a good freak,"" after he confirmed a net worth in the $10 million range. Wealth Gap Raises Different Questions William said he owns properties worth about $1.4 million with $230,000 in d",https://finnhub.io/api/news?id=314832d446b485d42a02690711441aec0ee5bad86530c52e24497a43999da547,Yahoo,company
GOOGL,2025-11-22 15:01:07+00:00,"'Where We'll Dedicate The Vast Majority Of Our Resources,' Mark Zuckerberg Shifts Philanthropic Focus To AI","Meta (NASDAQ:META) CEO Mark Zuckerberg and his wife, Dr. Priscilla Chan, announced they will be shifting the focus of their philanthropic efforts to AI in a blog post last week. ""Ten years ago, we started the Chan Zuckerberg Initiative to help cure diseases, improve education, support our local community, and more,"" the couple wrote in the post. ""We're proud of all this work, and especially what we believe has been our greatest impact: accelerating science and developing the Biohub network."" ""Ac",https://finnhub.io/api/news?id=78285aff02523cb3764fd8465050c23ac7827fb970849fa47473c2bf005a3b63,Yahoo,company
GOOGL,2025-11-22 14:16:26+00:00,These Are the 3 Biggest Stocks in Alphabet’s Secret Portfolio,"Google parent Alphabet (NASDAQ:GOOG)(NASDAQ:GOOGL) is often seen as a core tech giant focused on search, advertising, and cloud computing. Yet beneath its main operations lies a quieter side: a venture arm that invests in promising companies in areas like space tech, geospatial data, and semiconductors. These bets target innovations adjacent to Alphabet’s ecosystem, such as ... These Are the 3 Biggest Stocks in Alphabet’s Secret Portfolio",https://finnhub.io/api/news?id=e673b9d85dd0fddec623089b08799bbbb26e9b858ccc05dffda31c327963a725,Yahoo,company
GOOGL,2025-04-09 17:36:21+00:00,These 7 Stocks Are Analyst Favorites For Magnificent Earnings Growth,"Netflix and DoorDash are two of the seven best stocks where investors can find magnificent profit growth prospects.  More than 70% of analysts covering Netflix have buy or overweight ratings on the video streaming service.  The consensus estimate for 2025 earnings is $24.69, a 25% increase from last year.",https://finnhub.io/api/news?id=d6c2d8311e80e499363328e31d436387786100b5a8afd235145a0b634ed99eca,Yahoo,company
GOOGL,2025-11-22 11:46:25+00:00,"Tom Lee Says Bitcoin, Ethereum Crash Wasn't Macro But A 'Software Bug'",Bitcoin (CRYPTO: BTC) and Ethereum (CRYPTO: ETH) breaking below key support levels has sparked debate over whether fundamentals are to blame — but Fundstrat's Tom Lee argues the real culprit is far more mechanical. What Happened: In an interview with ...,https://finnhub.io/api/news?id=90bd043e0467ebde8f908561690dcfa6faf560d4aff0d2363da6df141cfa359b,Yahoo,company
GOOGL,2025-11-22 10:30:00+00:00,How Google Finally Leapfrogged Rivals With New Gemini Rollout,Gemini 3’s surge past ChatGPT and other competitors on benchmark tests has handed Google an elusive victory.,https://finnhub.io/api/news?id=cb83f216b1059dbef73d018a24e1ccd7c5baab2dd8aeab9650dcd89e4ea62fdc,Yahoo,company
GOOGL,2025-11-22 09:17:16+00:00,Investing.com’s stocks of the week,"Investing.com – Despite the bounce on Friday, the DJIA, S&P 500, and Nasdaq are tracking for weekly losses amid global market declines driven by persistent concerns over stretched AI valuations.",https://finnhub.io/api/news?id=5bc9dceb5864fd90f4f96651085596824ff5a1171d13a0525df4d20fb296cc31,Yahoo,company
GOOGL,2025-11-22 09:00:00+00:00,"Bitcoin mining news: Hashprice plunges to new low, 166 GW load forecast, and Cipher’s $830M Fluidstack extension","This week in bitcoin mining news, hashprice hits an all-time low and Cipher extends its Fluidstack AI deal.",https://finnhub.io/api/news?id=d932999dd2f95792b47561838b7164c6abdf64ca9bc95fc54363ee813923b045,Yahoo,company
AMZN,2025-11-26 18:36:10+00:00,"Weekly Jobless Claims Fall, Continuing Applications Rise","Weekly applications for unemployment insurance dropped, while continuing claims moved higher, US gov",https://finnhub.io/api/news?id=934229db2194f8cb91ab98dff2f175f5a198d4564db66f44c0e4df6da26e8d66,Yahoo,company
AMZN,2025-11-26 18:23:00+00:00,"If You'd Invested $100 in Amazon 5 Years Ago, Here's How Much You'd Have Today",This disruptive technology business has a strong position in multiple end markets.,https://finnhub.io/api/news?id=e95a2dcd60c4f817b1cebb13807911214c2727ce996e0acfc9550191a3cb66b4,Yahoo,company
AMZN,2025-11-26 18:07:00+00:00,Amazon unveils AI infrastructure push with two major investments,"Amazon is accelerating to become a strong player in America’s push to dominate the artificial intelligence race. It unveiled two major initiatives on Monday, November 25, signaling the company’s continuous shift from retail to becoming a national-scale compute provider. The company’s stock was up ...",https://finnhub.io/api/news?id=572b908c7e9f367084f35b279b92288c1ca462e5eaa66263670c395683ee922e,Yahoo,company
AMZN,2025-11-26 17:08:42+00:00,PayPal Is A Black Friday Stock Bargain: 3 Reasons To Buy Now,"Discover why PayPal stock may be undervalued now. Explore growth potential, buybacks, and dividend benefits.",https://finnhub.io/api/news?id=5d1f494ca7fee702230dc8c05747fcb2f1cd39e83bb6c032d1fe584ffd71fa83,SeekingAlpha,company
AMZN,2025-11-26 16:47:00+00:00,"Dalfen Industrial Acquires 13-Building Industrial Portfolio in West Sacramento, CA","West Sacramento Logistics Portfolio Dalfen Industrial Acquires 13-Building Industrial Portfolio in West Sacramento, CA DALLAS, Nov. 26, 2025 (GLOBE NEWSWIRE) -- Dalfen Industrial, a leader in last-mile industrial real estate, has expanded its presence in Northern California with the acquisition of the West Sacramento Logistics Portfolio. The portfolio comprises 13 infill, multi-tenant buildings totaling 1.32 million square feet situated on approximately 68 acres at the I-80 / Highway 50 intercha",https://finnhub.io/api/news?id=9b552057bf596d9427c5e6085b3dcfa4c43885a6976c32febde70a91e9e5d67b,Yahoo,company
AMZN,2025-11-26 16:00:54+00:00,"Wall Street Loves Broadcom, Oscar Health, and Amazon Stocks Today","It’s always a good idea to keep track of analysts’ stock upgrades. Often, they’re influenced by (1) company fundamentals, such as financial health, future growth, and even meetings with management; (2) industry and market trends, including specific market conditions and economics; (3) earnings and financial data, including earnings reports that came in better than expected, ... Wall Street Loves Broadcom, Oscar Health, and Amazon Stocks Today",https://finnhub.io/api/news?id=ee81a75288b858919d7d04805d4805ff8d81d4beb18912270d16ee92624dbc6b,Yahoo,company
AMZN,2025-11-26 15:35:57+00:00,Amazon faces investigation after drone causes internet blackout for homeowner,Amazon is facing an investigation from US regulators after a delivery drone cut out the internet in a customer’s house.,https://finnhub.io/api/news?id=2016894f234c2bb20788c03a2ab2b9b5332677c6fff00fd42edc6bf7849dd18c,Yahoo,company
AMZN,2025-11-26 15:26:55+00:00,900 Reasons to Buy Amazon Stock Now,"Amazon operates 900+ cloud data centers in over 50 countries and recently signed a $38 billion, seven-year deal with OpenAI. Analysts predict these moves could boost the company’s value by around 29%.",https://finnhub.io/api/news?id=0088207d4616193798fe993ea131d2019c0dd204905556e02f996b1ca490a318,Yahoo,company
AMZN,2025-11-26 14:20:00+00:00,Contrarian Plays And Real Asset Opportunities From Next Gen Investors,"Rob Isbitts checks in with analysts Julia Ostian, Kenio Fontes, and Jack Bowman to see how they're thinking about the current market.",https://finnhub.io/api/news?id=74010ccfce072633425bbf78e17a6ca5cc22bb216835aba0a2d9c0f73a698212,SeekingAlpha,company
AMZN,2025-11-26 14:11:00+00:00,4 Retail Stocks to Grab on Robust Holiday Sales Growth Projection,"AMZN, EXPE, BOOT and TPR stand out as holiday sales are projected to surge, with online spending set to drive strong seasonal momentum.",https://finnhub.io/api/news?id=97f26d593edaf1cfcccbfd1eb8f6a39c3d8d4066c78dd86c0e6a252885e62521,Yahoo,company
AMZN,2025-11-26 14:00:00+00:00,Vendasta Adds SurveyMonkey CEO Eric Johnson and Cloudflare CMO Brent Remai to Board of Directors,"Leaders from two of the most recognized names in tech join Vendasta as the company accelerates its AI workforce vision for SMBs. Vendasta Adds SurveyMonkey CEO Eric Johnson and Cloudflare CMO Brent Remai to Board of Directors Leaders from two of the most recognized names in tech join Vendasta as the company accelerates its AI workforce vision for SMBs. Saskatoon, SK, Nov. 26, 2025 (GLOBE NEWSWIRE) -- Vendasta, the company building AI employees to help small businesses work smarter and grow faste",https://finnhub.io/api/news?id=4f9d0ec979aa291655f15c5a9d5e362bb3ea5d6637743231f72ae4461edc2276,Yahoo,company
AMZN,2025-11-26 13:41:47+00:00,Amazon Faces FAA Probe After Delivery Drone Strikes Internet Cable in Texas,Incident marks latest setback for the company's drone-delivery expansion.,https://finnhub.io/api/news?id=05c611a246d0c69f979a5f59788e0c0b99051ffacaf747330e9d04e8485abd11,Yahoo,company
AMZN,2025-11-26 13:18:16+00:00,MacKenzie Scott's college roommate once loaned her $1K. Now it's the billionaire's turn to invest,"MacKenzie Scott, one of the world's wealthiest women and most influential philanthropists, is now known for her “no strings attached” surprise grantmaking.  Facing the prospect of dropping out if she couldn't come up with $1,000, Scott was crying when her roommate, Jeannie Tarkenton, found her and got her dad to loan Scott the money.  “I would have given MacKenzie my left kidney,” Tarkenton told the Associated Press recently.",https://finnhub.io/api/news?id=e36a91974ff502be857508b076856eda2a37716c5273b0cf5855a900b011c412,Yahoo,company
AMZN,2025-11-26 11:31:39+00:00,"I’ve Got Nothing for You When It Comes To Target (TGT), Says Jim Cramer","We recently published 11 Stocks Jim Cramer Shared His Insights On. Target Corporation (NYSE:TGT) is one of the stocks Jim Cramer discussed. While Cramer has repeatedly praised Walmart and Costco throughout 2025, he hasn’t been similarly optimistic about Target Corporation (NYSE:TGT). He started the year with a warning that the firm might be facing a profitability […]",https://finnhub.io/api/news?id=ebd1beedefd620e43c95e99959a1dfad0bde7cf2d9a2bad70d73b91db7dc74ce,Yahoo,company
AMZN,2025-11-26 10:17:57+00:00,"BNP Paribas Exane Initiates Amazon (AMZN) at Outperform, Says AI Concerns Are Overblown","Amazon.com, Inc. (NASDAQ:AMZN) is one of the Hot AI Stocks to Keep on Your Radar. On November 24, BNP Paribas Exane initiated coverage on the stock with an Outperform rating and a $320.00 price target. The firm believes that AMZN enjoys strong leadership in cloud, ecommerce, and ad growth; and that AI underinvestment concerns are overblown. […]",https://finnhub.io/api/news?id=831034689921b5f9bcb28c7cabc49f953ef7ee92347f237ae88f23dd8fda8fb6,Yahoo,company
AMZN,2025-11-26 09:00:14+00:00,Alibaba: The Market Got Its Earnings Wrong,"Discover why Alibaba Group Holding Limitedâs cloud & AI investments may drive long-term growth, higher margins, and upside potential. Click for this BABA update.",https://finnhub.io/api/news?id=97fffbfd704b3ed5e0a9e36db6d22ea19d977a1fee1f8f47bd18fe66c9625782,SeekingAlpha,company
AMZN,2025-11-26 08:07:00+00:00,"Zacks Investment Ideas feature highlights Amazon, Advanced Micro Devices, Nvidia, Bloom Energy and Coreweave","Amazon, Advanced Micro Devices, Nvidia, Bloom Energy and Coreweave have been highlighted in this Investment Ideas article.",https://finnhub.io/api/news?id=e66a78950e153995c5065c533dd1c9fed51c437e48c1c93ed125abfdad2b83df,Yahoo,company
AMZN,2025-11-26 08:00:00+00:00,AI Is Remaking Shopping. These Companies Are the Leaders.,"From Shopify to Walmart, brands and retailers are laying the groundwork for agentic e-commerce. Why “discoverability” is an issue.",https://finnhub.io/api/news?id=fd164cd5c5429ba3eb6e8c6f7e535e4733f8ad439b5594c1dd5853e74052de67,Yahoo,company
AMZN,2025-11-26 06:42:06+00:00,Amazon: Building A Superior AI Environment,Discover why Amazon's AI advancements and cloud growth position AMZN for up to 30% upside potential.,https://finnhub.io/api/news?id=fc66a6fc9006c5961379e57970f830d5be77254455cce9fe9c5a72133cf1a915,SeekingAlpha,company
AMZN,2025-11-26 06:25:39+00:00,Tesla CEO Musk says Austin robotaxi fleet to double next month,"""The Tesla Robotaxi fleet in Austin should roughly double next month,"" Musk said in a post on X, which is also owned ⁠by him.  It is not ‌immediately clear how many robotaxis Tesla operates.  Tesla's robotaxi service currently operates in two cities,‍ Austin and the San Francisco Bay Area, with safety monitors still required in the vehicles.",https://finnhub.io/api/news?id=da0320409dae9ad06507c357389fe21e736e1372dbaa61749f3b325895ab9021,Yahoo,company
AMZN,2025-11-26 06:01:00+00:00,Holiday Shoppers Fall Into Two Camps This Year: Those Who Spend and Those Who Scrimp.,"As lower- and middle-income shoppers curb their purchases, retailers will be relying increasingly on heavy spending from affluent shoppers.",https://finnhub.io/api/news?id=e9162e60cbf2fb8b92cae9d02f7624f22f2df023c2e588faf7faa0b69417820b,Yahoo,company
AMZN,2025-11-26 05:21:31+00:00,"Walmart (WMT) Has “Kept a Lid on Prices,” Says Jim Cramer","We recently published Jim Cramer Discussed These 11 Stocks & Commented On A Market Reversal. Walmart Inc. (NYSE:WMT) is one of the stocks Jim Cramer discussed. As the conversation shifted to inflation, Walmart Inc. (NYSE:WMT) once again factored into Cramer’s discussion. One consistent theme that he has stuck with in 2025 is lower prices when […]",https://finnhub.io/api/news?id=4db41a47eaf4347e42284f70546c42d095c063cfa4c38a05d9f5606ec05b4d62,Yahoo,company
AMZN,2025-11-26 03:03:00+00:00,Amazon to face growing boycott from angry consumers amid holidays,"Amazon, the largest online retailer in the world, is currently benefiting from growing demand, despite increasing economic concerns among consumers nationwide. During the third quarter of this year, Amazon's net sales in the U.S. increased by 11% year-over-year, according to its latest earnings ...",https://finnhub.io/api/news?id=2ea161bd0356a2c52652ec990e238d3ae524e848784fdee763dc0c2e3fd6a733,Yahoo,company
AMZN,2025-11-26 02:04:21+00:00,Asia Morning Briefing: Asia Wakes Up to an AI BTC-Nvidia Tailwind That’s Already Starting to Sputter,"Yesterday’s Amazon-driven risk rally is colliding with a sharp wobble in Nvidia, putting the AI-BTC-beta trade that lifted crypto back under scrutiny.",https://finnhub.io/api/news?id=b61ca5b6a905a246261d951e0118c16eca0cb17f60cf07a6b772b625d6b73f74,Yahoo,company
AMZN,2025-11-26 02:01:20+00:00,"'Hyperliquidated': Andrew Tate Loses $800,000 Trying To Trade Crypto","Andrew Tate has received a beatdown at the hands of the cryptocurrency market. The controversial influencer and former kickboxer has lost $800,000 trading cryptocurrencies on the decentralized exchange Hyperliquid, cryptocurrency intelligence platform ...",https://finnhub.io/api/news?id=ec3bb324d5dbe2bae78203b2df5af335982d01584f41ab5c392ffc5236541969,Yahoo,company
AMZN,2025-11-26 01:02:22+00:00,E Ink Holdings Inc (ROCO:8069) Q3 2025 Earnings Call Highlights: Record Revenue and Strategic ...,E Ink Holdings Inc (ROCO:8069) reports robust growth with a 29% revenue increase and outlines future capacity expansions amid market challenges.,https://finnhub.io/api/news?id=8c527d3f1e87a4b23ebbbd6e36b08bb19dd1e738240842a58b59ca5354a0b330,Yahoo,company
AMZN,2025-11-26 00:34:46+00:00,Amazon: Better But Still Losing Ground (Rating Upgrade),"Amazon's Q4 guidance is soft, with expected slower growth and profitability, casting doubt on the sustainability of AWS' rebound. Read why AMZN stock is a Hold.",https://finnhub.io/api/news?id=3590ee4bfda4e8d28ebff86e5d9d85d922fe43f31cc039e49f94d258025ed433,SeekingAlpha,company
AMZN,2025-11-25 22:01:23+00:00,Marvell Technology Q3 Preview: Setting Up For More Data Center Content Going Into 2027,"Marvell Technology has strong data center growth, strategic divestiture, and fresh capital driving its bullish outlook. See why MRVL stock is buy rated.",https://finnhub.io/api/news?id=8fd58af5bad99a4509f683a9c48878233a64cfacd941a0e46197cbe677822b73,SeekingAlpha,company
AMZN,2025-11-25 21:11:27+00:00,Amazon faces FAA probe after delivery drone snaps internet cable in Texas,"The probe comes as Amazon faces stiffer competition from Walmart, which has also begun drone deliveries. ",https://finnhub.io/api/news?id=f728b3545ba911c257119ca849cb2fa7394599c270b98a3fb21cd0d22a9ac279,CNBC,company
AMZN,2025-11-25 19:00:00+00:00,How Amazon Relay turns peak season volume into real opportunity,"Holiday shopping events mean one thing for carriers: more freight on the road. Amazon Prime’s Black Friday sale—running from November 20 to December 1—brings a surge in e-commerce volume that translates directly into increased loads across Amazon Relay’s load board. For carriers looking to capitalize on seasonal demand, this multi-day shopping event creates opportunities that […] The post How Amazon Relay turns peak season volume into real opportunity appeared first on FreightWaves.",https://finnhub.io/api/news?id=690890ddc26c23b14e5ff9f3f2431a1f77c610e722039e7f2d4a7c89570ae33d,Yahoo,company
AMZN,2025-11-25 18:50:12+00:00,Wednesday's big stock stories: What’s likely to move the market in the next trading session,All three major U.S. indexes scored a third straight winning session on Tuesday as investors grew more optimistic that the Federal Reserve might cut rates. ,https://finnhub.io/api/news?id=04488386c050313fa4850763b99f7e76c2459318e1cc1ba4916d2f407010d694,CNBC,company
AMZN,2025-11-25 15:02:02+00:00,Paris on alert as China’s JD.com targets French retailer Fnac Darty,"Chinese e-commerce giant JD.com’s decision to take a stake in French retailer Fnac Darty has revived French government concerns about China’s growing influence in Europe, particularly around data security, cultural independence, and long-term strategic leverage.View on euronews",https://finnhub.io/api/news?id=89d5b517c99b0efcf544811f11cbae3b07224c9a132c59cc57b495559427b2b0,Yahoo,company
AMZN,2025-11-25 18:01:03+00:00,"MercadoLibre Just Got Ambushed: Amazon, Temu, and Shopee Are Crashing Its Holiday Party","Latin America's e-commerce kingpin faces a billion-dollar brawl as rivals flood Brazil with cash, credit, and celebrity firepower.",https://finnhub.io/api/news?id=7c287c3bb942183a49680b078aa7854181d27bf189aebb6bdfe21c0a755c2dc8,Yahoo,company
AMZN,2025-11-25 16:48:48+00:00,Marvell (MRVL) Earns $121 Price Target on Rising AI Compute and Advanced Packaging Momentum,"Marvell Technology, Inc. (NASDAQ:MRVL) is one of the AI Stocks in Focus on Wall Street. On November 20, Raymond James assumed coverage on the stock with a Strong Buy rating and a price target of $121.00. The firm is bullish on the stock as it sees Marvell well-positioned for AI-driven demand and advanced packaging trends. While analysts […]",https://finnhub.io/api/news?id=6f932745be1ea25ce345e390de7798274db52766e453acba76276ad6d8107775,Yahoo,company
AMZN,2025-11-25 16:31:41+00:00,Entergy's role in Amazon investment is to hold the line. What to know,"The new Amazon facility represents ""at least a $3 billion investment"" making it the fourth largest economic development project in the history of MS.",https://finnhub.io/api/news?id=6d26146ba1affcc19330c14539c2e15def3c4ec16225d83f046a1f4cbc1cd692,Yahoo,company
AMZN,2025-11-25 15:20:00+00:00,The AI Bubble Theory Breaks When Amazon's Growth Refuses To Slow Down,"Amazon.com, Inc. is a top long-term investment, excelling in AI and cloud, with strong growth prospects and an attractive valuation. Click for this AMZN update.",https://finnhub.io/api/news?id=9db13291a33b1809d1df81ff57c62e3bff99d34806c5dd86a9682788244295c6,SeekingAlpha,company
AMZN,2025-11-25 14:46:09+00:00,Google Parent Alphabet Drops $100 Million On Celero: The $140 Million Startup Ending AI Data Center Bottlenecks,"Semiconductor startup Celero Communications announced on Nov. 17 that it closed $140 million in total funding to tackle one of artificial intelligence’s most critical infrastructure challenges: bandwidth limits in AI data centers. Celero Communications pulled in $100 million during its Series B round, with CapitalG, Alphabet’s (NASDAQ:GOOG, GOOGL)) independent growth fund, serving as lead investor. The Irvine, California-based company previously raised $40 million across seed and Series A rounds",https://finnhub.io/api/news?id=222f0ff50c75aab3bde496b754c12f61b5821f992b4be98150a70974f0f15605,Yahoo,company
