ticker,datetime,title,summary,url,source,category
MSFT,2025-11-25 10:11:02+00:00,Microsoft’s $9.7 Billion AI Cloud Deal Might Change the Case for Investing in IREN (IREN),"Microsoft recently announced a $9.7 billion, five-year AI cloud services agreement with IREN, focused on deploying advanced GPUs powered by renewable energy infrastructure. This landmark deal marks IREN’s expansion from bitcoin mining into high-demand AI data center services, leveraging its large-scale power capacity and direct partnerships with tech industry leaders. We’ll explore how this multi-billion dollar Microsoft partnership accelerates IREN’s transition to AI infrastructure and...",https://finnhub.io/api/news?id=639b02acb96a49f96275ed1fe38b99b04c9d482e85a1c86f57f5176098410cfc,Yahoo,company
MSFT,2025-11-25 09:58:00+00:00,1 Unstoppable Artificial Intelligence (AI) Stock to Buy Before It Soars Into the $5 Trillion Club,Artificial intelligence is creating trillions of dollars in value for America's tech giants.,https://finnhub.io/api/news?id=81197b85939e2158a03d0724fd70e4ee6d12540eb1d5053c83199694594e0861,Yahoo,company
MSFT,2025-11-25 09:46:20+00:00,"Zelestra signs 95.7MW PPA with Microsoft in Aragón, Spain",The move supports Microsoft’s carbon-negative objectives and its Datacenter Community Pledge.,https://finnhub.io/api/news?id=ad5b3c2165c5c8f7a4516d9bb8960fda67b664ccf197ae2f49ed4c3a8916c664,Yahoo,company
MSFT,2025-11-25 09:44:27+00:00,Alphabet: Next Best Bet Outside Of Nvidia?,Alphabet Inc.'s AI investments and TPU advantages are boosting Google Cloud growth. Click for this updated look at GOOG stock and the latest news.,https://finnhub.io/api/news?id=ab402f683dd4bddb5ca52110fcbd93aa1bca733f724d737bfad7c686d31c1304,SeekingAlpha,company
MSFT,2025-11-25 08:00:00+00:00,UNICEPTA Launches Integration with Microsoft 365 Copilot to Simplify Reputation Intelligence,"UNICEPTA, a global media intelligence provider within The Marketing Cloud, part of Stagwell (NASDAQ: STGW), today announced the launch of an integration with Microsoft 365 Copilot to make its reputation and media intelligence capabilities directly accessible within Copilot. The collaboration enables communications and reputation leaders to access, analyze, and act on real-time insights without leaving their core Microsoft environment – eliminating friction, reducing tool complexity, and improvin",https://finnhub.io/api/news?id=fbcc75d6da5afc2d3b4dda7c7fd0690f3274a8f818dc170b643fd69b9e6dd597,Yahoo,company
MSFT,2025-11-25 07:00:01+00:00,Why rural Wisconsin is blocking the AI data center boom: 'Horses are skittish',Tech giants are increasingly facing community backlash as they select places to build mammoth AI data centers.,https://finnhub.io/api/news?id=e2ce3a6da808ec0df456034678138eb2fd1bcd9d738ff729a9a043b577adf159,CNBC,company
MSFT,2025-11-25 06:58:08+00:00,Jim Cramer Critically Discusses Oracle’s (ORCL) OpenAI Partnership,"We recently published Jim Cramer Discussed These 11 Stocks & Commented On A Market Reversal. Oracle Corporation (NYSE:ORCL) is one of the stocks Jim Cramer discussed. As Oracle Corporation (NYSE:ORCL)’s partnership with OpenAI continues to draw media attention, the firm once again popped up on Jim Cramer’s radar. He discusses the firm in nearly every […]",https://finnhub.io/api/news?id=c22a51ee37d9b622b52e27d9d9bbf65d86f6dce2d0164120a3071c6d62a7ff8b,Yahoo,company
MSFT,2025-11-25 06:56:14+00:00,"“Microsoft (MSFT) Has to Stop Going Down,” Says Jim Cramer",We recently published Jim Cramer Discussed These 11 Stocks & Commented On A Market Reversal. Microsoft Corporation (NASDAQ:MSFT) is one of the stocks Jim Cramer discussed. Microsoft Corporation (NASDAQ:MSFT) is at the center of what Jim Cramer has recently used to bifurcate AI software. He has divided AI into business-to-business and business-to-consumer and used Anthropic […],https://finnhub.io/api/news?id=362398200afd76c7d6ce3be714f17b4f30140b4a4a3786993d37023995b851f7,Yahoo,company
MSFT,2025-11-25 05:08:55+00:00,How Investors Are Reacting To Zscaler (ZS) Joining Microsoft’s Entra Agent ID AI Security Initiative,"On November 18, 2025, Microsoft announced Zscaler as an early adoption partner in the Microsoft Entra Agent ID partner ecosystem, with Zscaler contributing to the integration and advancement of AI agent security services across Microsoft's Entra Agent platform. This close collaboration marks a significant step for Zscaler in extending its Zero Trust and identity management capabilities into the emerging area of enterprise AI, supporting secure and compliant adoption of AI agents at...",https://finnhub.io/api/news?id=34b718b3cab3c0c82530afc650fbdd1352c3c6976b11d410f462db77e262994b,Yahoo,company
MSFT,2025-11-24 21:17:00+00:00,"These Stocks Moved the Most Today: Alphabet, Broadcom, Tesla, Nvidia, Novo Nordisk, Oscar Health, Inspire Medical, and More","Alphabet stock continues its surge on the back of excitement around Google’s latest large-language model, while Tesla rises after CEO Elon Musk indicates the electric-vehicle maker has designed AI chips for its cars and data centers.",https://finnhub.io/api/news?id=e6e2dbef7eb0810009f9a17765dd9bf201b68fea4d8f9f4070e5fc96c02f217d,Yahoo,company
MSFT,2025-11-24 20:32:46+00:00,Amazon to invest $15 billion in Indiana to boost data center infrastructure,"The new data center project, which comes on top of an $11 billion outlay announced last year, will add 2.4 gigawatts of capacity in the region, Amazon said on Monday.⁠ It is also expected ‌to create 1,100 jobs.  The e-commerce behemoth, which is also the largest cloud services ‍provider in the world, has invested more than $31.3 billion in Indiana since 2010.  Earlier in the day, Amazon also announced plans to invest up to $50 billion to expand AI and supercomputing capabilities for U.S. government customers of its cloud unit, Amazon Web Services.",https://finnhub.io/api/news?id=af51c5a30c5b98565600c41634a0442f449341fae6bd87d6e8cd69e1316e8a1f,Yahoo,company
MSFT,2025-11-24 15:09:00+00:00,Google Stock Has Been the Clear AI Winner—and the Gains Could Keep Coming,The company’s shares have gained 70% since Barron’s recommended it in December. It’s worth holding despite the gain.,https://finnhub.io/api/news?id=72dab563104e044727453cf5f3b5552e548a6cf0cf1469e766c4966ff5d5016e,Yahoo,company
MSFT,2025-11-24 19:03:40+00:00,Stock Market Today: Nasdaq Surges On Tech Spike; These Defense Stocks Fall Amid Ukraine Progress (Live Coverage),"The Dow Jones index and the Nasdaq rose on the stock market today, with Tesla and Alphabet among AI stocks jumping. Health stocks tested entries.",https://finnhub.io/api/news?id=c607618f2af4a40052d36008baadd6f292ee13e988c796371e291e14f35248ef,Yahoo,company
MSFT,2025-11-24 18:56:59+00:00,"The AI Trade is Bouncing Back, Thanks to Nvidia and Renwed Rate Cut Hopes. This Tech Stock Might Be Worth Buying","It was a tough past week for the AI trade and the broad markets, to say the least. But it’s always nice to finish things on a high note, with the S&P 500 and Nasdaq 100 both shooting higher (both closing Friday’s session up less than 1%), thanks in part to good Nvidia (NASDAQ:NVDA) numbers ... The AI Trade is Bouncing Back, Thanks to Nvidia and Renwed Rate Cut Hopes. This Tech Stock Might Be Worth Buying",https://finnhub.io/api/news?id=0ba189d5e3cd983b2ab4ac0d3f00965e9d8762a4144445ef58d3ae66ee5fdc3b,Yahoo,company
MSFT,2025-11-24 18:12:59+00:00,Amazon to invest $50 billion in data centers to power US government AI efforts,Amazon says it will spend $50 billion to expand its data center footprint for US government services.,https://finnhub.io/api/news?id=360408c2dba607f5bca915a60cba6b6b5de0d13ffea0f2232e919498b9263fe0,Yahoo,company
MSFT,2025-11-24 18:07:52+00:00,Factbox-Tech companies tap debt markets to fund AI and cloud expansion,"() -The world's largest technology companies are tapping debt markets, raising almost $100 billion through recent bond offerings, as they seek to bolster their artificial intelligence infrastructure. This marks a shift for Silicon Valley firms that typically relied on cash to fund their investments.",https://finnhub.io/api/news?id=857fcfafca40c56b0946766d7a769193ad6bb9cd9f9d04d83615368f3ba8a80d,Yahoo,company
MSFT,2025-11-24 18:06:15+00:00,Wall Street Weighs New AI Stock Fear: Why Google Winning Could Be 'Risk To Watch',The new Gemini 3 model from Google parent company Alphabet is boosting Google stock.  Google's Gemini 3 debuted last week to rave reviews.  Google shares are rising nearly 5% on Monday after rallying 8% last week.,https://finnhub.io/api/news?id=62704ceff517ecc07700956609753e601e2c0af7473b2767e8be4a223e29eac1,Yahoo,company
MSFT,2025-11-24 17:42:16+00:00,"Stock Market Today: Dow, Nasdaq Up As Alphabet, Tesla Jump; These Health Plays Test Entries (Live Coverage)","The Dow Jones index and the Nasdaq rose on the stock market today, with Tesla and Alphabet among AI stocks jumping. Health stock tested entries.",https://finnhub.io/api/news?id=1be78d575ac99d4ec0f939f4d78fac9c8abceae69847c82c79933cc0bd0f6443,Yahoo,company
MSFT,2025-11-24 17:32:50+00:00,Microsoft Backed by BMO Capital After Analyst Reiterates Outperform Rating,Firm maintains $625 price target following Ignite conference insights.,https://finnhub.io/api/news?id=9d15e86d972fac187ffdc602d595fccf8e68f74dc137ab91d537694d685676fc,Yahoo,company
MSFT,2025-11-24 17:27:42+00:00,"HSBC Starts Marvell At Hold, Citing ASIC Uncertainty",Firm sees optical strength but weaker share in Amazon chips,https://finnhub.io/api/news?id=073898a323a3b4a553b493adff26edecfb1d87035b056909aa2c707e54171c94,Yahoo,company
MSFT,2025-11-24 17:21:24+00:00,"Tesla stock pops as Melius says it's a 'must own' due to FSD, Musk touts AI chip progress","Tesla stock popped on Monday as Melius Research tabbed the EV maker a ""must own"" due to its autonomy efforts and as CEO Elon Musk talked up its chipmaking progress.",https://finnhub.io/api/news?id=d3359cf4bcb172ec88027b79a42571be8603316b73d7ff714219c71113bcbcff,Yahoo,company
MSFT,2025-11-24 17:20:41+00:00,Why Is Alphabet (GOOGL) Stock Jumping Today?,Alphabet Hits Record High -- Gemini 3 Drives Explosive Growth in Cloud and AI,https://finnhub.io/api/news?id=eccdca9c0015eac17e30ac769c14032cdfb672690a17aaa95724f6834cb56bad,Yahoo,company
MSFT,2025-11-24 17:20:35+00:00,Broadcom stock surges 10% as Google AI success boosts supplier outlook,"Investing.com -- Broadcom (NASDAQ:AVGO) stock surged 10% Monday, riding a wave of optimism surrounding Google’s artificial intelligence advancements. Other Google suppliers also saw significant gains, with Lumentum (NASDAQ:LITE) jumping 13.5% and Celestica (NYSE:CLS) rising 12%.",https://finnhub.io/api/news?id=7552007759f13f25778cc152519fea2a2ab3a0b4c28960b2245f35e983f30485,Yahoo,company
MSFT,2025-11-24 17:00:35+00:00,"Alphabet Hits New High, Tops The Magnificent Seven. Is Google Stock A Buy?",The artificial intelligence trade is in trouble but Google stock hit an all-time high of 306.42 on Nov. 20 amid market volatility.,https://finnhub.io/api/news?id=5e286af327d72848f3ceb614ca8f14faf07f9fe3e0a713b9d6dfd245f9cfdc1d,Yahoo,company
MSFT,2025-11-24 16:49:00+00:00,Alphabet Stock Is a Berkshire Win. The Gain So Far May Be 40%.,"The shares have been on a tear lately, buoyed by optimism about Google’s use of artificial intelligence in its search business.",https://finnhub.io/api/news?id=7635d56d287433ae36e2a960047627b8d642899252819f704b9a4e93404af4ef,Yahoo,company
MSFT,2025-11-24 16:45:00+00:00,Alibaba Stock Jumps. Why Its AI Chatbot Is a Big Deal.,"The company’s Qwen app notched more than 10 million downloads within the first week, highlighting strong demand for consumer-driven AI.",https://finnhub.io/api/news?id=302d5c8df61d71143ce9871998cf721399f244e4b9ec709d89a2f51a0dcc461e,Yahoo,company
MSFT,2025-11-24 16:28:00+00:00,MSFT vs. NOW: Which Cloud Software Provider Offers More Upside?,ServiceNow's AI control tower and workflow automation offer superior upside compared with Microsoft's diversified model. NOW's YTD decline offers superior upside potential.,https://finnhub.io/api/news?id=d992d1d2d8a77418be0f9864e36e1e5de1aab16fc1cec4fed33abe979942d28a,Yahoo,company
MSFT,2025-11-24 16:23:34+00:00,‘Big Short’ investor Michael Burry warns Nvidia is the Cisco equivalent in today’s AI boom: ‘Sometimes the new company is the same company on a pivot’,"Fresh off a string of bearish stock activity and the deregistration of his hedge fund, Burry has started a Substack for his financial writing.",https://finnhub.io/api/news?id=4f0c3dfbb8eaaf8c7c08a409880b31db8f49056264ea559bfe3a75a82f097b00,Yahoo,company
MSFT,2025-11-24 16:09:29+00:00,"Amazon pledges up to $50 billion to expand AI, supercomputing for US government","The project, expected to break ground ‌in 2026, will add nearly 1.3 gigawatts of artificial intelligence and high-performance computing capacity across AWS Top Secret, AWS Secret and AWS GovCloud regions by building data centers equipped with advanced compute and networking technologies.  AWS cloud regions ⁠for U.S. government ‌are based on increasing levels of data sensitivity.  The cloud unit currently serves more than 11,000 U.S. government ‍agencies.",https://finnhub.io/api/news?id=896cfaba24e22244441ab8baade842e0b7008225e8e7beb7c7faa10aa5bf6692,Yahoo,company
MSFT,2025-11-24 16:05:09+00:00,‘Painful’ UK planning process delaying power supplies for Microsoft projects,Clare Barclay said the company is facing lengthy delays to secure the energy to run a new data centre development in Leeds.,https://finnhub.io/api/news?id=aac036814a4171d9b79e1a4d9606d189601981c598647586b6a8e44880071be4,Yahoo,company
MSFT,2025-11-24 15:49:42+00:00,The Big Short Investor Michael Burry Blasts Nvidia -- Calls AI Chip Demand 'Ridiculously Small',NVDA Faces Scrutiny as Burry Questions Long-Term AI Demand,https://finnhub.io/api/news?id=e51bab61775a6513c243a45adcf454aba96aec779b394191341e7ca44588831a,Yahoo,company
MSFT,2025-11-24 15:14:00+00:00,Devicie Recognized as a Microsoft Security Excellence Awards Finalist for Secure Access Trailblaze,"Devicie, a leader in optimized Microsoft Intune deployment and maintenance solutions, today announced it is a Secure Access Trailblazer award finalist in the Microsoft Security Excellence Awards. The company was honored among a global field of industry leaders that demonstrated success across the security landscape during the past 12 months.",https://finnhub.io/api/news?id=67b249a2976e67d58789cbab05d95c76f31a778bf8ee90b13d760f7e40709332,Yahoo,company
MSFT,2025-11-24 13:37:00+00:00,SAS Data Maker launches in the Microsoft Marketplace,"SAS Data Maker – a secure, enterprise-grade synthetic data generator that creates statistically representative data without exposing sensitive or regulation-protected information – is now available in the Microsoft Marketplace, the unified online destination for customers to buy trusted cloud solutions, AI apps and agents to meet their business needs.",https://finnhub.io/api/news?id=358090efaafadb111db40ce25029074c8dd62db2980e260289cc0012458aa9d8,Yahoo,company
MSFT,2025-11-24 13:00:00+00:00,Senzing Entity Resolution AI Now Available on Microsoft Marketplace for Risk & Fraud Detection and KYC,"LAS VEGAS, November 24, 2025--Senzing, developers of industry-leading entity resolution technology, today announced the arrival of the Senzing® AI for entity resolution on the Microsoft Marketplace. Delivered as an SDK, Senzing entity resolution enables streamlined deployment on the Azure cloud platform to enhance risk and fraud detection and Know Your Customer (KYC) initiatives with the world’s most advanced entity resolution.",https://finnhub.io/api/news?id=5dfa3bd7e1f851e3357efa7e46127fe3f6b9948494b5f7d45d23c4e93a37d7f5,Yahoo,company
MSFT,2025-11-24 12:48:51+00:00,Alphabet Is Winning The Multi-Cloud Shift In The AI Era,Alphabet Inc. has successfully converted AI from a threat to an additive opportunity to its existing moat. Learn more about GOOG stock here.,https://finnhub.io/api/news?id=55739bc39163f5ef9cb9154e1987c8a9d1b56ac8cd984d3897ec90d20ec52f64,SeekingAlpha,company
MSFT,2025-11-24 11:18:45+00:00,Why Nvidia Stock Could Reach A $20 Trillion Market Cap By 2030,See how Nvidia Corporation's rapid GPU advancements and strong data center growth could drive its market cap to $20T by 2030. Click for my NVDA Q3 earnings update.,https://finnhub.io/api/news?id=dd445c183708b3552d410db14f8bd93bea792d03df8d1ddce302095380ea692a,SeekingAlpha,company
MSFT,2025-11-24 11:15:36+00:00,Big Tech’s AI Debt Wave Is Threatening to Swamp Credit Markets,"With tech firms expected to turn to debt for as much as $1.5 trillion by 2028 to fund expansion in artificial intelligence and data centers, that could widen spreads across the whole market, Morgan Stanley argues.  Bond buyers are starting to worry about being compensated for the risks of a bubble in the sector, given recent turmoil in tech stocks.",https://finnhub.io/api/news?id=1885c3129baadd307ba928af3f3187fdef14c4a4b6caa0ee060c806bb7263195,Yahoo,company
MSFT,2025-11-24 11:08:13+00:00,When Nvidia Can't Even Save The Market,"NVIDIA's strong Q3 can't lift markets as the AI boom cools. Click to get insights on fading AI narratives, future stock market trends, and NVDA stock prospects.",https://finnhub.io/api/news?id=18769c1855dbf6978f9a401c80b32d96230067d8c524ba329850e4e863ae89ba,SeekingAlpha,company
MSFT,2025-11-24 10:53:00+00:00,"These Stocks Are Moving the Most Today: Tesla, Alphabet, Alibaba, Strategy, Eli Lilly, and More","Stock futures were rising Monday with investors hopeful that economic data due this week will strengthen the case for the Federal Reserve to cut interest rates next month.  CEO Elon Musk said Sunday in a post on X that the electric-vehicle maker already had designed several million artificial-intelligence chips for its cars and data centers.  Tesla is close to finishing its AI5 chip, has started work on its AI6 chip, and is aiming to bring a new chip to volume production every 12 months, Musk added.",https://finnhub.io/api/news?id=637808b4d0e069b36ad8d822ebf7210301bf8ce97925137bedcc89d648c04d3e,Yahoo,company
MSFT,2025-11-24 10:30:00+00:00,"The Zacks Analyst Blog ServiceNow, Microsoft, Atlassian and Salesforce","ServiceNow deepens its Microsoft integrations, aiming to boost workflow adoption even as guidance reflects tighter federal budgets.",https://finnhub.io/api/news?id=a67a50280256aab2978fa303ff1de2853bf21a173535288cf2ad391315d2eb96,Yahoo,company
MSFT,2025-11-24 09:51:18+00:00,"Nvidia's Fundamentals Remain Strong, Buy Into The Dip","Nvidia leads AI chip growth with strong data center demand, $404 target, geopolitical risks, and attractive valuation. Check out why NVDA stock is a strong buy.",https://finnhub.io/api/news?id=a6f48769757a6be9fc2e04527e336aed70e898a50fc428e1bbc413935fb01666,SeekingAlpha,company
MSFT,2025-11-24 09:44:00+00:00,"Which Quantum Computing Stock Is Wall Street Most Bullish About: D-Wave Quantum, IonQ, or Rigetti?","Analysts like D-Wave, IonQ, and Rigetti. But one appears to be Wall Street's favorite right now.",https://finnhub.io/api/news?id=7c4bd45647aa00a3832c6c9e291e108b11c73e963f80fc91af107c240a407c71,Yahoo,company
MSFT,2025-11-24 09:42:16+00:00,Palo Alto Networks: The Q1 FY 2026 Beat And Raise Signals Caution,"Palo Alto Networks delivers Q1 FY26 strength with AI-driven security, valuation premium concerns, and growing risk factors. Learn why PANW stock is a hold.",https://finnhub.io/api/news?id=62c2939fccb4e34ac44ab41fa5de76dd6a64c7a1984ff24fda22cf0b3fe40c34,SeekingAlpha,company
MSFT,2025-11-24 08:25:00+00:00,Anthropic Will Spend $30 Billion on Azure. Could This Be Microsoft's Most Important AI Deal Yet?,The deal positions Microsoft to remain a major player in AI for a long time.,https://finnhub.io/api/news?id=7b9e375123efaed2c84134a704cfbb159b96551d3cebf249e924b2b12b9fb9d9,Yahoo,company
MSFT,2025-11-24 08:13:06+00:00,"Holiday air travel, Novo Nordisk trial results, 'Wicked: For Good' debut and more in Morning Squawk",Here are five key things investors need to know to start the trading day.,https://finnhub.io/api/news?id=af2131bb30b30b5c5998f4a2197027f3ea89ecbc1d39c4c02ea4c197b1fdce27,CNBC,company
MSFT,2025-11-24 07:30:00+00:00,Could the Anthropic Partnership Be Nvidia's Most Important AI Deal Yet?,Nvidia just made another blockbuster artificial intelligence (AI) deal. Here's what you need to know.,https://finnhub.io/api/news?id=558bedbd740d9c2e198f2ac21fb94c93a3319d6c163e125b21497a98b289f69d,Yahoo,company
MSFT,2025-11-24 06:05:38+00:00,Analysis-U.S. companies hold the line at climate talks despite Trump,"By Simon Jessop BELEM, Brazil (Reuters) -Despite the U.S. government souring on the global climate agenda ahead of the COP30 summit, American companies did not shy away.",https://finnhub.io/api/news?id=508d5a928cb420d9c9a936079d5889cb31889c5a3d373fc57f10bf72a3102ec3,Yahoo,company
MSFT,2025-11-24 06:00:00+00:00,Google Has Been an AI Winner. What to Do With Alphabet Stock Now.,The company’s shares have gained 70% since Barron’s recommended it in December. It’s worth holding despite the gain.,https://finnhub.io/api/news?id=ec3a85b01f2c0c76e97cc2eac620f5f0b60ff442bb6889f9239ed6060ef71fe0,Yahoo,company
MSFT,2025-11-24 04:36:15+00:00,2 Mega-Cap Stocks to Consider Right Now and 1 We Question,"""Too big to fail"" is how we would describe the megacap stocks in this article today. While they will likely stand the test of time, it’s not all sunshine and rainbows as their scale can limit their ability to find new sources of growth.",https://finnhub.io/api/news?id=20b22c3e00f0536dd0555bc3b0bf30c699438a63ea65dc4af8667b7ab9cfc485,Yahoo,company
MSFT,2025-11-24 02:00:00+00:00,Flood of AI Bonds Adds to Pressure on Markets,"Wall Street is straining to absorb a flood of new bonds from tech companies funding their artificial intelligence investments, adding to the recent pressure in markets.  Since the start of September, so-called AI hyperscalers  Amazon  com,  Alphabet Meta Platforms  and  Oracle  have issued nearly $90 billion of investment-grade bonds, according to Dealogic, more than they had sold over the previous 40 months.  AI data-center developers like  TeraWulf  and  Cipher Mining  both started as bitcoin miners, also have stormed the speculative-grade market, issuing more than $7 billion of those lower-rated bonds.",https://finnhub.io/api/news?id=4949c3a4e471050b414007152ae6c92e722fddf16e7243e5fce9dc3a0f3ff026,Yahoo,company
MSFT,2025-11-24 01:20:43+00:00,Could markets be facing an 'everything bubble'? Investors are divided,"Global stocks have seen wild swings over the past week, amid mounting concerns a bubble could be about to burst. ",https://finnhub.io/api/news?id=dd22816611242ad8216b0ae24b82e712c77f28e708f0ec646d7fe0dbadb44ee0,CNBC,company
MSFT,2025-11-24 01:01:11+00:00,Former Microsoft Executive Launches $250 Eyewear Brand For Girls After Daughter's Vision Crisis At Age 4,"A former Microsoft (NASDAQ:MSFT) executive has launched a children’s eyewear company after her daughter received a vision diagnosis at 4 years old that revealed multiple eye coordination problems. Hayley Martin founded Once Upon a Charm, a Seattle-based startup selling prescription glasses designed specifically for girls between the ages of 4 and 9. The frames retail at $250 per pair and feature a patent-pending system allowing wearers to attach decorative charms to the temples. Martin developed",https://finnhub.io/api/news?id=e0fbba36db6c8f54ef8b2cf21b0160182209480e68d89d5dfb948c48ae6914a1,Yahoo,company
MSFT,2025-11-23 20:54:32+00:00,Tracking Bridgewater Associates 13F Portfolio - Q3 2025 Update,"Get a 2025 update on Bridgewater Associatesâ $25.53B portfolio, top stock moves, and diversification strategies.",https://finnhub.io/api/news?id=61d8296e69b080fa1b002c2b3fd9c2349cb2b455745d094b9d4ee71ffbc1a8f7,SeekingAlpha,company
MSFT,2025-11-23 20:33:41+00:00,"Satoshi Nakamoto's Bitcoin Wealth Falls By $41 Billion, Now Poorer Than Bill Gates",Satoshi Nakamoto's Bitcoin-based net worth took a heavy hit as BTC dropped more than 30% from its all-time high set in October.,https://finnhub.io/api/news?id=ee411eebc02dbcc52845576f8b2a31ce16d0def95a60c62484c147ff6051b34a,Yahoo,company
MSFT,2025-11-23 18:17:00+00:00,Microsoft’s $80B AI shift: What it does to your money,"Microsoft is making significant changes with respect to the future of its operations, leading to substantial implications for the tech world. It didn't ask you first, but if you've invested in the S&P 500, the Nasdaq 100, or a few shares of Microsoft through your 401(k), you're already on ...",https://finnhub.io/api/news?id=b2f91cdaa3a896a251a25bf7a3291aaef428de4f3c43b0f470d9ccd26cae9a8d,Yahoo,company
MSFT,2025-11-23 17:07:00+00:00,Will Alphabet Be the World's Next $5 Trillion Stock?,The company has been on a tear over the past six months.,https://finnhub.io/api/news?id=84167ba5ac931996d322bced07b1caabe282163fb234e9d38cf883c6d25d0c85,Yahoo,company
MSFT,2025-11-23 14:34:34+00:00,The Great S&P 500 Shakeup: How Microsoft and Oracle Became the Last Giants Standing,Doug and Lee examined the generational turnover in the S&P 500’s largest companies and discussed how only Microsoft and Oracle maintained top tier status through two decades of technological and market upheaval.,https://finnhub.io/api/news?id=00491eabea09eaf80eeab41863d7a511b1d7fe305cd3b339a0dce6b546b4efca,Yahoo,company
MSFT,2025-11-23 12:37:46+00:00,"Economic data returns, retail earnings feature in holiday-shortened week: What to watch this week",Investors will be tracking retail earnings and economic data as the government works through a backlog of reports delayed by the shutdown.,https://finnhub.io/api/news?id=dcad978ee0ba252939009a4e3ed36a4165be3ab1e44f05a85725a7eedebf4f40,Yahoo,company
