ticker,datetime,title,summary,url,source,category
AAPL,2025-11-26 18:07:42+00:00,"Stock market today: Dow, S&P 500, Nasdaq jump as Wall Street eyes 4th straight win before Thanksgiving",Stock futures held steady as investors realigned amid a month of losses.,https://finnhub.io/api/news?id=e9258bec5888b06cfc73a95873858f1b3126f25349faf47140a56f2d01b1f373,Yahoo,company
AAPL,2025-11-26 18:02:37+00:00,"Tech analyst Dan Ives flags 10 stocks to own, insists there's no AI bubble",The AI revolution is still in its early innings. Wedbush analyst Dan Ives argues that investors are misreading one of the most significant technology build-outs since the dawn of the internet.,https://finnhub.io/api/news?id=e0bc42ebb8c3ef950363fde4febbfc0fd71841974cb10cc994e32cdf959bddb5,Yahoo,company
AAPL,2025-11-26 17:45:12+00:00,"Apple contests India's antitrust penalty law with risk of $38 billion fine, filing shows","By Aditya Kalra and Arpan Chaturvedi NEW DELHI (Reuters) -Apple is challenging India's new antitrust penalty law under which the U. company could potentially face a fine of up to $38 billion, a court filing at the ​Delhi High Court, seen by Reuters, shows.",https://finnhub.io/api/news?id=8aef7d760837109323aa3bd94caf6f06e78e74d66d2d2887028a58c61524d385,Yahoo,company
AAPL,2025-11-26 17:30:00+00:00,Top 10 stock picks of 2025 from Wedbush's Dan Ives,"Wedbush Securities managing director and global head of technology research, Dan Ives, sits down with Yahoo Finance Executive Editor Brian Sozzi to talk about his top 10 stock picks for 2025. To watch more expert insights and analysis on the latest market action, check out more Opening Bid.",https://finnhub.io/api/news?id=c51b172114aeed7225d9609ec03223eb1732883f0a626f4a4b4d1465c4e45338,Yahoo,company
AAPL,2025-11-26 17:01:42+00:00,The autumn budget explained in five charts,Chancellor Rachel Reeves announced more than £26bn in tax rises in the government's long-awaited autumn budget.,https://finnhub.io/api/news?id=8cc9941518d8a4012619ec4f8e0ea93c8d26bbbb82bd12d361f66266b8ca0bc5,Yahoo,company
AAPL,2025-11-26 16:42:48+00:00,"DGRO Is A Wealth Compounding Machine, But Nobody Is Talking About Its Biggest Weakness",iShares Core Dividend Growth ETF has a strong track record as a dividend growth and wealth compounding machine. Learn more about DGRO ETF here.,https://finnhub.io/api/news?id=8ef53e17862ee1b6645c4de1626468fe4d1ce398dcc0c20a67e8420055c47935,SeekingAlpha,company
AAPL,2025-11-26 16:19:42+00:00,GM loses 3rd high-profile software exec in a month after restructure,"Bariş Cetinok, General Motors’ senior vice president of software and services product management, has left the automaker.",https://finnhub.io/api/news?id=20ed12fa8ea23d75775cef8c3cebae8b87048eb8c5ca38839e8d366c92fcd1fe,Yahoo,company
AAPL,2025-11-26 16:11:55+00:00,"Want $4,000 per Year in Passive Income? Invest Just $2,500 in These Big-Yield Dividend Stocks","How can you leverage your savings into a more secure financial future? Dividends can be a key component of your wealth-building plan, and you can start today by investing just $2,500 per asset into five stocks or exchange traded funds (ETFs). When all is said and done, it might even be possible to take a ... Want $4,000 per Year in Passive Income? Invest Just $2,500 in These Big-Yield Dividend Stocks",https://finnhub.io/api/news?id=1a70f7a8fcf949c26775e19219761e188e0898e4be1bb525ed5bc90f7d57a279,Yahoo,company
AAPL,2025-11-26 16:04:23+00:00,Apple Edges Closer to Apple Intelligence Launch in China After New Feedback Form Surfaces,Tech giant quietly tests localized readiness as partners Alibaba and Baidu prepare supporting models.,https://finnhub.io/api/news?id=f7b6db6f06d4dcece419f1e2c778fa6adb47621d17909b8dbc23ef80746cd192,Yahoo,company
AAPL,2025-11-26 15:03:00+00:00,Nvidia Stock Rebounds. Why Google’s AI Chips Shouldn’t Worry Investors.,"Investors have been fretting that Nvidia's market share could come under threat from Google parent Alphabet, and its AI chips.",https://finnhub.io/api/news?id=9217978732f83d8e9438fa7483b86b81372c5768cb53f5d60d50e94928440f6c,Yahoo,company
AAPL,2025-11-26 15:01:00+00:00,Roblox Isn’t Playing Games. Why the Stock Could Jump 50%.,The videogame platform is looking more and more like the next YouTube. Investors are missing the opportunity.,https://finnhub.io/api/news?id=5bdae5221e3012b4ecbb9df64c6822d8b6d260be68c19e3f3e37bf7612f2bd59,Yahoo,company
AAPL,2025-11-26 15:00:00+00:00,"Building A $100,000 Dividend Portfolio: Maximizing SCHD's Income With November's Top High-Yield Stocks","This article presents a diversified $100,000 high-yield dividend portfolio for November 2025, blending income, dividend growth, and reduced volatility.",https://finnhub.io/api/news?id=c27cdc4703d413438a3c9bcaee7d662db3d1f54ef7388f325f8030c9c8e5042a,SeekingAlpha,company
AAPL,2025-11-26 13:46:12+00:00,Apple: Demand Pull For iPhone 17 Augurs A Strong FY 2026,Apple (AAPL) eyes strong FY 2026 sales on iPhone 17 demand and Gen Z appeal.,https://finnhub.io/api/news?id=4a6ea3fff646c3dba8ea16ff944d7dbc898374a8fb100bcc2e0da10ead1278ff,SeekingAlpha,company
AAPL,2025-11-26 13:23:00+00:00,Apple Stock Heads for Record as Big Tech Pecking Order Gets Reshuffled,"It may be too early to declare a new sheriff in residence, but Google parent  Alphabet  emergence as the hottest new thing in artificial intelligence has triggered a massive realignment among the world’s biggest tech stocks.  Google is set to open at a fresh record high on Wednesday, with a market value of just under $4 trillion, to extend its November advance to around 17%.  On the downside,  Nvidia  stock is set to open more than 15% south of its last all-time peak, as it and slowly careens through correction territory heading into the final month of the year.",https://finnhub.io/api/news?id=c0d4326fefb98ccd6fdef75f803751824ba46811e7822cffbf0dc2185c283c84,Yahoo,company
AAPL,2025-11-26 12:34:00+00:00,Nvidia Stock Falls Further as Google AI Chip Fears Grow. Why Investors Shouldn’t Worry.,"Investors are fretting that Nvidia's dominant market share could come under threat from Google parent Alphabet, and its AI chips.",https://finnhub.io/api/news?id=2160f87f39b3a4feaaa5ef06ed1830831004590bb6d732169972c74406b42cd8,Yahoo,company
AAPL,2025-11-26 12:21:00+00:00,Google Vs Nvidia for AI Dominance? Why That’s Only Half the Story and 4 Other Things to Know Today.,"What could sway a divided Fed on rate cuts, spending slows as retailers enter the holiday shopping season, and more news to start your day.",https://finnhub.io/api/news?id=fc2e2bfa871e85b27e21ff43579d5ac8c06fffe7bb08a19340070d0a2a11d5d1,Yahoo,company
AAPL,2025-11-26 11:59:54+00:00,Pound steady as investors await autumn budget,"The pound was steady against the dollar on Wednesday morning, as investors waited for chancellor Rachel Reeves to deliver the UK's autumn budget.",https://finnhub.io/api/news?id=15994acaa8268c216c110c6f1f23447a972398bd61ccf3ed01dd18d029d7e986,Yahoo,company
AAPL,2025-11-26 11:50:44+00:00,"Nvidia, Microsoft Lead Wedbush New Tech List -- The 10 'Must-Own' Stocks",New Wedbush Tech Roadmap: Ten Stocks Poised to Rip Into Year-End,https://finnhub.io/api/news?id=d30ccc54ea7ddc07a87a2a7cad6905a8c0e596eb405744c2c18dd1114b310f08,Yahoo,company
AAPL,2025-11-26 11:37:56+00:00,3 Major Potential Headwinds For 2026,"The market faces major challenges in 2026, including AI stocks being overvalued and real estate woes. Here's what investors need to keep in mind.",https://finnhub.io/api/news?id=13bbdfceab5f6408eb0e4f29e3abf76c1747c1631be0c2ff75d2ed97bd0e07a6,SeekingAlpha,company
AAPL,2025-11-26 11:27:00+00:00,Foxconn to spend $569M expanding Wisconsin factory,The investment comes days after the Apple product manufacturer announced a collaboration deal with OpenAI.,https://finnhub.io/api/news?id=3139c8bfbec70d0dbabe0d55edbf380b5745d815030da37dcf2bbd9cba8d590a,Yahoo,company
AAPL,2025-11-26 11:00:00+00:00,"From Silicon Valley to Hollywood, why California's job market is taking a hit",Thousands of workers have been laid off this year in Hollywood and Silicon Valley as AI shakes up the media and tech industries amid other economic challenges.,https://finnhub.io/api/news?id=3812e52daefb758f66e23d62e2ae6dd58aa5ef4a77ce5a029ca470216a60da89,Yahoo,company
AAPL,2025-11-26 10:59:00+00:00,"These Stocks Are Moving the Most Today: Alphabet, Nvidia, Apple, Dell, HP Inc., and More","Alphabet and Apple shares were rising again, putting Nvidia's status as the most valuable U.S. company under threat.",https://finnhub.io/api/news?id=1f1d7e656ac57a0753bfe5e993b2719a1ffe76f060472e676eff07f3506a068a,Yahoo,company
AAPL,2025-11-26 10:47:00+00:00,"Meet the Marvelous Vanguard ETF With 59% of Its Portfolio Invested in the ""Magnificent Seven"" Stocks",Investors who don't own these seven stocks are almost certainly underperforming the broader market.,https://finnhub.io/api/news?id=3270086fcc33c74ef4ebe0b715153a4c68aabad97770ee6fec73c8b004bd9289,Yahoo,company
AAPL,2025-11-26 10:43:00+00:00,"United States Home Healthcare Market Analysis Report 2025-2033 Featuring 3M Healthcare, Apple, Arkray, B. Braun Melsungen, BD And Co, F. Hoffmann-La Roche, Fresenius, and Hollister","The United States Home Healthcare Market is projected to grow significantly, from US$ 115.13 billion in 2024 to US$ 210.25 billion by 2033, driven by a 6.92% CAGR. This surge is fueled by an aging population, rising chronic diseases, and a preference for in-home care, enhancing patient comfort and convenience. Key growth factors include cost-effectiveness over institutional care, technological advances in remote services, and increasing insurance coverage. Major challenges involve workforce shor",https://finnhub.io/api/news?id=1608c679368a3ec7e2306bbd013d7221485bf5a56431e11311dcbf9fa97a7b4b,Yahoo,company
AAPL,2025-11-26 09:59:00+00:00,"Smart TV Market Competitive Landscape Report 2025: Company Analysis,Recent Developments, Strategy, Sustainability, Product Launch, Key Persons and Revenue","The Smart TV market is projected to grow from US$ 255.55 billion in 2024 to US$ 691.19 billion by 2033, at a CAGR of 11.69%. This surge is fueled by increased internet access, cutting-edge display innovations, and rising consumer demand for integrated entertainment systems. Smart TVs offer internet connectivity, enabling streaming, web browsing, and app access, and are central to smart home ecosystems. Enhanced by AI, voice recognition, and seamless integration with smart devices, these TVs tran",https://finnhub.io/api/news?id=5dfd24cfe545331b4d26ec16faf9014a0d2705b9dd863dcfc46b8f09fd2ba95b,Yahoo,company
AAPL,2025-11-26 09:57:20+00:00,JPMorgan Reiterates Overweight on Apple (AAPL) as iPhone 17 Lead Times Track Higher,"Apple Inc. (NASDAQ:AAPL) is one of the Hot AI Stocks to Keep on Your Radar. On November 24, JPMorgan reiterated the stock as “Overweight” stating how their checks show lead times for Apple’s iPhone are tracking higher. “In Week 11 of our Apple Product Availability Tracker, lead times across the iPhone 17 series moderated by three […]",https://finnhub.io/api/news?id=05fd252c9fbb252b916fb07d4bc32ee977b7a39831ea423d9468d09d7ef184a5,Yahoo,company
AAPL,2025-11-26 09:53:28+00:00,Xiaomi: $7.8 Trillion TAM To Drive This Chinese Tech Giant,Discover how Xiaomi Corporation's expansion into electric vehicles and smart home tech drives growth. Click for more about XIACY and its innovative strategies.,https://finnhub.io/api/news?id=43710d6db58eda8e9818623f758fff5203666feb1954609a159cbb19aa691d3a,SeekingAlpha,company
AAPL,2025-11-26 09:47:33+00:00,Nvidia’s Stock Is Sinking as Doubts About Its AI Dominance Grow,"Shares of the chipmaker fell 2.6% on Tuesday following a report suggesting that Alphabet Inc.’s AI processors are gaining ground.  The stock is down 14% since the start of this month, erasing more than $700 billion in market value, as investors grow increasingly fearful of a bubble in AI spending as well as Nvidia’s circular investments in startups like OpenAI that are also customers.  “Nvidia’s valuation was really based on the idea that it would maintain its market share,” said Adam Sarhan, chief executive officer of 50 Park Investments.",https://finnhub.io/api/news?id=7ccf897c303ec859eda2d4c8dca8b91462de61d6ebf3a3f0e453efbdac00f4e2,Yahoo,company
AAPL,2025-11-26 09:44:00+00:00,Billionaire Ken Griffin More Than Doubled His Stakes in These 3 Artificial Intelligence (AI) Stocks. Here's Why You Might Want to Buy Them Too.,There are good reasons why Griffin recently loaded up on these AI stocks.,https://finnhub.io/api/news?id=decbfc080dedf1f7fea1401698141daf8c1f2f3f8d5f53b2518159fea792917f,Yahoo,company
AAPL,2025-11-26 09:37:55+00:00,"Apple iPhone shipments to beat Samsung for the first time in 14 years, report says",Apple's success is being driven by its iPhone 17 series launched in September.,https://finnhub.io/api/news?id=301c11ab8f2b3c4646639f7806ecf0f7fc31f5f2b172104e251165be8737eb7e,CNBC,company
AAPL,2025-11-26 09:10:44+00:00,FTSE 100 LIVE: Markets rise as OBR forecasts budget will leave Reeves with £22bn fiscal headroom,"The yield on 10-year UK gilts, a benchmark for the return the Treasury promises to buyers of its debt, climbed by four basis points to 4.53% ahead of the speech.",https://finnhub.io/api/news?id=73c3550cc9a2607c4718e33d90efaab87ba146817f6e639f23545ebb1ad46796,Yahoo,company
AAPL,2025-11-26 08:56:59+00:00,"Budget live blog: Reeves freezes income tax thresholds and caps salary sacrifice, OBR reveals","Reeves is delivering her autumn budget, although the Office for Budget Responsibility published details early.",https://finnhub.io/api/news?id=ab211bf8a62cdfe6fee51b9dc906cf9722261ec0a2c2393561d2067eeca0bc24,Yahoo,company
AAPL,2025-11-26 08:50:00+00:00,"2 Artificial Intelligence (AI) Stocks to Buy Before They Soar to $2 Trillion, According to Wall Street Analysts","Certain Wall Street analysts expect Broadcom and Meta Platforms to join Nvidia, Apple, Alphabet, Microsoft, and Amazon in the $2 trillion club.",https://finnhub.io/api/news?id=01b770b0c23711a63233d53beb8e66a8eb8b1bcd816dd22479f59e7e3f2b27c5,Yahoo,company
AAPL,2025-11-26 08:17:00+00:00,Zacks Investment Ideas feature highlights Apple and Nvidia,Apple and Nvidia have been highlighted in this Investment Ideas article.,https://finnhub.io/api/news?id=1d5ff6edd4f6eb89b1dcc1dccae7e167001f85ec04bb471d8453926a8651edf7,Yahoo,company
AAPL,2025-11-26 08:15:19+00:00,Apple Stock: Don't Buy Into This Strength,"Apple's stock rebounds, but growth, AI investment, and regulatory risks may limit upside. Explore why AAPL's current valuations support a Hold.",https://finnhub.io/api/news?id=fec280484d41bc1371ea185cf15abd8b9cdbe20335638f3e933daf10abddb950,SeekingAlpha,company
AAPL,2025-11-26 05:10:00+00:00,Foxconn Secures Approval to Invest Additional $569 Million in Wisconsin,Foxconn Technology has secured approval to invest an additional $569 million in Wisconsin to build artificial-intelligence infrastructure.,https://finnhub.io/api/news?id=b93890bd1769ed8455683112818584052ce2588b227f18a39dfc0c7ac0377723,Yahoo,company
AAPL,2025-11-26 03:14:29+00:00,Major Patent Verdict Against Apple Might Change The Case For Investing In Apple (AAPL),"Earlier this month, a U.S. District Court jury ruled that Apple infringed Masimo’s Patent No. 10,433,776 and awarded Masimo US$634 million in damages. This verdict highlights increased legal risks for Apple, underscoring the ongoing challenges major technology companies face regarding intellectual property disputes. We’ll examine how this major patent infringement verdict could impact Apple’s investment narrative, particularly in relation to regulatory and legal risk management. Trump's oil...",https://finnhub.io/api/news?id=c3894c75f89dc9ad20f311427b8e7a60d9ab9c95c6536289711978c589bc0c7c,Yahoo,company
AAPL,2025-11-26 03:08:12+00:00,The AI boom hits a crossroads in 2026,"After three years of breakneck growth and soaring valuations, the AI industry enters 2026 with some of the euphoria giving way to tough questions.Anthropic founder Dario Amodei contends the next level of AI could debut in 2026 and become smarter than Nobel Prize winners.",https://finnhub.io/api/news?id=051c18a1c8dbaa78c44bbd6b3e574975484920714736b9a11cf6ca0c41ac6f06,Yahoo,company
AAPL,2025-11-25 22:47:00+00:00,Apple’s best year yet comes with a puzzling weak spot,"It's been a good news/bad news few weeks for Apple. The company just closed its fiscal year with a record $112 billion in net income and quarterly revenue of $102.5 billion, per its October 30 earnings call. Both figures were ahead of Wall Street expectations. ""We are incredibly excited about the ...",https://finnhub.io/api/news?id=85b32c043efbaf949107a876c5e4d6b1fedfb7924bbf64988ceb51a074959517,Yahoo,company
AAPL,2025-11-25 22:26:09+00:00,Google is Winning the AI Race by Stealing Exxon's Business Model. Here's How.,"Alphabet is transforming into the ‘Big Oil’ of AI, and GOOGL stock is crushing its competition in the process.",https://finnhub.io/api/news?id=ce319e27a7968def6eb3f6e70af29629bcb1e9d154cef67df0c9fddeb9c5ce43,Yahoo,company
AAPL,2025-11-25 19:20:00+00:00,FPA Queens Road Small Cap Value Fund Q3 Top Contributors And Detractors,FPA Queens Road Small Cap Value Fund Q3 update: Click here to read who the top detractors and contributors are.,https://finnhub.io/api/news?id=ef170e235b8aa0c82e58c707ab4168ed942b1b338c607b11fcd8e2def76a5aeb,SeekingAlpha,company
AAPL,2025-11-25 18:39:34+00:00,"Cramer says Nvidia selloff is overdone and driven by fear, not fundamentals","Jim Cramer says the Nvidia selloff is driven by fear, not fundamentals, and argues investors should stick with AI leaders despite Alphabet’s chip shift.",https://finnhub.io/api/news?id=b1210840dcd867fcc6d3f7990a8b059ff6679ea0c428ae12f744580d17402915,CNBC,company
AAPL,2025-11-25 18:22:10+00:00,IBD Stock Of The Day: Berkshire Hathaway Jumps Into The AI Boom,Berkshire Hathaway disclosed a major investment in Alphabet earlier this month. Its stock is now close to a new buy point.,https://finnhub.io/api/news?id=65e93fc83cfe11805cf9b8da16a2d8c417884ff913c4c440f7f4afdab6b5b51b,Yahoo,company
AAPL,2025-11-25 17:56:04+00:00,Apple (AAPL) Stock Rises 2% -- Breaks New Record Levels,"Apple Touches Fresh Peak, Market Cap Nears $4.1 Trillion",https://finnhub.io/api/news?id=63e002dfa422f0dc6cd3b01289f2fc055b052a29bb93d3e2a86cdbdf6664ce3e,Yahoo,company
AAPL,2025-11-25 17:27:34+00:00,"Ranking the Best ""Magnificent Seven"" Stocks to Buy for 2026. Here's My No. 5 Pick.","Amazon is one way to invest in cloud computing and AI infrastructure, but the business is far from perfect.",https://finnhub.io/api/news?id=0c6402b719884dc2031fcd9205ae3df7ad0de59dd494e73859da908250d9baee,Yahoo,company
AAPL,2025-11-25 16:40:09+00:00,"This Morning, Wall Street is Bullish on AMAT, NVDA and AAPL","UBS is bullish on Applied Materials (NASDAQ: AMAT). Just this morning, the firm upgraded AMAT to a buy rating with a price target of $285. They pointed to a far more bullish outlook for wafer fab equipment over the next two years. Rising demand for memory means that [analyst Timothy] Arcuri now expects WFE to ... This Morning, Wall Street is Bullish on AMAT, NVDA and AAPL",https://finnhub.io/api/news?id=9abf109a2e6f0913bb9113a4e9fa297561d4bdf6aa5dbd8d312ffa50a77540be,Yahoo,company
AAPL,2025-11-25 16:30:02+00:00,A third high-profile tech leader is leaving GM as part of a software-product restructuring ,"GM is combining its vehicle software engineering and global product units under one organization, led by new Chief Product Officer Sterling Anderson.",https://finnhub.io/api/news?id=fc7b7b06717b03e5f0cf5f1b22948a68ef3f519e26523b491497191569024e4c,CNBC,company
AAPL,2025-11-25 16:21:27+00:00,Here's how Canada can go 'elbows up' and start winning the intellectual property war,Louis Carbonneau: Measures in this month's federal budget not nearly strong enough to protect Canadian IP for long run economic growth,https://finnhub.io/api/news?id=72e3d7671d7a7d669793a92005da1f30fd22cc69c8f8c59fabf092d31d6e5f5a,Yahoo,company
AAPL,2025-11-25 16:16:26+00:00,Retailers' pricing tactics are under the spotlight - here's what you should know,The CMA is investigating eight companies to see whether they are complying with price transparency rules.,https://finnhub.io/api/news?id=5aabef629465bdaddeedc30d4859185045dbdb9d798f091ff92172774a2affd1,Yahoo,company
AAPL,2025-11-25 15:24:00+00:00,Disney vs. Apple: Which Media-Tech Giant Has Better Upside Potential?,"DIS' streaming turnaround, rising Experiences income and bold ESPN push set up a compelling contrast with AAPL's ecosystem-driven momentum.",https://finnhub.io/api/news?id=1f3838557f7e3a920089ea9443c9f3b272c60c6589470e4a4731a8698ec923be,Yahoo,company
AAPL,2025-11-25 14:47:08+00:00,Opinion: Apple Has a Good Shot to Outperform as the AI Boom Runs Out of Steam,"Apple (NASDAQ:AAPL) got off to a rough start to the year, as skeptics slammed the iPhone maker for a lack of an AI strategy. Things have changed in a big way since Apple’s stock bottomed out in the midst of the post-Liberation Day selling across markets. Since then, shares of Apple have gained more than ... Opinion: Apple Has a Good Shot to Outperform as the AI Boom Runs Out of Steam",https://finnhub.io/api/news?id=c9277fb46c7de96b90f26abe943054550fcec79570da8159cf0e27ff13c7bb8f,Yahoo,company
AAPL,2025-11-25 14:30:00+00:00,23.6% of Berkshire Hathaway's Portfolio Is Invested in These 3 Artificial Intelligence (AI) Stocks. Which One Is the Best?,Warren Buffett made an unexpected new investment in one of the biggest AI stocks.,https://finnhub.io/api/news?id=3f33b3c7f12342d0d8b292d2ec468dbd2594952431a741acca4e82c00b3a3dcd,Yahoo,company
AAPL,2025-11-25 14:10:36+00:00,Equinix Taps AI Leadership for Digital Innovation Might Change The Case For Investing In EQIX,"On November 13, 2025, Equinix appointed Yang Song, Ph.D., as Senior Vice President and Chief Data Science and AI Officer, reporting to Harmeen Mehta and tasked with leading the company's global data science and AI initiatives. Song’s track record of building high-performing AI organizations at Apple and IBM Research signals Equinix's intent to embed AI-driven intelligence across its platforms and operations. We'll explore how Song’s mandate to drive AI innovation could influence Equinix's...",https://finnhub.io/api/news?id=7fa67722d82aff6d17d148d2a24fb29325e9461194ec9fa8b2ee42423a0a38de,Yahoo,company
AAPL,2025-11-25 14:05:00+00:00,T-Mobile Unwraps the Ultimate Apple Bundle — All on Us for Black Friday,"BELLEVUE, Wash., November 25, 2025--T-Mobile (NASDAQ: TMUS) is taking Black Friday to the next level, offering nearly $2000 in savings with an Apple Bundle and even more ways to save this season. Starting tomorrow, Nov. 26, new and existing customers, including businesses, can score the brand-new iPhone 17 Pro, iPad (A16) and Apple Watch SE 3, all on Us. Plus, for a limited time, new T-Mobile 5G Home Internet customers can get a month on Us and receive $300 back via virtual prepaid Mastercard wh",https://finnhub.io/api/news?id=6769e70d72fac26b6cbf7207df5338ea93348e1fa1eb6f3c8b21aaf0ae890346,Yahoo,company
AAPL,2025-11-25 14:00:03+00:00,Is Trending Stock Apple Inc. (AAPL) a Buy Now?,"Apple (AAPL) has been one of the stocks most watched by Zacks.com users lately. So, it is worth exploring what lies ahead for the stock.",https://finnhub.io/api/news?id=77cb735796682cc072adc4b011ce67c3c6a444a896863c85b49ba66a7ed00330,Yahoo,company
AAPL,2025-11-25 14:00:00+00:00,"Zip Accelerates Canadian Expansion with New Toronto Office, Plans to Nearly Triple Local Workforce","TORONTO & SAN FRANCISCO, November 25, 2025--Zip Accelerates Canadian Expansion with New Toronto Office, Plans to Nearly Triple Local Workforce",https://finnhub.io/api/news?id=92199dca222b30fb9824e9f77dc2f4c26f877b3a27266d882946906207002863,Yahoo,company
AAPL,2025-11-25 14:00:00+00:00,AI Spending War And AI Debt Pile-Up Could Squeeze Share Buybacks,One of the big drivers of the surge of stock prices over the past many years has been the prodigious amount of corporate cash spent on share buybacks by Big...,https://finnhub.io/api/news?id=ec9dc9ff7d64be556c3d90ac16e393dc258d849cc9db4cf12f4dd65483e4f054,SeekingAlpha,company
AAPL,2025-11-25 13:46:04+00:00,Trump's $21 Trillion Boom: Hype or Historic Windfall?,"A tidal wave of trillion-dollar pledges, AI hype, and sovereign deals--how much is real, and who's cashing in?",https://finnhub.io/api/news?id=f65d89586203d308125a602a464d5116326a77582b1f695b5c129f13a2a620ff,Yahoo,company
AAPL,2025-11-25 13:39:14+00:00,Bitcoin Gets Kicked Out of the $2 Trillion Club. Here's Why This Top Bitcoin ETF Is a Buy Anyway.,Some investors may prefer to buy Bitcoin through a brokerage account rather than using cryptocurrency apps.,https://finnhub.io/api/news?id=7e12dcf1fb67200437bd7e9ee1ecb8859d339c430ad37d65150129faabe50451,Yahoo,company
AAPL,2025-11-25 13:27:48+00:00,Finance experts answer your pre-budget questions,"Ahead of the autumn budget, we asked readers what questions they wanted answered by finance experts.",https://finnhub.io/api/news?id=24e82c9957322730534792e5430be34d4abc9e3ea7011b1b2e6f0961b7a73b2b,Yahoo,company
AAPL,2025-11-25 13:25:30+00:00,Wedbush’s Ives lists top 10 tech stocks to own into year-end,"Investing.com -- Wedbush is doubling down on its bullish outlook for the technology sector, arguing that despite rising “AI Bubble” chatter, the market is still in the early stages of a multi-year investment cycle.",https://finnhub.io/api/news?id=dced410492a89badcb37f813140f998f343e5c7b66a19d3aa3bb67a06aff14d9,Yahoo,company
AAPL,2025-11-25 13:23:50+00:00,Update: Apple Probed by Poland Antitrust Authority Over Ad-Tracking Policy,(Updates throughout with statement from UOKiK.) Apple (AAPL) faces an investigation by Poland's a,https://finnhub.io/api/news?id=56c84a3dade7bdc768b455339ff770cd21aa4e9c1ef6155b87a6fb56b7cc9b52,Yahoo,company
