ticker,datetime,title,summary,url,source,category
NVDA,2025-11-25 08:55:36+00:00,Michael Burry's next 'Big Short': An inside look at his analysis showing AI is a bubble,"The investment world is ""expecting far more economic importance out of this technology than is likely to be provided,"" Burry's associate portfolio manager said.",https://finnhub.io/api/news?id=13e0a4298c7f049a9dae50948ce462c8ea4255e24ed97fa8b2a818aa08157c80,CNBC,company
NVDA,2025-11-25 08:02:00+00:00,"Prediction: This Unstoppable Stock Will Soar to $20 Trillion by 2030, According to a Certain Wall Street Analyst","Despite the current narrative, one bullish Wall Street analyst just doubled their price target on the stock market darling.",https://finnhub.io/api/news?id=d051248132000059eeafae50e0706ba9c34f1df1c578020c7af1dbd24acbaea6,Yahoo,company
NVDA,2025-11-25 01:49:33+00:00,This Artificial Intelligence (AI) and Robotics Stock Has Crushed Nvidia and Palantir This Year. It Can Still Soar Higher.,Investors are looking beyond the biggest names in artificial intelligence (AI) for future growth. This company might be worth a look.,https://finnhub.io/api/news?id=7d285b4f906f429fbc5a375941e3dcd4b24941ea7949ea3b080a3fb542300afe,Yahoo,company
NVDA,2025-11-25 01:00:00+00:00,Where Will Micron Stock Be in 3 Years?,The company remains an affordable way to bet on artificial intelligence (AI).,https://finnhub.io/api/news?id=21ce0678523c4debd5be87b48d8c240c1fa117aff0321822809383a4d35dd11a,Yahoo,company
NVDA,2025-11-24 23:07:49+00:00,Mysterious trader bets millions ahead of Trump's 4PM executive order,A mysterious crypto trader has gone long on two popular cryptocurrencies ahead of President Donald Trump's executive order today. Trump is expected to sign an executive order regarding state regulations on artificial intelligence (A) at 4:00 PM EST on Nov. 24. AI and crypto are among Trump's ...,https://finnhub.io/api/news?id=4dd55bd95dd7460b609562fd1842b90e4688dca665047acd348e3b4a00e3ec2d,Yahoo,company
NVDA,2025-11-24 21:58:43+00:00,Trump Signs ‘Genesis Mission’ Order to Boost Innovation With AI,"The effort aims to better coordinate research done by agencies across the government and more effectively integrate AI tools to achieve more scientific breakthroughs, according to Michael Kratsios, the director of the White House Office of Science and Technology Policy, who spoke to reporters on the order ahead of Trump’s signature.  The mission will harness the computing resources of the Department of Energy’s national labs to tap federal datasets and enable more experiments utilizing AI, Kratsios added, predicting the effort would help shorten the timelines for scientific discoveries.",https://finnhub.io/api/news?id=a7773b695e75bef35d66fc8da130c7e7a9b728b618c7b4fc092f6a3f15fb8c3b,Yahoo,company
NVDA,2025-11-24 21:51:00+00:00,"Doubts remain over AI monetization, market expert says","STORY: Sissel says investors are “looking for clarity” as uncertainty around China and Nvidia’s sales weighs on markets.She noted that “most of the revenue that Nvidia was able to achieve was with very little input from Chinese customers,” highlighting the market’s importance.Despite these concerns, Sissel pointed to a historical pattern, noting a “rough November, especially with the Nasdaq,” is “almost always followed by a very strong December.”",https://finnhub.io/api/news?id=41cc3b70bd040f598cc4a1bdac29d4f7e445b4d7d91793a4d2c68af2a8cac673,Yahoo,company
NVDA,2025-11-24 21:47:14+00:00,Investors fearful of AI bubble burst are missing out: Strategist,"Hennion & Walsh CIO Kevin Mahn doesn't believe the AI bubble is anywhere near bursting. Speaking with Josh Lipton on Market Domination Overtime, Mahn explains certain risk factors that could hinder the longevity of the current bull market while outlining why he agrees with Nvidia (NVDA) CEO Jensen Huang's outlook on the potential of the artificial intelligence industry. To watch more expert insights and analysis on the latest market action, check out more Market Domination Overtime.",https://finnhub.io/api/news?id=73cf182361a978b0e7874eb12c288b227e3a720e39b0a605020c7ba44b126318,Yahoo,company
NVDA,2025-11-24 21:44:30+00:00,US Equity Indexes Surge as Doubling Fed Rate-Cut Probability Boosts Risk Sentiment,US equity indexes surged on Monday as the odds of an interest-rate cut in December doubled from a we,https://finnhub.io/api/news?id=62ac325181ff667d70c3fc6a81174f2fcc60d401fa777dbc4beb5caaa4b06f34,Yahoo,company
NVDA,2025-11-24 21:44:00+00:00,Why Google’s AI Wins Are Bad News for Nvidia Stock and the AI Trade,"A whizzy new chatbot, powered by artificial intelligence, has tech stocks jockeying for leadership of a volatile market amid new concerns over demand for  Nvidia  chips, the product behind Wall Street’s hottest stock.  It applies equally well to what is happening Monday following the launch of  Alphabet  new Gemini 3.  The company, whose stock is by far the best-performing member of the so-called Magnificent Seven so far this year, unveiled the latest version of its chatbot last week.",https://finnhub.io/api/news?id=2f1df99b2c21e0caccf1831c76e4a7aed1630526ce4ce3ee2886a5231dad0ac5,Yahoo,company
NVDA,2025-11-24 21:17:00+00:00,The Stock Market Needs December Magic to Keep Tech Rebound on Track,"“A short-term pullback in the broader U.S. equity market has been long overdue for a number of reasons, in our opinion, despite our constructive view on the year ahead,” said Lori Calvasina, head of U.S. equity strategy at RBC Capital Markets.  “Investors are questioning whether financial markets have run too far too fast and whether too much risk has been taken on” since this year’s rally began in early April, she added.  “The S&P 500 is back on a slower track than the fast track it was on from April 9 until the end of October,” said Ed Yardeni, president and chief investment strategist at Yardeni Research.",https://finnhub.io/api/news?id=5043334f463b654e375f92b5ea0e5a492ba0325a0421897c8a0ce83a6e174451,Yahoo,company
NVDA,2025-11-24 20:02:52+00:00,Citi Wealth Head Sees Upside to Bull Market on Record Inflows,"Last week, Citi announced plans to fold its retail bank into the wealth business, creating a single group.",https://finnhub.io/api/news?id=d4c26c2db88a37babf846da2e5e9bc2c4a26fcf6c7ead9aee2b92cb0c519d64f,Yahoo,company
NVDA,2025-11-24 19:42:57+00:00,Crude Oil Moves Higher as Risk Appetite Returns,Oil traded higher on Monday following three losing sessions as traders regained their appetite for r,https://finnhub.io/api/news?id=4326362af0425ff98af050c36d6c98f56e16d8c9d315248e8dae18a4c9ede882,Yahoo,company
NVDA,2025-11-24 18:57:42+00:00,Trump Holds Nvidia's Fate in His Hands: China Chip Ban Could Crack,A single decision from Trump could unlock--or shut--the gates to Nvidia's multibillion-dollar AI chip market in China.,https://finnhub.io/api/news?id=d2c87171a8bca45b2df814225f96b58dd3870b22eed610f574bdd5a0ab3adbd7,Yahoo,company
NVDA,2025-11-24 18:10:21+00:00,Revolut Achieves $75 Billion Valuation After Major Share Sale,"Revolut completed a significant fundraising round, valuing it at $75 billion as it advances its strategy to become a global digital bank. Revolut’s latest fundraising round, involving a large secondary share sale, has positioned the company among the highest-valued private fintech firms. Investors, including Coatue, Greenoaks, Dragoneer, and Fidelity Management ...",https://finnhub.io/api/news?id=a10f305a7e36ff9e4ca9216954ddcf6236c860416e901993af8e312830c569a4,Yahoo,company
NVDA,2025-11-24 17:40:49+00:00,Why Are Tesla (TSLA) Shares Soaring Today,"Shares of electric vehicle pioneer Tesla (NASDAQ:TSLA) jumped 6.9% in the afternoon session after CEO Elon Musk posted on his social media platform, X, that the company plans to build its own AI chips in higher volumes than all other AI chip makers combined.",https://finnhub.io/api/news?id=5780fcde469bbc6733cf83c3208b80b96b4246c350fcae41e41415cbf584b88c,Yahoo,company
NVDA,2025-11-24 17:40:39+00:00,"Broadcom (AVGO) Shares Skyrocket, What You Need To Know","Shares of fabless chip and software maker Broadcom (NASDAQ:AVGO) jumped 9% in the afternoon session after reports highlighted how Alphabet is using Tensor Processing Units (TPUs) co-designed and supplied by Broadcom, to outperform rivals following the release of its Gemini 3 artificial intelligence (AI) model.",https://finnhub.io/api/news?id=de834ae3916fcf7360eaa82fd36b607173ab781600c75200cc184e8876bfa3a4,Yahoo,company
NVDA,2025-11-24 17:35:02+00:00,Elon Musk Says Tesla Targets AI Chip Dominance,CEO touts yearly designs and higher volumes than rivals,https://finnhub.io/api/news?id=ba7e2c674f552b58370e30807eee40849e30bef9c77991e69f91f52215131bf9,Yahoo,company
NVDA,2025-11-24 17:18:53+00:00,Why the Selloff in Micron Technology Stock Never Made Sense,"Micron Technology (NASDAQ:MU) shares soared to an all-time high of $260 earlier this month, riding the wave of AI-driven optimism in the semiconductor sector. But like most chip and tech stocks, the memory chip maker has trended lower since, caught in broader market jitters over AI hype fears. Last week, the selloff intensified, with Micron ... Why the Selloff in Micron Technology Stock Never Made Sense",https://finnhub.io/api/news?id=34e56e7d5cc017aaf9af658f784c3946198ea483ffe59e4da781473fc6b93a86,Yahoo,company
NVDA,2025-11-24 17:10:48+00:00,CoreWeave: Where The AI And Private Credit Bubbles Collide,Discover why CoreWeave's soaring AI cloud revenues aren't boosting profits and how its future hinges on capital markets.,https://finnhub.io/api/news?id=be269169d7519df00ba1ebb477f3389b6f2b467410b0dcfc6930a8a4e33217ef,SeekingAlpha,company
NVDA,2025-11-24 17:08:50+00:00,"As AI Stocks Like Nvidia Get Tarnished, This Gem Looks To Shine","As AI-fueled tech stocks like Nvidia and Palantir wobble, Kinross Gold joins a cadre of gold stocks showing strength.",https://finnhub.io/api/news?id=f968e52c20a29da8c158726d53c2aec738adcb06a75eb4f96bfd03c99d736ed0,Yahoo,company
NVDA,2025-11-24 17:06:34+00:00,Neobank Revolut Boosts Valuation to $75 Billion Ahead of Potential Stablecoin Launch,Revolut’s share sale attracted investors like Fidelity and Franklin Templeton as the neobank continues expanding its crypto offerings.,https://finnhub.io/api/news?id=7684d17848c10a971052da59f01b7a49e83ac0267378474af1f2b1f9d6defbdf,Yahoo,company
NVDA,2025-11-24 17:03:00+00:00,"Nvidia Stock Rises. The Tech Rally, China News, and More Propelling Shares Higher.","Nvidia  stock found its direction on Monday, eventually joining the  in rallying.  First, the White House is considering letting Nvidia sell more of its chips to China, according to two reports at the end of last week from Reuters and Bloomberg, both of which cited anonymous sources.  The Trump administration could allow Nvidia to sell its H200 AI chip to China, according to the reports, as the U.S. Department of Commerce reviews its policy banning such high-end chip sales to the country.",https://finnhub.io/api/news?id=e4c217a106a1131607d1d53a4a36b6c6a167cc450459a51ef54206167ac1427f,Yahoo,company
NVDA,2025-11-24 17:00:23+00:00,Elfun Trusts Significantly Reduces Stake in Broadcom Inc by 60.7%,"Exploring Elfun Trusts (Trades, Portfolio)' Strategic Moves in Q3 2025",https://finnhub.io/api/news?id=c6bc2b63a0bd044341d599f8e390225fa0b538c1ba4aa09c5b780110cb076322,Yahoo,company
NVDA,2025-11-24 16:51:13+00:00,"Wall Street's Wildest Gamble Is Back: SPACs, Crypto Hoards, and the Quantum Gold Rush",A Covid-era craze roars into 2025 as investors chase Bitcoin treasuries and Trump-fueled tech dreams.,https://finnhub.io/api/news?id=156b04be786dc22bec6e129cd5b7a07faf1a8dd29eb5765a7c9eb19d17a243ee,Yahoo,company
NVDA,2025-11-24 16:20:20+00:00,"Why the Market Loved Walmart’s Earnings, But Not Nvidia’s","Earnings reports can swing fortunes overnight, and we saw a study in contrasts last week Nvidia (NASDAQ:NVDA) unveiled its third-quarter fiscal 2026 results last Wednesday after the market closed, posting record revenue of $57 billion — a 22% jump from the prior quarter and 62% year-over-year surge, fueled by unrelenting AI chip demand. Yet, despite ... Why the Market Loved Walmart’s Earnings, But Not Nvidia’s",https://finnhub.io/api/news?id=48d9f0200386630ebc0041c533bebaaaba46260908b9be92d190dec699513399,Yahoo,company
NVDA,2025-11-24 13:47:41+00:00,EOS: Sell-Off Presents A Widening Discount Opportunity,Eaton Vance Enhanced Equity Income II offers an attractive entry point with income and growth. Click to learn more about EOS' key risks and opportunities.,https://finnhub.io/api/news?id=b4c818e4cfb56169a91ad9dd8df49ab7b5cb9ab70823ea8379ea8ce29b11161a,SeekingAlpha,company
NVDA,2025-11-24 13:33:48+00:00,Tesla Declares War on AI Chip Giants -- Elon Musk Vows Yearly Breakthroughs,Elon Musk's Bold AI Gamble: Tesla Aims to Outproduce All Rivals Combined,https://finnhub.io/api/news?id=baeccbff94dbc11adc117cea2322ca46483f17248067cc51e4097d0248bc9d75,Yahoo,company
NVDA,2025-11-24 13:10:38+00:00,"Palantir Stock: More Insider Selling, Technical Outlook Sags. Is PLTR Stock A Buy Or Sell?",Palantir stock has dropped below its 21-day and 50-day moving averages amid a pull back in many artificial intelligence stocks.,https://finnhub.io/api/news?id=9aab792ee0d5f92cafa83429a78aefd57665faadecbd42fb8479f1fb8730e55f,Yahoo,company
NVDA,2025-11-24 13:09:00+00:00,Why Micron and SK Hynix Could Quietly Become the Real AI Winners,Investing in digital memory companies could be a smart way to profit from the next AI wave.,https://finnhub.io/api/news?id=11032b837f7310e6356474b5b7cabdb1f999d6475194e4176829dbdefc36034c,Yahoo,company
NVDA,2025-11-24 13:03:16+00:00,"Crucial Black Friday, AI bubble worries and Fed rate cut hopes","Last week earnings results from retailers were mixed with Walmart (WMT) being a winner and Home Depot (HD) a loser. Russ Mould from AJ Bell believes that's why this Black Friday will be scrutinised even more closely. He also believes that despite Friday's bounce on Wall Street AI bubble fears haven't gone away but that rising hopes for an interest rate cut are justified. For more live coverage of the markets, watch the full episode of Market Sunrise and visit Yahoo Finance.",https://finnhub.io/api/news?id=7b5d24fa4021d0a22f35bbcf5108e64e63e9e92b6a4d7398d7f7b739d9f0bfa5,Yahoo,company
NVDA,2025-11-24 12:54:27+00:00,"Nvidia chip sales to China among key decisions for Trump, says Lutnick","Investing.com -- U.S. Commerce Secretary Howard Lutnick indicated that President Donald Trump will personally decide whether to allow Nvidia to sell its advanced H200 chips to China, as trade negotiations between the United States and European Union continue in Brussels.",https://finnhub.io/api/news?id=5dad14c641d6808e5ea4bcbc5f41dee3b4c7e2cc8dd30c4e60884f5f5d327898,Yahoo,company
NVDA,2025-11-24 12:44:46+00:00,"Trump to Decide on Nvidia H200 Chips to China, Lutnick Says","Commerce Secretary Howard Lutnick says the decision to authorize sales of Nvidia's H200 artificial intelligence chips to China is on President Donald Trump's desk. Lutnick also discusses the national security issues of selling chips to China on ""Bloomberg Surveillance.""",https://finnhub.io/api/news?id=56e5323207f7f9d1ef051eae80f90b122579aaa33698749d491955e2ce5da316,Yahoo,company
NVDA,2025-11-24 12:30:00+00:00,This Is the Best AI Stock to Buy as Spending Shifts Toward Hardware,Nvidia should continue to benefit from its early AI lead for years to come.,https://finnhub.io/api/news?id=08c98f920f0815fab765e127ada62a076ff5cf3c6173d7a3ad00797e3ef44333,Yahoo,company
NVDA,2025-11-24 12:09:00+00:00,"France Data Center Colocation Analysis Report 2025: Market to Expand by Almost $2.5 Billion by 2030, Driven by AI Demand, Sustainability, Cloud Connectivity, Enhanced Submarine Cable Infrastructure","The France Data Center Colocation Market is set to grow from USD 1.09 billion in 2024 to USD 3.57 billion by 2030, boasting a CAGR of 21.86%. This expansion is driven by increased investments, such as Equinix's USD 361 million PA13x facility in Paris. The focus is on AI-ready data centers, exemplified by a joint venture between Bpifrance, MGX, Mistral AI, and NVIDIA, planning a 1,400 MW campus. Market insights cover colocation supply, demand, revenue, and trends. The report also includes a compe",https://finnhub.io/api/news?id=f1d36faed6c1473076d09e477ca3319726eb7fef74038f1cf03a62b33a9b23ed,Yahoo,company
NVDA,2025-11-24 11:50:35+00:00,"US Equity Investors to Watch Out for Evolving Fed Policy Outlook, Greenlight to Nvidia's China Chip Sales",US equity investors will focus on the impact of incoming economic data on monetary policy expectatio,https://finnhub.io/api/news?id=9378a7531ceb09e1a4105861df72905806281847306d70c03c5ec0095bbc98bb,Yahoo,company
NVDA,2025-11-24 11:50:29+00:00,Nvidia: Here Is Why I Am Upgrading To Strong Buy,Nvidia Corporation upgraded to Strong Buy as AI-driven data center demand fuels 35% upside. Click for my NVDA earnings update.,https://finnhub.io/api/news?id=745aed66b9637ff34e9ed63f740c23ad65f875af5f60559c53d112e7b78b551d,SeekingAlpha,company
NVDA,2025-11-24 11:45:00+00:00,"Billionaire Philippe Laffont Is Selling CoreWeave, Tesla, and Nvidia and Piling Into 2 Recent IPOs",Philippe Laffont is renowned for being an early investor in several of the world's most disruptive and prominent tech giants.,https://finnhub.io/api/news?id=5d1034c8ebe7ef1fdb7768fe014f677dc9a796147260fd3679b42063d186fecd,Yahoo,company
NVDA,2025-11-24 11:43:00+00:00,Wall Street Needs Some Magic in December to Reignite Tired Tech Rally,"“A short-term pullback in the broader U.S. equity market has been long overdue for a number of reasons, in our opinion, despite our constructive view on the year ahead,” said Lori Calvasina, head of U.S. equity strategy at RBC Capital Markets.  “Investors are questioning whether financial markets have run too far too fast and whether too much risk has been taken on” since this year’s rally began in early April, she added.  “The S&P 500 is back on a slower track than the fast track it was on from April 9 until the end of October,” said Ed Yardeni, president and chief investment strategist at Yardeni Research.",https://finnhub.io/api/news?id=07807bd1f60839440dc2762fa6fd6f79092b0c79b273728c51a414ffe447e3fc,Yahoo,company
NVDA,2025-11-24 11:41:24+00:00,"Top Semiconductor Stocks. Nvidia, AMD, Intel Poised for AI Growth",AI Spending Frenzy Sparks Chip Rally -- Nvidia Retains Core Investor Spot,https://finnhub.io/api/news?id=3db05851fcaaacec856769e3098733f1ed894d15b5bf1e0def1e91a8e0c3a392,Yahoo,company
NVDA,2025-11-24 11:38:06+00:00,High Growth Tech Stocks In The US For November 2025,"The U.S. stock market has recently experienced significant volatility, with major indices like the Nasdaq and S&P 500 posting substantial losses despite strong earnings reports from companies like Nvidia. This turbulent environment highlights the importance of identifying high-growth tech stocks that can withstand market fluctuations and capitalize on emerging trends, making them potentially attractive options for investors seeking growth opportunities in an unpredictable landscape.",https://finnhub.io/api/news?id=91a193fe5f673bf25ac807c1c384fe77396299438ecd0113674db51a2a93a981,Yahoo,company
NVDA,2025-11-24 11:37:33+00:00,AI Chips Today - AI Boosts Cancer Drug Discovery Through Innovative Techniques,"Rakovina Therapeutics Inc. has presented promising data at the 2025 Society for Neuro-Oncology Annual Meeting, demonstrating advancements in their AI-derived PARP1 inhibitor program. Utilizing AI methods such as Deep Docking™ and generative AI, the company has been able to effectively screen large chemical libraries, resulting in the discovery of novel, CNS-penetrant, PARP1-selective small molecules. These compounds have undergone biochemical evaluations, with a subset showing favorable...",https://finnhub.io/api/news?id=b082d5b3f87746b6d564bfb7044b033d384b34a64d670d2bb9f587705b36adb6,Yahoo,company
NVDA,2025-11-24 11:21:40+00:00,Chinese chip stocks retreat as U.S. weighs allowing Nvidia to sell H200 processors in China,Report raises competitive concerns for domestic semiconductor makers,https://finnhub.io/api/news?id=c56a17a0d02a1f75bf0589be1a2c83bd04b41c102e31900d5f70352117a3ce36,Yahoo,company
NVDA,2025-11-24 10:04:10+00:00,Michael Burry launches newsletter to lay out his AI bubble views after deregistering hedge fund,"""The Big Short"" investor is capitalizing on the massive audience he's built on X, where 1.6 million followers have long parsed his cryptic posts. ",https://finnhub.io/api/news?id=ad57228d54a09a2cfae78666b0ae032cceb2730644196995564ebad6f5dbeba7,CNBC,company
NVDA,2025-11-24 10:00:48+00:00,Nvidia Earnings Selloff: A Golden Buying Opportunity,"Discover why Nvidia (NVDA) remains a top buy with stellar earnings, AI leadership, and strong growthâsee key price levels and investment tips.",https://finnhub.io/api/news?id=6bb49e9c0ae9b48efc6170a3d8c450932ae69bd123a29af68951e1c81e1add8f,SeekingAlpha,company
NVDA,2025-11-24 03:22:42+00:00,Don't Buy This Dip: It's Black Friday In The Equity Market,"NVDA shows strong results with volatility, liquidity pressure, market softness, rally hopes, and a strategy around the 200-day. Read why SPX is a sell.",https://finnhub.io/api/news?id=afcdff1a73c12737d4f2762342979d89f313b608e3fd26022a219994b2ed82cb,SeekingAlpha,company
NVDA,2025-11-24 03:04:00+00:00,"If You'd Invested $100 in Nvidia 10 Years Ago, Here's How Much You'd Have Today",Nvidia stock has stalled for the time being.,https://finnhub.io/api/news?id=f0d547a8f30a712d938cc5fbcb38cc475912849981aed3b4e6f3dc2a171ce1d3,Yahoo,company
NVDA,2025-11-24 00:10:00+00:00,"Billionaire Stanley Druckenmiller Dropped Nvidia, Palantir, and Eli Lilly Over the Past Year and Just Bought the 2 Cheapest Magnificent Seven Stocks.",These Magnificent Seven players are well-positioned to benefit in the AI boom.,https://finnhub.io/api/news?id=f5544db38a556f356484feaaf9473a85e36ae57ecba36f0963b3971ba551561c,Yahoo,company
NVDA,2025-11-23 21:58:48+00:00,Nvidia: I'm Not Sweating A Drop After This Q3 Meltdown,"Nvidia has $500B Blackwell/Rubin visibility into 2025 and 2026, which is a strong sign that the AI buildout is far from over. Read why NVDA stock is a Strong Buy.",https://finnhub.io/api/news?id=295501a9afe2574e30dfbcee98c2063ad345dbaf1aa9429bb541b238f175d2c4,SeekingAlpha,company
NVDA,2025-11-23 19:51:25+00:00,"Jim Cramer Reiterates “You Need to Own NVIDIA, Not Trade It”","NVIDIA Corporation (NASDAQ:NVDA) is one of the stocks Jim Cramer recently offered insights on. Cramer highlighted the company’s solid set of numbers during the episode. He remarked: “Case in point, the biggest stock in the world, NVIDIA. Last night, NVIDIA reported one of the best quarters I have ever seen. Ahead of the report, there […]",https://finnhub.io/api/news?id=1cd996f2f03a41be21289323c0424014ca516794bed834152e2c8026e6afbc56,Yahoo,company
NVDA,2025-11-23 19:45:00+00:00,Why Nvidia Could Be a Bigger Winner in Quantum Computing Than You Might Think,Nvidia doesn't need to build a quantum computer to make a lot of money in the quantum computing market.,https://finnhub.io/api/news?id=f5b98f3181c226b3047b89ee6a5db7b76a34c05f7b7ec7a509d5221f2fc395cf,Yahoo,company
NVDA,2025-11-23 19:36:16+00:00,"Michael Burry Takes On Nvidia And The AI Boom, Here's Why People Are Loving It","Michael Burry, famous for his accurate prediction of the mid-2000s US housing bubble burst, has once again stirred the pot in the financial world. This time, his bet against Nvidia and his criticism of AI companies have made him a hot topic on social media. What Happened: Burry’s recent actions may have played a role in last week’s stock market dip. The investor, notorious for his ominous crash and recession predictions, recently made a comeback on social media after a two-year break, issuing se",https://finnhub.io/api/news?id=d5d1f22a49a5cb4a2065ac5b7503eaa17581e0e031332a1f8e43659fd2cd5600,Yahoo,company
NVDA,2025-11-23 19:17:00+00:00,Cathie Wood buys the dip in Nvidia-backed stock,"In no time, CoreWeave (CRWV) has become one of the most talked-about names in AI, but the going’s been rough of late. The Nvidia (NVDA)-backed cloud infrastructure business has just slashed its sales outlook, sending its stock into a steep slide and spooking the broader market in the process. For ...",https://finnhub.io/api/news?id=0a7227bb7acefad17faab6acf4e195662e88ba55267f66449a745c62de97879d,Yahoo,company
NVDA,2025-11-23 19:00:00+00:00,"Dell, HP Inc., Alibaba, Zoom, Deere, and More Stocks to Watch This Week","This Thanksgiving week will bring some September economic data, as well as earnings from Best Buy, Smucker, Zscaler, and more.",https://finnhub.io/api/news?id=b27152da1ac9dfe9430045289f658660634997081fa2caf72d4d979f9882c97d,Yahoo,company
NVDA,2025-11-23 18:51:44+00:00,Trump Administration Ponders Allowing Nvidia To Trade H200 AI Chips With China,"President Donald Trump’s administration is reportedly contemplating the possibility of permitting Nvidia Corp. (NASDAQ:NVDA) to trade its H200 artificial intelligence chips with China. What Happened: According to a report, the Trump administration’s internal discussions indicate a significant deviation from its previous stance on semiconductor export controls. However, this potential move remains a subject of debate, with no final decision taken as of yet. The ongoing discussions are being perce",https://finnhub.io/api/news?id=2686ae2c1251d30e86648c03e5b3a20e3221add47f02b53f238c48e83d1e692b,Yahoo,company
NVDA,2025-11-23 18:15:00+00:00,Could Buying Robinhood Stock Today Set You Up for Life?,Robinhood stock has surged 250% over the past year. Can it continue delivering for investors?,https://finnhub.io/api/news?id=5ac7dacb75f1d1889499d8eb74228db4eb1e39ffeed2d8a6a4f08fafd4ca143f,Yahoo,company
